Date,Adj Close,Close,High,Low,Open,Volume,Daily_Return,EMA_7,EMA_21,Ticker,Company,Headlines
2024-01-24,164.0770263671875,170.5,171.00999450683594,168.86000061035156,169.36000061035156,9967100,0.008935399979038694,163.1960216835381,163.6094275537765,JPM,JPMorgan Chase & Co.,"JPMorgan Ultra - Short Income ETF ( NYSEARCA : JPST ) Shares Sold by Schwarz Dygos Wheeler Investment Advisors LLC | Q3 Asset Management Acquires New Shares in ProShares UltraPro S & P 500 ( NYSEARCA : UPRO )  | 50 , 251 Shares in iShares North American Natural Resources ETF ( BATS : IGE ) Purchased by Q3 Asset Management | Winthrop Advisory Group LLC Sells 7 , 770 Shares of JPMorgan Ultra - Short Income ETF ( NYSEARCA : JPST )  | 7 , 312 Shares in FT Vest U . S . Equity Deep Buffer ETF – August ( BATS : DAUG ) Acquired by Q3 Asset Management"
2024-01-25,166.42510986328125,172.94000244140625,172.99000549316406,170.91000366210938,172.30999755859375,8873500,0.01431086086871769,164.0032937284739,163.86539867282238,JPM,JPMorgan Chase & Co.,"Guinness Asset Management LTD Sells 39 , 462 Shares of TPI Composites , Inc . ( NASDAQ : TPIC )  | Wilbanks Smith & Thomas Asset Management LLC Sells 99 Shares of Danaher Co . ( NYSE : DHR )  | LSV Asset Management Reduces Stock Position in Group 1 Automotive , Inc . ( NYSE : GPI )  | Guinness Atkinson Asset Management Inc Sells 1 , 890 Shares of Baidu , Inc . ( NASDAQ : BIDU )  | Guinness Atkinson Asset Management Inc Sells 1 , 890 Shares of Baidu , Inc . ( NASDAQ : BIDU ) "
2024-01-26,165.7899627685547,172.27999877929688,173.05999755859375,171.77999877929688,172.61000061035156,7443000,-0.003816413852743339,164.4499609884941,164.0403590451617,JPM,JPMorgan Chase & Co.,"Nomura Asset Management Co . Ltd . Sells 9 , 067 Shares of LyondellBasell Industries ( NYSE : LYB )  | Nomura Asset Management Co . Ltd . Sells 27 , 673 Shares of FLEETCOR Technologies , Inc . ( NYSE : FLT )  | Infosys Limited ( NYSE : INFY ) Stock Position Lowered by Nomura Asset Management Co . Ltd .  | Infosys Limited ( NYSE : INFY ) Shares Sold by Nomura Asset Management Co . Ltd .  | Nomura Asset Management Co . Ltd . Buys 3 , 210 Shares of CSX Co . ( NASDAQ : CSX ) "
2024-01-29,166.22300720214844,172.72999572753906,172.83999633789062,171.3000030517578,172.24000549316406,6971200,0.0026120063383949788,164.89322254190768,164.23878160488778,JPM,JPMorgan Chase & Co.,"JPMorgan Kolanovic Sees Tech Earnings Testing Rich Valuations | JPMorgan Kolanovic Sees Tech Earnings Testing Rich Valuations | Meta Platforms , Inc . ( NASDAQ : META ) Shares Bought by Global Wealth Management Investment Advisory Inc .  | JPMorgan Active Growth ETF ( NYSEARCA : JGRO ) Shares Sold by Security Financial Services INC .  | Encompass Wealth Advisors LLC Sells 578 Shares of JPMorgan Ultra - Short Municipal ETF ( BATS : JMST ) "
2024-01-30,169.62966918945312,176.27000427246094,176.75999450683594,172.8300018310547,172.8300018310547,10822100,0.020494527470326318,166.07733420379404,164.7288622943937,JPM,JPMorgan Chase & Co.,"JPMorgan Ultra - Short Income ETF ( NYSEARCA : JPST ) Shares Sold by Executive Wealth Management LLC | JPMorgan Ultra - Short Income ETF ( NYSEARCA : JPST ) Shares Sold by Masso Torrence Wealth Management Inc .  | Alpha Omega Group Inc . Sells 377 Shares of JPMorgan Ultra - Short Income ETF ( NYSEARCA : JPST )  | Masso Torrence Wealth Management Inc . Has $5 . 39 Million Stock Holdings in Invesco QQQ ( NASDAQ : QQQ )  | Darwin Wealth Management LLC Sells 9 , 688 Shares of First Trust TCW Opportunistic Fixed Income ETF ( NASDAQ : FIXD ) "
2024-01-31,167.79161071777344,174.36000061035156,178.3000030517578,174.33999633789062,176.1999969482422,11521800,-0.010835713354052645,166.50590333228888,165.0072939692464,JPM,JPMorgan Chase & Co.,"Van Hulzen Asset Management LLC Has $736 , 000 Stock Position in Canadian Natural Resources Limited ( NYSE : CNQ )  | Cornerstone Wealth Management LLC Acquires Shares of 1 , 815 Danaher Co . ( NYSE : DHR )  | Freeport - McMoRan Inc . ( NYSE : FCX ) Shares Purchased by Cornerstone Wealth Management LLC | 7 , 633 Shares in Blackstone Inc . ( NYSE : BX ) Acquired by Community Financial Services Group LLC | Community Financial Services Group LLC Buys Shares of 185 , 501 Pfizer Inc . ( NYSE : PFE ) "
2024-02-01,167.18533325195312,173.72999572753906,174.83999633789062,171.42999267578125,173.63999938964844,9354800,-0.0036132763922271938,166.67576081220494,165.20529754040155,JPM,JPMorgan Chase & Co.,iShares ESG Advanced MSCI united states ETF ( NASDAQ : USXF ) Shares Sold by Keystone Financial Services | RKL Wealth Management LLC Sells 394 Shares of JPMorgan Chase & Co . ( NYSE : JPM )  | JPMorgan Chase & Co . ( NYSE : JPM ) Shares Purchased by MONECO Advisors LLC | Pavion Blue Capital LLC Boosts Stock Holdings in JPMorgan Chase & Co . ( NYSE : JPM )  | Wilbanks Smith & Thomas Asset Management LLC Raises Stock Holdings in JPMorgan Chase & Co . ( NYSE : JPM ) 
2024-02-02,168.14767456054688,174.72999572753906,175.82000732421875,173.25999450683594,173.3000030517578,8607600,0.005756134762990639,167.0437392492904,165.47278636041477,JPM,JPMorgan Chase & Co.,"JPMorgan Chase & Co . ( NYSE : JPM ) Shares Sold by Mawer Investment Management Ltd .  | HBK Sorce Advisory LLC Sells 3 , 201 Shares of JPMorgan Chase & Co . ( NYSE : JPM )  | JPMorgan Chase & Co . ( NYSE : JPM ) Shares Sold by Retirement Systems of Alabama | JPMorgan Chase & Co . ( NYSE : JPM ) Shares Purchased by XML Financial LLC | Clearstead Advisors LLC Buys 1 , 498 Shares of JPMorgan Ultra - Short Income ETF ( NYSEARCA : JPST ) "
2024-02-05,167.9263458251953,174.5,175.08999633789062,172.9199981689453,173.86000061035156,7820200,-0.0013162759219239595,167.26439089326664,165.69583722084937,JPM,JPMorgan Chase & Co.,iShares 0 - 5 Year Investment Grade Corporate Bond ETF ( NASDAQ : SLQD ) Shares Acquired by Greenup Street Wealth Management LLC | JPMorgan Ultra - Short Income ETF ( NYSEARCA : JPST ) Stock Holdings Decreased by Charles Schwab Investment Advisory Inc .  | JPMorgan Ultra - Short Income ETF ( NYSEARCA : JPST ) Stock Holdings Decreased by Charles Schwab Investment Advisory Inc .  | iShares MSCI united states ESG Select ETF ( NYSEARCA : SUSA ) Shares Sold by Greenup Street Wealth Management LLC | Greenup Street Wealth Management LLC Sells 693 Shares of iShares MSCI united states ESG Select ETF ( NYSEARCA : SUSA ) 
2024-02-06,168.50375366210938,175.10000610351562,175.8699951171875,173.75999450683594,174.61000061035156,6764800,0.0034384588914662118,167.57423158547732,165.951102351873,JPM,JPMorgan Chase & Co.,"9258 Wealth Management LLC Has $13 . 01 Million Holdings in iShares Core Total USD Bond Market ETF ( NASDAQ : IUSB )  | 9258 Wealth Management LLC Has $9 . 45 Million Stock Position in iShares 7 - 10 Year Treasury Bond ETF ( NASDAQ : IEF )  | JPMorgan Chase & Co . ( NYSE : JPM ) Shares Purchased by MV Capital Management Inc .  | Waterford Advisors LLC Has $307 , 000 Stock Holdings in JPMorgan Chase & Co . ( NYSE : JPM )  | Pointe Capital Management LLC Has $1 . 85 Million Stock Position in JPMorgan Chase & Co . ( NYSE : JPM ) "
2024-02-07,168.82130432128906,175.42999267578125,175.8699951171875,173.9600067138672,175.69000244140625,7225500,0.0018845316634099607,167.88599976943027,166.2120298036381,JPM,JPMorgan Chase & Co.,"Sequoia Financial Advisors LLC Sells 16 , 944 Shares of JPMorgan Ultra - Short Income ETF ( NYSEARCA : JPST )  | JPMorgan Municipal ETF ( BATS : JMUB ) Shares Sold by Sequoia Financial Advisors LLC | JPMorgan Municipal ETF ( BATS : JMUB ) Shares Sold by Sequoia Financial Advisors LLC | Sowell Financial Services LLC Purchases 1 , 923 Shares of SPDR Dow Jones Global Real Estate ETF ( NYSEARCA : RWO )  | Alphabet Inc . ( NASDAQ : GOOG ) Shares Sold by 9258 Wealth Management LLC"
2024-02-08,168.2150421142578,174.8000030517578,175.30999755859375,173.57000732421875,175.0,6060300,-0.003591147512268078,167.96826035563714,166.39412183187625,JPM,JPMorgan Chase & Co.,"ProVise Management Group LLC Acquires 3 , 610 Shares of JPMorgan Municipal ETF ( BATS : JMUB )  | ProVise Management Group LLC Acquires 3 , 610 Shares of JPMorgan Municipal ETF ( BATS : JMUB )  | Liberty Mutual Group Asset Management Inc . Sells 2 , 416 Shares of Cousins Properties Incorporated ( NYSE : CUZ )  | 3 , 291 Shares in NVIDIA Co . ( NASDAQ : NVDA ) Acquired by Must Asset Management Inc . "
2024-02-09,168.4171142578125,175.00999450683594,175.10000610351562,173.6699981689453,175.0,6296700,0.0012012727340842133,168.080473831181,166.57803023423406,JPM,JPMorgan Chase & Co.,"DB Wealth Management Group LLC Grows Stock Holdings in iShares Core S & P Total U . S . Stock Market ETF ( NYSEARCA : ITOT )  | Costello Asset Management INC Sells 494 Shares of JPMorgan Chase & Co . ( NYSE : JPM )  | Hyundai Motor Is Set to Line Up Citi , JPMorgan for India Unit IPO | JPMorgan Lowers Piedmont Lithium Price Target ; This IPO Is Oversubscribed ; Nexa Reports Results ; Compass Refocuses - Metals Acquisition ( NYSE : MTAL ), Compass Minerals Intl ( NYSE : CMP )  | JP Morgan Chase fined nearly $40 billion , here how and why"
2024-02-12,169.16773986816406,175.7899932861328,176.80999755859375,173.6999969482422,174.77999877929688,8539300,0.004456943783055944,168.35229034042675,166.81345838277315,JPM,JPMorgan Chase & Co.,"JPMorgan Chase & Co . ( NYSE : JPM ) Shares Sold by Texas Permanent School Fund Corp | Burgundy Asset Management Ltd . Sells 462 , 362 Shares of Allison Transmission Holdings , Inc . ( NYSE : ALSN )  | Ross Stores , Inc . ( NASDAQ : ROST ) Shares Sold by Burgundy Asset Management Ltd .  | Taurus Asset Management LLC Sells 1 , 500 Shares of EOG Resources , Inc . ( NYSE : EOG )  | Burgundy Asset Management Ltd . Sells 628 , 770 Shares of News Co . ( NASDAQ : NWSA ) "
2024-02-13,167.6953887939453,174.25999450683594,176.22999572753906,172.6199951171875,175.32000732421875,8397600,-0.008703497932680215,168.1880649538064,166.89363387469788,JPM,JPMorgan Chase & Co.,
2024-02-14,169.39869689941406,176.02999877929688,176.10000610351562,174.4199981689453,175.07000732421875,7056700,0.0101571552904276,168.49072294020831,167.12136687694482,JPM,JPMorgan Chase & Co.,"JPMorgan Chase & Co . ( NYSE : JPM ) Shares Sold by Valley Wealth Managers Inc .  | Greenleaf Trust Has $17 . 69 Million Stock Holdings in JPMorgan Chase & Co . ( NYSE : JPM )  | Atomi Financial Group Inc . Grows Stock Position in JPMorgan Ultra - Short Income ETF ( NYSEARCA : JPST )  | Deseret Mutual Benefit Administrators Purchases Shares of 119 , 880 JPMorgan Ultra - Short Income ETF ( NYSEARCA : JPST )  | Tocqueville Asset Management L . P . Purchases 1 , 352 Shares of Canadian Natural Resources Limited ( NYSE : CNQ ) "
2024-02-15,173.0940399169922,179.8699951171875,180.2100067138672,176.14999389648438,176.14999389648438,8723400,0.02181447133428871,169.64155218440428,167.66433715331277,JPM,JPMorgan Chase & Co.,"JPMorgan Chase Declares Preferred Stock Dividends | Nicolet Bankshares Inc . Sells 8 , 896 Shares of JPMorgan Chase & Co . ( NYSE : JPM )  | Pzena Investment Management LLC Sells 16 , 107 Shares of JPMorgan Chase & Co . ( NYSE : JPM )  | Formidable Asset Management LLC Sells 136 Shares of JPMorgan Chase & Co . ( NYSE : JPM )  | JPMorgan Chase & Co . ( NYSE : JPM ) Stock Position Raised by Nemes Rush Group LLC"
2024-02-16,172.2856903076172,179.02999877929688,179.97999572753906,178.16000366210938,179.61000061035156,8152600,-0.004670002559086672,170.3025867152075,168.08446016734044,JPM,JPMorgan Chase & Co.,"Johnson Investment Counsel Inc . Acquires 10 , 573 Shares of JPMorgan Chase & Co . ( NYSE : JPM )  | Envestnet Asset Management Inc . Reduces Stock Position in Vanguard Total Bond Market ETF ( NASDAQ : BND )  | JPMorgan Chase & Co . ( NYSE : JPM ) Shares Acquired by Aviva PLC | Checchi Capital Advisers LLC Sells 1 , 359 Shares of JPMorgan Chase & Co . ( NYSE : JPM )  | JPMorgan Chase & Co . ( NYSE : JPM ) Stock Position Lessened by Excalibur Management Corp"
2024-02-20,172.95932006835938,179.72999572753906,180.4600067138672,178.41000366210938,179.19000244140625,9668000,0.003909957696076827,170.96677005349545,168.52762924925125,JPM,JPMorgan Chase & Co.,"Longbow Finance SA Sells 390 Shares of JPMorgan Chase & Co . ( NYSE : JPM )  | Healthcare of Ontario Pension Plan Trust Fund Sells 259 , 488 Shares of JPMorgan Chase & Co . ( NYSE : JPM )  | Visionary Wealth Advisors Acquires 56 , 505 Shares of JPMorgan Core Plus Bond ETF ( BATS : JCPB ) "
2024-02-21,174.0852508544922,180.89999389648438,180.99000549316406,178.52000427246094,179.9499969482422,7024000,0.006509801181502128,171.74639025374464,169.03286757700042,JPM,JPMorgan Chase & Co.,"FFT Wealth Management LLC Has $7 . 25 Million Stake in iShares MSCI Emerging Markets ETF ( NYSEARCA : EEM )  | FFT Wealth Management LLC Has $7 . 25 Million Stake in iShares MSCI Emerging Markets ETF ( NYSEARCA : EEM )  | Retirement Planning Co of New England Inc . Buys 6 , 687 Shares of JPMorgan Chase & Co . ( NYSE : JPM )  | Capital One - Discover Merger Could Shake Up Credit Card Market , Dethrone JPMorgan | River & Mercantile Asset Management LLP Lowers Stock Holdings in Noah Holdings Limited ( NYSE : NOAH ) "
2024-02-22,176.1735076904297,183.07000732421875,183.4199981689453,181.24000549316406,181.82000732421875,9296500,0.011995598855660372,172.8531696129159,169.68201667822123,JPM,JPMorgan Chase & Co.,"Cary Street Partners Investment Advisory LLC Buys 35 , 318 Shares of JPMorgan Chase & Co . ( NYSE : JPM )  | The US is heading towards stagflation , which would be terrible news for stocks , JPMorgan says | Stifel Financial Corp Grows Stock Holdings in JPMorgan Chase & Co . ( NYSE : JPM )  | Socorro Asset Management LP Purchases 5 , 402 Shares of Air Products and Chemicals , Inc . ( NYSE : APD )  | Eagle Asset Management Inc . Acquires 68 , 112 Shares of Prologis , Inc . ( NYSE : PLD ) "
2024-02-23,177.058837890625,183.99000549316406,185.1999969482422,183.19000244140625,183.80999755859375,7105800,0.00502533106028058,173.90458668234317,170.35263678843975,JPM,JPMorgan Chase & Co.,"Prudential Financial , Inc . ( NYSE : PRU ) Stock Holdings Lifted by EPG Wealth Management LLC | Fuller & Thaler Asset Management Inc . Has $5 . 11 Million Stock Holdings in Verisk Analytics , Inc . ( NASDAQ : VRSK )  | EPG Wealth Management LLC Has $255 , 000 Stock Holdings in Prudential Financial , Inc . ( NYSE : PRU )  | Fuller & Thaler Asset Management Inc . Boosts Stock Position in Union Pacific Co . ( NYSE : UNP )  | BlackRock , Inc . ( NYSE : BLK ) Shares Purchased by Meiji Yasuda Asset Management Co Ltd . "
2024-02-26,176.4525909423828,183.36000061035156,184.4600067138672,182.47999572753906,183.75,7145400,-0.0034239858086987374,174.54158774735308,170.90717807516185,JPM,JPMorgan Chase & Co.,iShares 7 - 10 Year Treasury Bond ETF ( NASDAQ : IEF ) Shares Sold by Milestone Asset Management LLC | Truvestments Capital LLC Purchases 106 Shares of JPMorgan Chase & Co . ( NYSE : JPM )  | Synovus Financial Corp Reduces Stock Position in JPMorgan Chase & Co . ( NYSE : JPM )  | JPMorgan Chase & Co . Alerian ML to Issue Annual Dividend of $0 . 42 ( NYSEARCA : AMJB )  | Trustmark National Bank Trust Department Increases Stock Position in JPMorgan Chase & Co . ( NYSE : JPM ) 
2024-02-27,176.53916931152344,183.4499969482422,183.5399932861328,182.24000549316406,183.30999755859375,5717100,0.0004906607983381495,175.04098313839566,171.41917727846746,JPM,JPMorgan Chase & Co.,"Morningstar Investment Services LLC Sells 5 , 027 Shares of JPMorgan Chase & Co . ( NYSE : JPM )  | Morningstar Investment Services LLC Sells 5 , 027 Shares of JPMorgan Chase & Co . ( NYSE : JPM )  | Morningstar Investment Services LLC Sells 5 , 027 Shares of JPMorgan Chase & Co . ( NYSE : JPM )  | JPMorgan Chase & Co . ( NYSE : JPM ) Shares Sold by Shoker Investment Counsel Inc .  | Sand Hill Global Advisors LLC Trims Stock Holdings in JPMorgan Chase & Co . ( NYSE : JPM ) "
2024-02-28,177.4341583251953,184.3800048828125,185.1999969482422,182.9600067138672,183.42999267578125,6131600,0.005069634218639374,175.63927693509558,171.9659937372609,JPM,JPMorgan Chase & Co.,"MBB Public Markets I LLC Sells 64 , 165 Shares of JPMorgan Chase & Co . ( NYSE : JPM )  | SEC filing says JP Morgan CEO Dimon sold nearly $150 million shares | SEC filing says JP Morgan CEO Dimon sold nearly $150 million shares | SEC filing says JP Morgan CEO Dimon sold nearly $150 million shares | SEC filing says JP Morgan CEO Dimon sold nearly $150 million shares"
2024-02-29,179.0508575439453,186.05999755859375,186.42999267578125,183.85000610351562,185.66000366210938,9643000,0.009111544439977415,176.492172087308,172.6100722651413,JPM,JPMorgan Chase & Co.,"CWA Asset Management Group LLC Acquires 552 Shares of iShares U . S . Technology ETF ( NYSEARCA : IYW )  | BOS Asset Management LLC Makes New $314 , 000 Investment in iShares MSCI EAFE Growth ETF ( BATS : EFG )  | JPMorgan Chase & Co . ( NYSE : JPM ) Shares Sold by Pentwater Capital Management LP | Gotham Asset Management LLC Has $7 . 97 Million Stock Holdings in JPMorgan Chase & Co . ( NYSE : JPM )  | JPMorgan Chase & Co . ( NYSE : JPM ) Shares Sold by Frisch Financial Group Inc . "
2024-03-01,178.3098602294922,185.2899932861328,186.44000244140625,185.10000610351562,185.6999969482422,6311800,-0.004138473976709411,176.94659412285404,173.128234807355,JPM,JPMorgan Chase & Co.,"Gotham Asset Management LLC Has $7 . 97 Million Stock Holdings in JPMorgan Chase & Co . ( NYSE : JPM )  | JPMorgan Chase & Co . ( NYSE : JPM ) Shares Purchased by Insigneo Advisory Services LLC | Danaher Co . ( NYSE : DHR ) Shares Sold by Gotham Asset Management LLC | CWA Asset Management Group LLC Invests $166 , 000 in Direxion Daily S & P 500 Bear 3X Shares ( NYSEARCA : SPXS )  | CWA Asset Management Group LLC Purchases 151 Shares of Digital Realty Trust , Inc . ( NYSE : DLR ) "
2024-03-04,179.64747619628906,186.67999267578125,187.58999633789062,184.27000427246094,184.7100067138672,7063600,0.007501637683273943,177.62181464121278,173.7208931154399,JPM,JPMorgan Chase & Co.,"Legacy Advisors LLC Sells 245 Shares of JPMorgan Chase & Co . ( NYSE : JPM )  | Lowe Brockenbrough & Co . Inc . Sells 7 , 007 Shares of JPMorgan Chase & Co . ( NYSE : JPM )  | O Shaughnessy Asset Management LLC Acquires 28 , 443 Shares of Tim S . A . ( NYSE : TIMB )  | O Shaughnessy Asset Management LLC Has $1 . 19 Million Stock Position in CNA Financial Co . ( NYSE : CNA )  | Gotham Asset Management LLC Purchases 6 , 245 Shares of Ventas , Inc . ( NYSE : VTR ) "
2024-03-05,181.44703674316406,188.5500030517578,189.3000030517578,186.36000061035156,186.36000061035156,6617800,0.010017176889859147,178.57812016670061,174.42326980886938,JPM,JPMorgan Chase & Co.,"Ather Energy picks HSBC , JPMorgan , Nomura , Indian banks to arrange its IPO | IPO News | Advisors Asset Management Inc . Has $4 . 60 Million Stock Holdings in New Mountain Finance Co . ( NASDAQ : NMFC )  | Ather picks HSBC , JPMorgan , Nomura , Indian banks for IPO : Report | JPMorgan sees  froth building  in U . S . stocks , while Goldman says rally is different this time | Ather Picks HSBC , JPMorgan , Nomura , Indian Banks for IPO , Sources Say"
2024-03-06,182.39013671875,189.52999877929688,190.07000732421875,187.6300048828125,189.25,7572900,0.005197659837900215,179.53112430471296,175.14753043704036,JPM,JPMorgan Chase & Co.,"Vanguard Dividend Appreciation ETF ( NYSEARCA : VIG ) Stock Position Raised by Consultiva Wealth Management CORP .  | iShares 3 - 7 Year Treasury Bond ETF ( NASDAQ : IEI ) Shares Bought by JPMorgan Chase & Co .  | iShares 3 - 7 Year Treasury Bond ETF ( NASDAQ : IEI ) Shares Bought by JPMorgan Chase & Co .  | Royal London Asset Management Ltd . Has $314 . 56 Million Stock Holdings in JPMorgan Chase & Co . ( NYSE : JPM )  | Baker Avenue Asset Management LP Sells 1 , 498 Shares of JPMorgan Chase & Co . ( NYSE : JPM ) "
2024-03-07,180.79269409179688,187.8699951171875,190.5,186.6300048828125,189.91000366210938,7618300,-0.00875838274860452,179.84651675148393,175.66072713292732,JPM,JPMorgan Chase & Co.,JPMorgan Chase & Co . ( NYSE : JPM ) Shares Purchased by Studio Investment Management LLC | Stonebridge Capital Advisors LLC Increases Stock Holdings in JPMorgan Chase & Co . ( NYSE : JPM )  | Stonebridge Capital Advisors LLC Increases Stock Holdings in JPMorgan Chase & Co . ( NYSE : JPM )  | JPMorgan Chase & Co . ( NYSE : JPM ) Shares Acquired by Orleans Capital Management Corp LA | Delos Wealth Advisors LLC Sells 241 Shares of JPMorgan US Momentum Factor ETF ( NYSEARCA : JMOM ) 
2024-03-08,181.12950134277344,188.22000122070312,190.4600067138672,187.9199981689453,188.44000244140625,6172200,0.0018629472427993399,180.1672628993063,176.1578884247315,JPM,JPMorgan Chase & Co.,"Westside Investment Management Inc . Has $802 , 000 Stock Position in JPMorgan Chase & Co . ( NYSE : JPM )  | Integrated Wealth Concepts LLC Grows Stock Holdings in JPMorgan Municipal ETF ( BATS : JMUB )  | Royal London Asset Management Ltd . Has $31 . 11 Million Stock Holdings in KLA Co . ( NASDAQ : KLAC )  | Mondelez International , Inc . ( NASDAQ : MDLZ ) Shares Bought by Essex Financial Services Inc .  | CSX Co . ( NASDAQ : CSX ) Stock Holdings Lifted by Royal London Asset Management Ltd . "
2024-03-11,181.1968536376953,188.2899932861328,188.44000244140625,186.22000122070312,187.27999877929688,5762600,0.0003718460793109557,180.42466058390357,176.6159761713646,JPM,JPMorgan Chase & Co.,"Graham Capital Management L . P . Has $17 . 06 Million Stock Position in JPMorgan Chase & Co . ( NYSE : JPM )  | Tompkins Financial Corp Grows Stock Position in JPMorgan Chase & Co . ( NYSE : JPM )  | JPMorgan Chase & Co . ( NYSE : JPM ) Shares Bought by EP Wealth Advisors LLC | Tompkins Financial Corp Buys 6 , 250 Shares of JPMorgan Chase & Co . ( NYSE : JPM )  | Invst LLC Boosts Stock Position in JPMorgan Chase & Co . ( NYSE : JPM ) "
2024-03-12,182.68846130371094,189.83999633789062,190.16000366210938,187.91000366210938,188.9499969482422,5708400,0.008231973326634723,180.99061076385541,177.16802027430518,JPM,JPMorgan Chase & Co.,"Tucker Asset Management LLC Boosts Stock Position in First Trust Morningstar Dividend Leaders Index ( NYSEARCA : FDL )  | Tucker Asset Management LLC Sells 583 Shares of Vanguard Dividend Appreciation ETF ( NYSEARCA : VIG )  | Vanguard Dividend Appreciation ETF ( NYSEARCA : VIG ) Shares Sold by Tucker Asset Management LLC | WT Wealth Management Has $2 . 53 Million Stock Holdings in iShares ESG Aware MSCI united states ETF ( NASDAQ : ESGU )  | Jamie Dimon Sees  Little Bit Of A Bubble In Stock Markets Right Now , But BofA Says Buy Because This Time It Different"
2024-03-13,184.17044067382812,191.3800048828125,191.72999572753906,189.83999633789062,190.36000061035156,7795500,0.008112057869125389,181.78556824134859,177.8046039469891,JPM,JPMorgan Chase & Co.,"229 , 348 Shares in iShares U . S . Infrastructure ETF ( BATS : IFRA ) Purchased by Modera Wealth Management LLC | 229 , 348 Shares in iShares U . S . Infrastructure ETF ( BATS : IFRA ) Purchased by Modera Wealth Management LLC | WT Wealth Management Acquires 854 Shares of JPMorgan Chase & Co . ( NYSE : JPM )  | VanEck Short Muni ETF ( BATS : SMB ) Shares Sold by EisnerAmper Wealth Management Corporate Benefits LLC | EisnerAmper Wealth Management Corporate Benefits LLC Sells 3 , 357 Shares of Fidelity Total Bond ETF ( NYSEARCA : FBND ) "
2024-03-14,180.88890075683594,187.97000122070312,191.6300048828125,187.10000610351562,191.02999877929688,10310900,-0.01781795115972984,181.56140137022044,178.08499456606606,JPM,JPMorgan Chase & Co.,JPMorgan Chase & Co . ( NYSE : JPM ) Shares Bought by First National Bank of Mount Dora Trust Investment Services | Baron Wealth Management LLC Trims Stock Position in iShares Global Infrastructure ETF ( NASDAQ : IGF )  | St . Louis Financial Planners Asset Management LLC Has $3 . 39 Million Stock Holdings in Invesco BulletShares 2025 Corporate Bond ETF ( NASDAQ : BSCP )  | Chemung Canal Trust Co . Cuts Stock Position in JPMorgan Chase & Co . ( NYSE : JPM )  | Fed Reserve Fines JPMorgan $98 . 2M for Market Misconduct Monitoring Failure
2024-03-15,183.13113403320312,190.3000030517578,190.94000244140625,186.47999572753906,186.47999572753906,17214200,0.012395637692449446,181.9538345359661,178.54373451762396,JPM,JPMorgan Chase & Co.,"JPMorgan Chase Declares Preferred Stock Dividends | JPMorgan Chase Declares Preferred Stock Dividends | Massmutual Trust Co . FSB ADV Buys 8 , 246 Shares of JPMorgan ActiveBuilders Emerging Markets Equity ETF ( BATS : JEMA )  | High Net Worth Advisory Group LLC Lowers Stock Holdings in JPMorgan Chase & Co . ( NYSE : JPM )  | Massmutual Trust Co . FSB ADV Sells 1 , 123 Shares of JPMorgan Core Plus Bond ETF ( BATS : JCPB ) "
2024-03-18,185.40223693847656,192.66000366210938,192.6999969482422,189.88999938964844,190.6300048828125,9013800,0.012401511721440439,182.81593513659374,179.16723473770148,JPM,JPMorgan Chase & Co.,"Nordea Investment Management AB Sells 100 , 053 Shares of JPMorgan Chase & Co . ( NYSE : JPM )  | Vanguard ESG US Stock ETF ( BATS : ESGV ) Shares Sold by Financial Network Wealth Management LLC | Vanguard ESG US Stock ETF ( BATS : ESGV ) Shares Sold by Financial Network Wealth Management LLC | Financial Network Wealth Management LLC Reduces Position in iShares Core MSCI Emerging Markets ETF ( NYSEARCA : IEMG )  | Financial Network Wealth Management LLC Reduces Position in iShares Core MSCI Emerging Markets ETF ( NYSEARCA : IEMG ) "
