Date,Adj Close,Close,High,Low,Open,Volume,Daily_Return,EMA_7,EMA_21,Ticker,Company,Headlines
2023-04-03,121.7785873413086,130.16000366210938,131.44000244140625,129.41000366210938,129.91000366210938,11775400,-0.0011509275097769667,120.94222820083365,122.69357362419653,JPM,JPMorgan Chase & Co.,"News Highlights : Top Financial Services News of the Day - Stock market news | Fifth Third Bancorp Has $95 . 62 Million Stock Holdings in JPMorgan Ultra - Short Income ETF ( NYSEARCA : JPST )  | Avaii Wealth Management LLC Buys 1 , 783 Shares of Franklin LibertyQ International Equity Hedged ETF ( NYSEARCA : FLQH )  | Bard Financial Services Inc . Has $4 . 20 Million Stock Position in Honeywell International Inc . ( NASDAQ : HON )  | The Goldman Sachs Group , Inc . ( NYSE : GS ) Shares Sold by Steel Peak Wealth Management LLC"
2023-04-04,120.15061950683594,128.4199981689453,130.58999633789062,127.41000366210938,130.5,11579900,-0.013368260135174337,120.74432602733422,122.46239597716375,JPM,JPMorgan Chase & Co.,"Stock Market Slides On New Bank Fears After JPMorgan Predicts Crisis | Cambridge Advisors Inc . Buys 131 Shares of JPMorgan Chase & Co . ( NYSE : JPM )  | JPMorgan Chase & Co . ( NYSE : JPM ) Stock Holdings Lifted by Cambridge Advisors Inc .  | JPMorgan Chase & Co . ( NYSE : JPM ) Shares Sold by Annapolis Financial Services LLC | JPMorgan Chase Share Price Live Today : JPM Stock Price Live , News , Quotes & Chart"
2023-04-05,120.32978820800781,127.61000061035156,128.14999389648438,126.45999908447266,126.80000305175781,9614700,0.0014912008103435959,120.64069157250262,122.26852254360412,JPM,JPMorgan Chase & Co.,"Invesco WilderHill Clean Energy ETF ( NYSEARCA : PBW ) Shares Sold by Harel Insurance Investments & Financial Services Ltd .  | TLW Wealth Management LLC Sells 2 , 612 Shares of Walmart Inc . ( NYSE : WMT )  | 14 , 943 Shares in Omnicom Group Inc . ( NYSE : OMC ) Acquired by Catalyst Wealth Management LLC | L3Harris Technologies , Inc . ( NYSE : LHX ) Shares Acquired by GDS Wealth Management | The TJX Companies , Inc . ( NYSE : TJX ) Shares Purchased by GDS Wealth Management"
2023-04-06,120.19776916503906,127.47000122070312,128.0800018310547,126.86000061035156,127.0,8760200,-0.0010971434832124372,120.52996097063672,122.08027223646184,JPM,JPMorgan Chase & Co.,"ASML Holding ( NASDAQ : ASML ) Shares Sold by Harel Insurance Investments & Financial Services Ltd .  | Harel Insurance Investments & Financial Services Ltd . Purchases 1 , 640 Shares of T - Mobile US , Inc . ( NASDAQ : TMUS )  | Visa Stock : Unfazed By Banking Crisis , Payments Giant Nears Buy Point | Tokio Marine Asset Management Co . Ltd . Buys 882 Shares of MetLife , Inc . ( NYSE : MET )  | Tokio Marine Asset Management Co . Ltd . Buys 216 Shares of Aon plc ( NYSE : AON ) "
2023-04-10,120.59379577636719,127.88999938964844,128.22999572753906,126.22000122070312,126.54000091552734,9477300,0.0032947916927172916,120.54591967206935,121.94513801281687,JPM,JPMorgan Chase & Co.,"JPMorgan Leads Bank Earnings This Week As Balance Sheets , Guidance Key | JPMorgan Leads Bank Earnings This Week As Balance Sheets , Guidance Key | JPMorgan strategist warns : Stocks are in  calm before the storm  phase | Global Blockchain and Cryptocurrency Market 2023 : U . S Remains the Frontrunner in Implementing Cryptocurrency Regulation | Global Blockchain and Cryptocurrency Market 2023 : U . S Remains the Frontrunner in Implementing Cryptocurrency Regulation"
2023-04-11,121.18785858154297,128.52000427246094,128.94000244140625,127.54000091552734,128.3000030517578,10516300,0.004926147330808206,120.70640439943776,121.8762944281556,JPM,JPMorgan Chase & Co.,"Geneos Wealth Management Inc . Has $7 . 20 Million Stock Holdings in JPMorgan Ultra - Short Income ETF ( NYSEARCA : JPST )  | Geneos Wealth Management Inc . Buys 33 , 889 Shares of SPDR Portfolio Developed World ex - US ETF ( NYSEARCA : SPDW )  | Security Financial Services INC . Purchases 414 Shares of Colgate - Palmolive ( NYSE : CL ) "
2023-04-12,121.16899871826172,128.5,130.42999267578125,128.05999755859375,129.17999267578125,11821000,-0.00015562502301791348,120.82205297914375,121.81199481816525,JPM,JPMorgan Chase & Co.,JPMorgan managing directors asked to work from office five days a week - memo - Stock market news | JPMorgan Chase & Co . ( NYSE : JPM ) Shares Sold by Humankind Investments LLC | Charles Schwab Trust Co Sells 402 Shares of JPMorgan Chase & Co . ( NYSE : JPM )  | JPMorgan Chase & Co . ( NYSE : JPM ) Shares Sold by Econ Financial Services Corp | JPMorgan Chase & Co . ( NYSE : JPM ) Shares Purchased by SevenBridge Financial Group LLC
2023-04-13,121.63103485107422,128.99000549316406,129.0399932861328,126.83000183105469,128.4600067138672,12450200,0.003813154665797125,121.02429844712637,121.79554391206605,JPM,JPMorgan Chase & Co.,JPMorgan Chase & Co . ( NYSE : JPM ) Shares Purchased by Oregon Public Employees Retirement Fund | JPMorgan Chase & Co . ( NYSE : JPM ) Shares Purchased by Oregon Public Employees Retirement Fund | JPMorgan Chase and Other Big Banks Post Earnings Friday . How to Play the Stocks .  | Earnings Outlook For JPMorgan Chase - JPMorgan Chase ( NYSE : JPM )  | JPMorgan Reports Earnings Friday . What to Expect . 
2023-04-14,130.81536865234375,138.72999572753906,139.1199951171875,134.89999389648438,135.14999389648438,43931300,0.07550978919578277,123.47206599843071,122.61552797936402,JPM,JPMorgan Chase & Co.,"JPMorgan profit surges 52 % on robust consumer business - Stock market news | JPMorgan Chase stock jumps after it blasts past earnings and revenue estimates | JPMorgan Chase Declares Preferred Stock Dividends | JPMorgan Chase Declares Preferred Stock Dividends | JPMorgan Chase Reports Jump In Profits , But Warns On Economy"
2023-04-17,131.85260009765625,139.8300018310547,140.05999755859375,137.66000366210938,139.9499969482422,16050500,0.0079289723829703,125.5671995232371,123.45526180829967,JPM,JPMorgan Chase & Co.,"Premarket stocks : JPMorgan steals the show as banks lift curtain on earnings | Kathleen S . Wright Associates Inc . Sells 300 Shares of JPMorgan Ultra - Short Income ETF ( NYSEARCA : JPST )  | Droms Strauss Advisors Inc . MO ADV Sells 96 , 037 Shares of JPMorgan Ultra - Short Municipal ETF ( BATS : JMST )  | Jamie Dimon On Inflation , Regulations , Credit Crunch And More : What The Veteran Banker Said During JPMorgan Earnings Call | Kathleen S . Wright Associates Inc . Has $2 . 49 Million Stock Position in JPMorgan Ultra - Short Municipal ETF ( BATS : JMST ) "
2023-04-18,133.33302307128906,141.39999389648438,141.77999877929688,139.02999877929688,140.27000427246094,13760100,0.01122786333023651,127.50865541025009,124.35324010493507,JPM,JPMorgan Chase & Co.,"Bank of America profit rises as it cashes in on higher interest rates - Stock market news | iShares MSCI Japan ETF ( NYSEARCA : EWJ ) Shares Sold by Congress Wealth Management LLC DE | Psagot Value Holdings Ltd . Israel Has $876 , 000 Stock Position in JPMorgan Chase & Co . ( NYSE : JPM )  | JPMorgan Chase & Co . ( NYSE : JPM ) Shares Acquired by Proficio Capital Partners LLC | JPMorgan Chase : 1Q23 Earnings Transcript"
2023-04-19,133.163330078125,141.22000122070312,141.5,140.39999389648438,141.22999572753906,9158100,-0.0012727004102601747,128.92232407721883,125.15415737522505,JPM,JPMorgan Chase & Co.,"First Interstate Bank Has $7 . 04 Million Stock Position in JPMorgan Chase & Co . ( NYSE : JPM )  | Evolution Advisers Inc . Sells 280 Shares of JPMorgan Chase & Co . ( NYSE : JPM )  | JPMorgan Ultra - Short Municipal ETF ( BATS : JMST ) Shares Bought by Silver Oak Securities Incorporated | JPMorgan Ultra - Short Income ETF ( NYSEARCA : JPST ) Shares Sold by Requisite Capital Management LLC | morgan stanley q1 update : Morgan Stanley Q1 Results : Firm beats estimates as wealth management shines , but shares slip"
2023-04-20,132.77671813964844,140.80999755859375,141.42999267578125,139.83999633789062,139.91000366210938,10586200,-0.0029032913058703036,129.88592259282623,125.8471174447181,JPM,JPMorgan Chase & Co.,Investment Research & Advisory Group Inc . Sells 636 Shares of JPMorgan Chase & Co . ( NYSE : JPM )  | Teradyne ( NASDAQ : TER ) Stock Rating Lowered by JPMorgan Chase & Co .  | Brookfield Asset Management ( NYSE : BAM ) Stock Price Down 3 . 4 % 
2023-04-21,132.52210998535156,140.5399932861328,141.11000061035156,138.77999877929688,139.74000549316406,11842500,-0.00191756625607431,130.54496944095757,126.45393494841204,JPM,JPMorgan Chase & Co.,"38 , 123 Shares in ProShares S & P 500 Aristocrats ETF ( BATS : NOBL ) Purchased by Centurion Wealth Management LLC | Fisher Asset Management LLC Has $498 . 31 Million Stock Holdings in Roche Holding AG ( OTCMKTS : RHHBY )  | AE Wealth Management LLC Buys 769 Shares of The Clorox Company ( NYSE : CLX )  | 9 , 621 Shares in Fabrinet ( NYSE : FN ) Acquired by Congress Wealth Management LLC DE | The Walt Disney Company ( NYSE : DIS ) Stock Position Lifted by Fisher Asset Management LLC"
2023-04-24,132.7012481689453,140.72999572753906,141.10000610351562,140.0399932861328,140.4600067138672,7567500,0.0013517607259161402,131.0840391229545,127.02187251391506,JPM,JPMorgan Chase & Co.,"Low Volatility in Stock Market Hides Risks , JPMorgan Kolanovic Says | JPMorgan Ultra - Short Income ETF ( NYSEARCA : JPST ) Shares Sold by Eldridge Investment Advisors Inc .  | Tradition Wealth Management LLC Purchases 5 , 820 Shares of Huntington Bancshares Incorporated ( NASDAQ : HBAN )  | Colgate - Palmolive ( NYSE : CL ) Shares Sold by Mystic Asset Management Inc .  | Gradient Capital Advisors LLC Sells 4 , 207 Shares of JPMorgan Ultra - Short Municipal ETF ( BATS : JMST ) "
2023-04-25,129.8158416748047,137.6699981689453,139.9600067138672,137.6300048828125,139.60000610351562,10629300,-0.021743627388245423,130.76698976091706,127.27586971035956,JPM,JPMorgan Chase & Co.,"Grant Street Asset Management Inc . Sells 13 , 954 Shares of iShares Core S & P 500 ETF ( NYSEARCA : IVV )  | JPMorgan :  ChatGPT has Driven Half the Gains in the Stock Market this Year  – Mega Financial Bubble About to Explode | Sittner & Nelson LLC Raises Stock Position in JPMorgan Chase & Co . ( NYSE : JPM )  | Verus Financial Partners Inc . Sells 648 Shares of JPMorgan Chase & Co . ( NYSE : JPM )  | Marshall Financial Group LLC Sells 242 Shares of JPMorgan Chase & Co . ( NYSE : JPM ) "
2023-04-26,127.51504516601562,135.22999572753906,137.80999755859375,134.0,137.6199951171875,14416100,-0.01772354189677927,129.95400361219168,127.29761293360102,JPM,JPMorgan Chase & Co.,"Princeton Global Asset Management LLC Sells 596 Shares of iShares 0 - 5 Year TIPS Bond ETF ( NYSEARCA : STIP )  | 75 , 274 Shares in JPMorgan Municipal ETF ( BATS : JMUB ) Acquired by Arete Wealth Advisors LLC | HM Payson & Co . Sells 43 , 903 Shares of JPMorgan Ultra - Short Income ETF ( NYSEARCA : JPST )  | Arcimoto , Inc . ( NASDAQ : FUV ) Shares Sold by Greenwich Wealth Management LLC | Reuter James Wealth Management LLC Grows Stake in ProShares Short S & P500 ( NYSEARCA : SH ) "
2023-04-27,129.23123168945312,137.0500030517578,137.91000366210938,135.66000366210938,136.0,9041100,0.013458698314407824,129.77331063150706,127.47339645686029,JPM,JPMorgan Chase & Co.,JPMorgan BetaBuilders U . S . Small Cap Equity ETF ( NYSEARCA : BBSC ) Stock Price Down 0 . 9 %  | AE Wealth Management LLC Sells 416 Shares of Synovus Financial Corp . ( NYSE : SNV )  | Ex - JPMorgan Executive Accuses Bank of Using Him As  PR Shield  In Bombshell Sex Trafficking Lawsuit
2023-04-28,130.35333251953125,138.24000549316406,138.32000732421875,135.6699981689453,136.55999755859375,9887300,0.008682892017732646,129.91831610351312,127.735208826194,JPM,JPMorgan Chase & Co.,JPMorgan Unveils ChatGPT AI Model to Predict Stock Market Moves on Fed Statements | JPMorgan ActiveBuilders U . S . Large Cap Equity ETF ( NYSEARCA : JUSA ) Shares Down 0 . 4 %  | JPMorgan ActiveBuilders U . S . Large Cap Equity ETF ( NYSEARCA : JUSA ) Shares Down 0 . 4 %  | JPMorgan Ultra - Short Income ETF ( NYSEARCA : JPST ) Shares Sold by JNBA Financial Advisors | Palisade Asset Management LLC Acquires 604 Shares of Danaher Co . ( NYSE : DHR ) 
2023-05-01,133.1444549560547,141.1999969482422,143.3699951171875,140.8300018310547,142.25999450683594,20415800,0.02141197606977352,130.7248508166485,128.22695847436316,JPM,JPMorgan Chase & Co.,"Why First Republic Bank Stock Is Tumbling In Premarket Trading - First Republic Bank ( NYSE : FRC ), JPMorgan Chase ( NYSE : JPM )  | JPMorgan CFO Says This Is Very Different Than 2008 Crisis - Era Deals - Stock market news | JP Morgan to buy First Republic assets and assume deposits - Stock market news | JPMorgan CEO Dimon Expects Banking Consolidation - Stock market news | Explainer - Why First Republic Bank failed and what JPMorgan deal means - Stock market news"
2023-05-02,130.99452209472656,138.9199981689453,142.41000366210938,138.42999267578125,141.39999389648438,14113400,-0.01614737062867344,130.79226863616802,128.47855516712346,JPM,JPMorgan Chase & Co.,"JPMorgan Jamie Dimon Continues Trend of Big Profits From Buying Failures | Ycg LLC Has $10 . 45 Million Stock Holdings in JPMorgan Chase & Co . ( NYSE : JPM )  | JPMorgan Chase & Co . ( NYSE : JPM ) Stock Position Reduced by Gables Capital Management Inc .  | First Republic Deal Is a Big Win for JPMorgan Stock and Jamie Dimon | Democrat Sold First Republic Stock , Bought JP Morgan Before Collapse"
2023-05-03,128.22225952148438,135.97999572753906,138.6699981689453,135.75999450683594,138.44000244140625,12930900,-0.021163194681052877,130.1497663574971,128.45525556297443,JPM,JPMorgan Chase & Co.,JPMorgan could process another 40 Russian grain export payments - sources - Stock market news | Lloyds beats forecasts with 46 % leap in profits after interest rates boost | Lloyds beats forecasts with 46 % leap in profits after interest rates boost | Lloyds beats forecasts with 46 % leap in profits after interest rates boost | Lloyds beats forecasts with 46 % leap in profits after interest rates boost
2023-05-04,126.46839141845703,134.1199951171875,135.72000122070312,131.80999755859375,134.9600067138672,17089200,-0.01367834344498875,129.22942262273708,128.27463154983647,JPM,JPMorgan Chase & Co.,First Trust Rising Dividend Achievers ETF ( NASDAQ : RDVY ) Shares Sold by Cozad Asset Management Inc . 
2023-05-05,128.93890380859375,136.74000549316406,137.8800048828125,135.91000366210938,136.44000244140625,11261400,0.01953462333495115,129.15679291920125,128.33501993699622,JPM,JPMorgan Chase & Co.,JPMorgan Chase Expects the First Republic Deal to Boost Profit by $500 Million . But That Seems Conservative | S & P 500 Finishes Strong Following Wild Week Of Bank Stock Volatility - JPMorgan Chase ( NYSE : JPM )  | The US Virgin Islands cant find Google co - founder Larry Page to serve him a subpoena in a lawsuit over JP Morgan links to Jeffrey Epstein | The US Virgin Islands cant find Google co - founder Larry Page to serve him a subpoena in a lawsuit over JP Morgan links to Jeffrey Epstein | The US Virgin Islands cant find Google co - founder Larry Page to serve him a subpoena in a lawsuit over JP Morgan links to Jeffrey Epstein
2023-05-08,129.25009155273438,137.07000732421875,137.97000122070312,136.47999572753906,137.49000549316406,7484900,0.0024134511380875523,129.18011757758453,128.4182082656997,JPM,JPMorgan Chase & Co.,"Worst Isnt Over for US Stock Market , JPMorgan Marko Kolanovic Warns | Worst Isnt Over for US Stock Market , JPMorgan Kolanovic Warns | UBS Group AG Acquires 2 , 021 , 887 Shares of JPMorgan Ultra - Short Income ETF ( NYSEARCA : JPST )  | 4 , 734 Shares in Kemper Co . ( NYSE : KMPR ) Acquired by Northstar Asset Management Inc .  | Northstar Asset Management Inc . Takes $4 . 58 Million Position in Eastern Bankshares , Inc . ( NASDAQ : EBC ) "
2023-05-09,128.62774658203125,136.41000366210938,136.9499969482422,135.2100067138672,135.92999267578125,7343600,-0.00481504471855021,129.0420248286962,128.437257203548,JPM,JPMorgan Chase & Co.,"Worst Isnt Over for US Stock Market , JPMorgan Kolanovic Warns | Commonwealth Equity Services LLC Buys 35 , 851 Shares of JPMorgan Chase & Co . ( NYSE : JPM )  | Journey Advisory Group LLC Purchases 12 , 687 Shares of JPMorgan Chase & Co . ( NYSE : JPM )  | JPMorgan Matejka Calls End of Euro - Area Stock Outperformance | Elite Wealth Management Inc . Has $316 , 000 Stock Position in Accenture plc ( NYSE : ACN ) "
2023-05-10,128.69374084472656,136.47999572753906,138.05999755859375,134.8699951171875,137.9499969482422,8133400,0.0005130639729680198,128.9549538327038,128.46057389820058,JPM,JPMorgan Chase & Co.,"Stockman Wealth Management Inc . Sells 3 , 050 Shares of JPMorgan Chase & Co . ( NYSE : JPM )  | Eagle Global Advisors LLC Has $27 . 09 Million Stock Holdings in JPMorgan Chase & Co . ( NYSE : JPM )  | Cooke & Bieler LP Buys 12 , 341 Shares of JPMorgan Chase & Co . ( NYSE : JPM )  | Mcdonald Capital Investors Inc . CA Sells 6 , 215 Shares of JPMorgan Chase & Co . ( NYSE : JPM )  | Stocks Will Rally If Inflation Data Is Soft , Goldman and JPMorgan Say"
2023-05-11,128.28829956054688,136.0500030517578,136.80999755859375,134.89999389648438,135.0,7057300,-0.0031504351456289603,128.78829026466457,128.44491259477752,JPM,JPMorgan Chase & Co.,JPMorgan Chase & Co . ( NYSE : JPM ) Shares Bought by Weil Company Inc .  | Lincoln National Corp Boosts Stock Position in JPMorgan Chase & Co . ( NYSE : JPM )  | JPMorgan Chase & Co . ( NYSE : JPM ) Stock Position Cut by Conning Inc .  | Pavion Blue Capital LLC Sells 276 Shares of JPMorgan Chase & Co . ( NYSE : JPM )  | Jamie Dimon Says Short - Selling Bank Stocks Should Get Traders Prosecuted
2023-05-12,126.44952392578125,134.10000610351562,136.99000549316406,133.1300048828125,136.82000732421875,9988600,-0.014333151511590536,128.20359867994375,128.26351362486878,JPM,JPMorgan Chase & Co.,"Gamble Jones Investment Counsel Buys 377 Shares of JPMorgan Chase & Co . ( NYSE : JPM )  | Daniel E . Pinto Sells 113 , 640 Shares of JPMorgan Chase & Co . ( NYSE : JPM ) Stock | Thrivent Financial for Lutherans Increases Stock Position in JPMorgan Chase & Co . ( NYSE : JPM )  | Financial Enhancement Group LLC Purchases 28 , 816 Shares of JPMorgan Ultra - Short Income ETF ( NYSEARCA : JPST )  | Nike , JPMorgan Chase share losses contribute to Dow 183 - point fall"
2023-05-15,127.51504516601562,135.22999572753906,135.6699981689453,133.9600067138672,134.27000427246094,7639500,0.008426455135250421,128.03146030146172,128.19547103770032,JPM,JPMorgan Chase & Co.,"Bell Investment Advisors Inc Increases Stock Position in JPMorgan Chase & Co . ( NYSE : JPM )  | Ahrens Investment Partners LLC Sells 2 , 387 Shares of JPMorgan Chase & Co . ( NYSE : JPM )  | Wealth Management Solutions LLC Sells 615 Shares of ProShares S & P 500 Aristocrats ETF ( BATS : NOBL )  | Connolly Sarah T . Grows Stock Holdings in JPMorgan Chase & Co . ( NYSE : JPM )  | Connolly Sarah T . Grows Stock Position in JPMorgan Chase & Co . ( NYSE : JPM ) "
2023-05-16,126.656982421875,134.32000732421875,135.94000244140625,133.9600067138672,135.4600067138672,6477200,-0.006729109831890678,127.68784083156504,128.05560843626165,JPM,JPMorgan Chase & Co.,"Insider Selling : JPMorgan Chase & Co . ( NYSE : JPM ) Vice Chairman Sells 1 , 240 Shares of Stock | US Virgin Islands subpoenas Elon Musk documents for lawsuit concerning Jeffrey Epstein bank , JPMorgan Chase - 16 - May - 2023 | Elon Musk subpoenaed by US Virgin Islands in JPMorgan Chase - Jeffrey Epstein lawsuit | Elon Musk Issued Subpoena in JPMorgan Epstein Lawsuit by US Virgin Islands | Elon Musk subpoenaed in Virgin Islands lawsuit against JPMorgan , Jeffrey Epstein"
2023-05-17,130.5513458251953,138.4499969482422,138.58999633789062,135.4600067138672,135.89999389648438,12711500,0.030747325010071602,128.4037170799726,128.28249365343743,JPM,JPMorgan Chase & Co.,"JPMorgan Chase & Co . ( NYSE : JPM ) Insider Ashley Bacon Sells 16 , 766 Shares of Stock | JPMorgan Ultra - Short Municipal ETF ( BATS : JMST ) Shares Sold by Vista Finance LLC | JPMorgan Chase & Co . ( NYSE : JPM ) Shares Acquired by Valeo Financial Advisors LLC | Prossimo Advisors LLC Acquires Shares of 8 , 319 JPMorgan Chase & Co . ( NYSE : JPM )  | Capital Advisors Wealth Management LLC Has $556 , 000 Stock Position in JPMorgan Ultra - Short Municipal ETF ( BATS : JMST ) "
2023-05-18,131.54147338867188,139.5,139.72999572753906,137.75999450683594,138.27000427246094,10999600,0.007584200355945203,129.18815615714743,128.57876453845873,JPM,JPMorgan Chase & Co.,"JPMorgan Chase & Co . ( NYSE : JPM ) Stock Position Decreased by Nicolet Bankshares Inc .  | Fountainhead AM LLC Buys 115 Shares of JPMorgan Chase & Co . ( NYSE : JPM )  | Impax Asset Management Group plc Buys 45 , 302 Shares of JPMorgan Chase & Co . ( NYSE : JPM )  | Trust Co . of Vermont Acquires 13 , 024 Shares of JPMorgan Chase & Co . ( NYSE : JPM ) "
2023-05-19,131.2396697998047,139.17999267578125,140.49000549316406,138.1300048828125,139.7899932861328,13492200,-0.0022943607144754186,129.70103456781175,128.82066501676292,JPM,JPMorgan Chase & Co.,"Insider Selling : JPMorgan Chase & Co . ( NYSE : JPM ) Vice Chairman Sells $167 , 424 . 80 in Stock | Manchester Capital Management LLC Sells 3 , 024 Shares of JPMorgan Chase & Co . ( NYSE : JPM )  | 17 , 202 Shares in JPMorgan Chase & Co . ( NYSE : JPM ) Bought by Ethos Financial Group LLC | Brown Brothers Harriman & Co . Acquires 20 , 513 Shares of JPMorgan Chase & Co . ( NYSE : JPM )  | Firestone Capital Management Sells 99 Shares of JPMorgan Chase & Co . ( NYSE : JPM ) "
2023-05-22,130.1553192138672,138.02999877929688,141.63999938964844,137.66000366210938,141.0,11402500,-0.00826236905039146,129.8146057293256,128.94199721649966,JPM,JPMorgan Chase & Co.,"Live stock market news today : Debt ceiling talks , JPMorgan , Micron , Facebook parent Meta , Venmo , stocks | May 22 , 2023 | Federal Realty Investment Trust ( NYSE : FRT ) Shares Sold by Abeille Asset Management SA | Federal Realty Investment Trust ( NYSE : FRT ) Shares Sold by Abeille Asset Management SA | JPMorgan Chase Raises Key Revenue Target to $84 Billion After First Republic Takeover | Capital Square LLC Sells 403 Shares of JPMorgan Chase & Co . ( NYSE : JPM ) "
2023-05-23,128.79747009277344,136.58999633789062,139.02999877929688,136.4600067138672,137.5399932861328,9514900,-0.010432528837815536,129.56032182018754,128.92885838707,JPM,JPMorgan Chase & Co.,"O Shaughnessy Asset Management LLC Acquires 320 , 521 Shares of Huntington Bancshares Incorporated ( NASDAQ : HBAN )  | Synergy Asset Management LLC Sells 29 , 685 Shares of JPMorgan Chase & Co . ( NYSE : JPM )  | Investors should put more money in gold and cash as rally in stocks wont last , top JPMorgan analyst says | The Tell : Investors should put more money in gold and cash as rally in stocks wont last , top JPMorgan analyst says | The Tell : Investors should put more money in gold and cash as rally in stocks wont last , top JPMorgan analyst says"
2023-05-24,127.6187744140625,135.33999633789062,136.35000610351562,135.0800018310547,135.39999389648438,8578000,-0.009151543721021227,129.0749349686563,128.8097598440693,JPM,JPMorgan Chase & Co.,"Fairview Capital Investment Management LLC Decreases Stock Holdings in JPMorgan Ultra - Short Income ETF ( NYSEARCA : JPST )  | JPMorgan Chase & Co . ( NYSE : JPM ) Shares Bought by Sequoia Financial Advisors LLC | Jes Staley must face JP Morgan lawsuit tied to Jeffrey Epstein , judge rules | JPMorgan Chase defends lawsuit by blaming U . S . Virgin Islands for Epstein sex crimes | JPMorgan Chase defends lawsuit by blaming US Virgin Islands for Jeffrey Epstein sex crimes | Taiwan News"
2023-05-25,127.92996978759766,135.6699981689453,136.27000427246094,134.5800018310547,134.82000732421875,8472500,0.0024384764307912032,128.78869367339163,128.7297789298446,JPM,JPMorgan Chase & Co.,"Fairhaven Wealth Management LLC Boosts Stock Position in JPMorgan Chase & Co . ( NYSE : JPM )  | JSF Financial LLC Sells 50 , 588 Shares of JPMorgan Ultra - Short Municipal ETF ( BATS : JMST )  | Default Fears Push Yields On Short - Term T - Bills To Over 7 % JPMorgan Says 1 - in - 4 Chance US Will Hit Date X - Invesco QQQ Trust , Series 1 ( NASDAQ : QQQ ), iShares 1 - 3 Year Treasury Bond ETF ( NASDAQ : SHY ), SPDR S & P 500 ( ARCA : SPY ), ... | Fairhaven Wealth Management LLC Acquires 421 Shares of Visa Inc . ( NYSE : V )  | JPMorgan informs some First Republic employees of job losses - source"
2023-05-26,129.1274871826172,136.94000244140625,137.60000610351562,135.6300048828125,136.11000061035156,8579900,0.009360726005077424,128.87339205069802,128.7659342255512,JPM,JPMorgan Chase & Co.,"AI to Pick Stocks ? JPMorgan Move Hints at Banks Following Nvidia , Tech Lead .  | Will JPMorgan Chase Raise Its Dividend This Year ?  | JPMorgan Chase & Co . ( NYSE : JPM ) Stock Holdings Increased by Wealth Dimensions Group Ltd .  | Giverny Capital Inc . Raises Stock Holdings in JPMorgan Chase & Co . ( NYSE : JPM )  | American International Group Inc . Sells 18 , 708 Shares of JPMorgan Chase & Co . ( NYSE : JPM ) "
2023-05-30,129.61785888671875,137.4600067138672,137.72000122070312,136.02000427246094,136.8000030517578,7399900,0.0037975779967596157,129.0595087597032,128.84338192202097,JPM,JPMorgan Chase & Co.,"JPMorgan Chase & Co . ( NYSE : JPM ) Shares Bought by Cigna Investments Inc . New | Atria Wealth Solutions Inc . Has $26 . 33 Million Stock Position in JPMorgan Chase & Co . ( NYSE : JPM )  | TFC Financial Management Inc . Has $186 , 000 Stock Position in JPMorgan Ultra - Short Municipal ETF ( BATS : JMST )  | Fuller & Thaler Asset Management Inc . Purchases 1 , 982 , 742 Shares of F . N . B . Co . ( NYSE : FNB )  | Delta Asset Management LLC TN Acquires 412 Shares of Philip Morris International Inc . ( NYSE : PM ) "
