Date,Adj Close,Close,High,Low,Open,Volume,Daily_Return,EMA_7,EMA_21,Ticker,Company,Headlines
2021-01-04,13.077455520629883,13.113499641418457,13.65250015258789,12.962499618530273,13.104249954223633,560640000,,13.077455520629883,13.077455520629883,NVDA,Nvidia Corporation,EQUITY ALERT : Rosen Law Firm Files Securities Class Action Lawsuit Against SolarWinds Corporation
2021-01-05,13.367904663085938,13.404749870300293,13.443499565124512,13.086999893188477,13.099749565124512,322760000,0.02220991247095938,13.150067806243896,13.103859988125887,NVDA,Nvidia Corporation,"Gainey McKenna & Egleston Announces A Class Action Lawsuit Has Been Filed Against SolarWinds Corporation ( SWI )  | EQUITY ALERT : ROSEN , A TOP RANKED LAW FIRM , Files First Securities Class Action Lawsuit Against SolarWinds Corporation ; Encourages Investors with Losses in Excess of $100K to Contact Firm | SolarWinds shareholder files class - action lawsuit alleging leadership  misrepresented and failed to disclose  information about hack"
2021-01-06,12.579824447631836,12.614500045776367,13.244999885559082,12.586000442504883,13.22249984741211,580424000,-0.058953159475344075,13.007506966590881,13.056220393535519,NVDA,Nvidia Corporation,"Digital Gaming Market 2020 Growth and Forecast Survey Till 2026 | AI In Computer Vision Market Report 2021 - 2023 by Technology , Future Trends , Opportunities , Top Key Players and more ...  | Artificial Intelligence ( AI ) Chipset Market Increasing Growth And Demand In COVID - 19 | Top Companies : Qualcomm Technologies , NVIDIA , Intel | Artificial Intelligence ( AI ) Chipset Market Increasing Growth And Demand In COVID - 19 | Top Companies : Qualcomm Technologies , NVIDIA , Intel | Artificial Intelligence ( AI ) Chipset Market Increasing Growth And Demand In COVID - 19 | Top Companies : Qualcomm Technologies , NVIDIA , Intel"
2021-01-07,13.307318687438965,13.343999862670898,13.377750396728516,12.886500358581543,12.967499732971191,461480000,0.057830237841203,13.082459896802902,13.079047511163104,NVDA,Nvidia Corporation,"Artificial Intelligence Ai In Market Growth Factors , Trends , Consumption , Production , Revenue and Forecast 2020 - 2023"
2021-01-08,13.240255355834961,13.276749610900879,13.420999526977539,13.041999816894531,13.362500190734863,292528000,-0.0050395825920444,13.121908761560917,13.093702769769635,NVDA,Nvidia Corporation,"Artificial Intelligence In Aviation Market Size , Share , CAGR , Revenue , Company Analysis and Forecast 2021 - 2023 | Ai In Computer Vision Market 2020 Insights , Revenue , Price and Gross Margin , Forecast 2023 | RM LAW Announces Class Action Lawsuit Against SolarWinds Corporation | RM LAW Announces Class Action Lawsuit Against SolarWinds Corporation | Notice of Lead Plaintiff Deadline for Shareholders in the SolarWinds Corporation Class Action Lawsuit"
2021-01-11,13.584054946899414,13.621500015258789,13.961000442504883,13.362500190734863,13.418749809265137,518344000,0.025966235682376215,13.237445307895541,13.138280240417798,NVDA,Nvidia Corporation,"LAWSUITS FILED AGAINST BABA , SWI and GDRX - Jakubowitz Law Pursues Shareholders Claims"
2021-01-12,13.44768238067627,13.484749794006348,13.754500389099121,13.345000267028809,13.7524995803833,291476000,-0.010039164796979305,13.290004576090723,13.166407707714022,NVDA,Nvidia Corporation,"Artificial Intelligence ( AI ) in Supply Chain Market 2021 Key Findings , Regional Study , Industry Profit Growth , Emerging Audience , Business Trends and Future Prospects | Why Nvidia and AMD Stocks Rose Today | Why Nvidia and AMD Stocks Rose Today | SOLARWINDS ALERT : Bragar Eagel & Squire , P . C . Announces That a Class Action Lawsuit Has Been Filed Against SolarWinds Corporation and Encourages Investors to Contact the Firm | SOLARWINDS ALERT : Bragar Eagel & Squire , P . C . Announces That a Class Action Lawsuit Has Been Filed Against SolarWinds Corporation and Encourages Investors to Contact the Firm"
2021-01-13,13.494552612304688,13.531749725341797,13.625,13.385000228881836,13.489999771118164,210028000,0.00348537616383382,13.341141585144214,13.19623906267681,NVDA,Nvidia Corporation,"Artificial Intelligence ( AI ) in Supply Chain Market 2021 Key Findings , Regional Study , Industry Profit Growth , Emerging Audience , Business Trends and Future Prospects | Artificial Intelligence ( AI ) in Supply Chain Market 2021 Key Findings , Regional Study , Industry Profit Growth , Emerging Audience , Business Trends and Future Prospects | Glancy Prongay & Murray LLP Reminds Investors of Looming Deadline in the Class Action Lawsuit Against SolarWinds Corporation ( SWI ) "
2021-01-14,13.163965225219727,13.200249671936035,13.599749565124512,13.180500030517578,13.574999809265137,283120000,-0.024497839727085302,13.296847495163092,13.193305077453438,NVDA,Nvidia Corporation,"AI - Powered Storage Market 2021 Size , Application , Equipment , Geography , Analysis , Revenue Analysis , Sales , Share and Research Depth Study 2025 | AI - Powered Storage Market 2021 Size , Application , Equipment , Geography , Analysis , Revenue Analysis , Sales , Share and Research Depth Study 2025 | AI - Powered Storage Market 2021 Size , Application , Equipment , Geography , Analysis , Revenue Analysis , Sales , Share and Research Depth Study 2025 | Alibaba ( NYSE : BABA ), Baidu , Inc . ( NASDAQ : BIDU ) - Alibaba Launches Electric Sedan In Partnership With China Largest Automaker : What You Need To Know | Bragar Eagel & Squire , P . C . Reminds Investors That Class Action Lawsuits Have Been Filed Against Triterras , Restaurant Brands International , CD Projekt , and SolarWinds and Encourages Investors to Contact the Firm"
2021-01-15,12.824153900146484,12.85949993133545,13.325249671936035,12.84850025177002,13.227999687194824,277780000,-0.025813751347673497,13.17867409640894,13.159745879516443,NVDA,Nvidia Corporation,"Micro Data Center Market Forecast 2021 to 2027 | Covid 19 Impact And Recovery | CT Scanner Market Overview with Detailed Analysis , Competitive landscape Forecast to 2027 | Hyperscale Data Center Market size is expected to register an exponential CAGR during the forecast period 2024 | Hyperscale Data Center Market size is expected to register an exponential CAGR during the forecast period 2024 | Hyperscale Data Center Market size is expected to register an exponential CAGR during the forecast period 2024"
2021-01-19,12.989447593688965,13.025250434875488,13.093999862670898,12.843999862670898,13.016249656677246,226188000,0.012889247495742495,13.131367470728947,13.144264217168491,NVDA,Nvidia Corporation,
2021-01-20,13.329010009765625,13.365750312805176,13.430500030517578,13.056750297546387,13.111749649047852,258572000,0.026141405446805877,13.180778105488116,13.161059289222777,NVDA,Nvidia Corporation,"Artificial Intelligence in Security Market to Touch USD 23 Billion at 31 . 86 % CAGR by 2024 | AI in Security Market Size , Share , Investment Opportunities and COVID - 19 Analysis | Artificial Intelligence in Security Market to Touch USD 23 Billion at 31 . 86 % CAGR by 2024 | AI in Security Market Size , Share , Investment Opportunities and COVID - 19 Analysis | Deep Learning Market Size , Share , Market Leaders , Current Trends , Industry Challenges , Demand Forecast , Competitor Strategies and Impact of COVID - 19 | Deep Learning Market Size , Share , Market Leaders , Current Trends , Industry Challenges , Demand Forecast , Competitor Strategies and Impact of COVID - 19 | Deep Learning Market Size , Share , Market Leaders , Current Trends , Industry Challenges , Demand Forecast , Competitor Strategies and Impact of COVID - 19"
2021-01-21,13.829383850097656,13.867500305175781,13.999250411987305,13.253000259399414,13.418499946594238,337780000,0.037540210410632824,13.342929541640501,13.22181606748413,NVDA,Nvidia Corporation,"Glancy Prongay & Murray LLP Reminds Investors of Looming Deadline in the Class Action Lawsuit Against SolarWinds Corporation ( SWI )  | Glancy Prongay & Murray LLP Reminds Investors of Looming Deadline in the Class Action Lawsuit Against SolarWinds Corporation ( SWI )  | Bragar Eagel & Squire , P . C . Reminds Investors That Class Action Lawsuits Have Been Filed Against Triterras , Restaurant Brands International , CD Projekt , and SolarWinds and Encourages Investors to Contact the Firm"
2021-01-22,13.674809455871582,13.712499618530273,13.841750144958496,13.627249717712402,13.739999771118164,246820000,-0.011177243751534394,13.425899520198271,13.262997284610263,NVDA,Nvidia Corporation,Deadline Reminder : Law Offices of Howard G . Smith Reminds Investors of Looming Deadline in the Class Action Lawsuit Against SolarWinds Corporation ( SWI )  | Deadline Reminder : Law Offices of Howard G . Smith Reminds Investors of Looming Deadline in the Class Action Lawsuit Against SolarWinds Corporation ( SWI ) 
2021-01-25,13.615717887878418,13.653249740600586,13.828499794006348,13.236499786376953,13.781749725341797,251112000,-0.004321198637820323,13.473354112118308,13.295062793998277,NVDA,Nvidia Corporation,"Middle East & Africa ( MEA ) AI , Cyber Security & Big Data Analytics Market Growth , Trends , Forecasts Report 2020 - 2025 - ResearchAndMarkets . com | Global Cloud Gaming Market – Top Devices like Gaming Consoles , Smartphones , Smart TV , LEDs among others driving market growth - by PMI - Press Release | Hyperscale Data Center Market 2021 Strategic Market Growth , Key Manufacturers and Industry Demand Analysis to 2025 | Artificial Intelligence In Military Market Trends and Analysis Research Report 2021 – 2025 | Artificial Intelligence ( AI ) in Automotive Market Likely to Emerge by 2026| Industry Insights , COVID - 19 Impact , Analysis , Opportunities"
2021-01-26,13.398319244384766,13.435250282287598,13.644749641418457,13.387499809265137,13.580499649047852,163980000,-0.015966741179853194,13.454595395184922,13.30444974403341,NVDA,Nvidia Corporation,"Middle East & Africa ( MEA ) AI , Cyber Security & Big Data Analytics Market Growth , Trends , Forecasts | New Rugged Graphics , Vision and AI Computer Provides High Performance and Flexibility for SWaP Constrained Platforms | New Rugged Graphics , Vision and AI Computer Provides High Performance and Flexibility for SWaP Constrained Platforms | Pomerantz Law Firm Announces the Filing of a Class Action against SolarWinds Corporation and Certain Officers - SWI | Worldwide Industry for AI - Enabled Medical Imaging Solutions to 2030 - Rapidly Evolving Deep Learning Techniques Presents Opportunities"
2021-01-27,12.882242202758789,12.917750358581543,13.232749938964844,12.793749809265137,13.229999542236328,371272000,-0.038518043361466026,13.311507097078389,13.26606724028117,NVDA,Nvidia Corporation,"Advanced Micro Devices ( AMD ), Intel ( INTC ), Nvidia ( NVDA ) - Will AMD , Nvidia Or Intel Stock Grow The Most By 2022 ? "
2021-01-28,13.015127182006836,13.050999641418457,13.339750289916992,12.96049976348877,12.99625015258789,228316000,0.0103153610339346,13.2374121183105,13.243254507710777,NVDA,Nvidia Corporation,"Artificial Intelligence in Epidemiology Market by AI Type , Infrastructure , Deployment Model , and Services - Global Forecast to 2026 - ResearchAndMarkets . com | Global Software Development AI Market - Comprehensive Evaluation of the Market via in - Depth Qualitative Insights – KSU | Artificial Intelligence ( AI ) in Manufacturing Market Size is USD 4798 Million by 2026 at CAGR 28 . 1 %  | Artificial Intelligence ( AI ) in Manufacturing Market Size is USD 4798 Million by 2026 at CAGR 28 . 1 %  | At More than 36 . 2 % CAGR , Artificial Intelligence Market Will exceed USD 208 . 49 Billion by 2025"
2021-01-29,12.954045295715332,12.989749908447266,13.334750175476074,12.911499977111816,13.074999809265137,271552000,-0.004693145555730638,13.166570412661708,13.216962761165735,NVDA,Nvidia Corporation,"Artificial Intelligence in Medicine Market Research Report by Application , by End User - Global Forecast to 2025 - Cumulative Impact of COVID - 19 | AI ( Artificial Intelligence ) Chip Market Technological Advancements and Rising Trend Report 2021 | Manufacturers , Suppliers and Analysis Market Report 2027 | AI ( Artificial Intelligence ) Chip Market Technological Advancements and Rising Trend Report 2021 | Manufacturers , Suppliers and Analysis Market Report 2027 | AI ( Artificial Intelligence ) Chip Market Technological Advancements and Rising Trend Report 2021 | Manufacturers , Suppliers and Analysis Market Report 2027 | Global Smart Retail Markets , 2020 - 2025 - Growing Number for Global Smart Stores Leading to Rising in Adoption of Self Delivery Vehicles"
2021-02-01,13.200614929199219,13.237000465393066,13.270750045776367,12.902750015258789,13.053250312805176,217204000,0.019034180277680557,13.175081541796086,13.215476594623325,NVDA,Nvidia Corporation,"Advanced Micro Devices ( AMD ), Intel ( INTC ), Nvidia ( NVDA ), Oracle ( ORCL ), The Charles Schwab Corp . ( SCHW ), Tesla Motors ( TSLA ) - Tesla , Charles Schwab Stocks NYSRTS , One Of U 10 Largest Pension Funds , Purchased In Q4 | Data Center Construction Market Size to Reach Revenues of over USD 55 Billion by 2026 | Data Center Construction Market Size to Reach Revenues of over USD 55 Billion by 2026"
2021-02-02,13.519485473632812,13.556750297546387,13.571999549865723,13.285499572753906,13.398750305175781,220440000,0.02415573411873906,13.261182524755267,13.24311376544237,NVDA,Nvidia Corporation,"Tesla Motors , Inc . ( NASDAQ : TSLA ), NVIDIA Corporation ( NASDAQ : NVDA ) - Tesla Agrees To Recall 134 , 951 Model S , X Vehicles After Regulator Finds Issues With Touch Screen Display"
2021-02-03,13.493307113647461,13.530500411987305,13.931750297546387,13.516500473022461,13.63599967956543,245408000,-0.001936342920476286,13.319213671978314,13.265858615279196,NVDA,Nvidia Corporation,SWI INVESTOR FILING DEADLINE : Bernstein Liebhard LLP Reminds Investors of the Deadline to File a Lead Plaintiff Motion in a Securities Class Action Lawsuit Against SolarWinds Corporation | SWI INVESTOR FILING DEADLINE : Bernstein Liebhard LLP Reminds Investors of the Deadline to File a Lead Plaintiff Motion in a Securities Class Action Lawsuit Against SolarWinds Corporation | SWI INVESTOR FILING DEADLINE : Bernstein Liebhard LLP Reminds Investors of the Deadline to File a Lead Plaintiff Motion in a Securities Class Action Lawsuit Against SolarWinds Corporation | SWI INVESTOR FILING DEADLINE : Bernstein Liebhard LLP Reminds Investors of the Deadline to File a Lead Plaintiff Motion in a Securities Class Action Lawsuit Against SolarWinds Corporation
2021-02-04,13.626688957214355,13.664250373840332,13.673500061035156,13.337750434875488,13.531000137329102,201340000,0.009885037259100837,13.396082493287324,13.298661373636937,NVDA,Nvidia Corporation,"Artificial Intelligence ( AI ) in Drug Discovery Market Study Based on Shares , Current Opportunities with Future Growth Scenario by 2027 – KSU"
2021-02-05,13.55363941192627,13.590999603271484,13.737250328063965,13.54574966430664,13.725000381469727,169152000,-0.005360769994636971,13.43547172294706,13.321841195299605,NVDA,Nvidia Corporation,"Global Automotive Artificial Intelligence Market By Component , By Technology , By Process , By Application , By Vehicle Type , By Demand Category , By Company , By Region , Forecast & Opportunities , 2026 | Smart Hospital Market Incredible Possibilities , Growth With Industry Study , Detailed Analysis And Forecast To 2021 – 2027 – KSU | IoT Chipset Market to See Massive Growth by 2025 | Qualcomm , Intel , NVIDIA"
2021-02-08,14.399062156677246,14.438750267028809,14.473750114440918,13.727250099182129,13.727250099182129,434624000,0.062376068822301844,13.676369331379608,13.419770373606664,NVDA,Nvidia Corporation,"LAWSUITS FILED AGAINST SWI , OTGLY and CLSK - JAKUBOWITZ LAW PURSUES SHAREHOLDERS CLAIMS"
2021-02-09,14.224043846130371,14.263250350952148,14.583250045776367,14.22249984741211,14.340749740600586,287560000,-0.012154840964118896,13.8132879600673,13.492886143836092,NVDA,Nvidia Corporation,"Artificial Intelligence ( AI ) in Precision Medicine Market Size , Trends , Companies , Driver , Segmentation , Forecast to 2025 | Global Discrete GPU Market 2020 to 2025 - Latest Research Report to Determine key Factors and Market Insights | AI ( Artificial Intelligence ) Chip Market Overview , Size , Share | Global Industry Outlook and Statistics , Segmentation and Forecast to 2027 | AI ( Artificial Intelligence ) Chip Market Overview , Size , Share | Global Industry Outlook and Statistics , Segmentation and Forecast to 2027 | AI ( Artificial Intelligence ) Chip Market Overview , Size , Share | Global Industry Outlook and Statistics , Segmentation and Forecast to 2027"
2021-02-10,14.72366714477539,14.764249801635742,14.904999732971191,14.341500282287598,14.463250160217285,485352000,0.03512526423918061,14.040882756244322,13.604775325739663,NVDA,Nvidia Corporation,2 AI Stocks To Buy As The Market Recovers
2021-02-11,15.208830833435059,15.250749588012695,15.272250175476074,14.925000190734863,14.980250358581543,450828000,0.0329512806754686,14.332869775542006,13.75059855371197,NVDA,Nvidia Corporation,"Apple Inc . ( NASDAQ : AAPL ), Amazon . com , Inc . ( NASDAQ : AMZN ) - Disney Earnings Straight Ahead , With Focus Squarely On Streaming Business | Bragar Eagel & Squire , P . C . Reminds Investors That Class Action Lawsuits Have Been Filed Against CD Projekt , SolarWinds , QuantumScape , and Tricida and Encourages Investors to Contact the Firm | Bragar Eagel & Squire , P . C . Reminds Investors That Class Action Lawsuits Have Been Filed Against CD Projekt , SolarWinds , QuantumScape , and Tricida and Encourages Investors to Contact the Firm | Bragar Eagel & Squire , P . C . Reminds Investors That Class Action Lawsuits Have Been Filed Against CD Projekt , SolarWinds , QuantumScape , and Tricida and Encourages Investors to Contact the Firm"
2021-02-12,14.920125007629395,14.961250305175781,15.291250228881836,14.774999618530273,15.050000190734863,374756000,-0.01898277579437424,14.479683583563853,13.856919140431737,NVDA,Nvidia Corporation,"Insights on the Automotive Artificial Intelligence Global Market to 2026 - Key Forecasts & Opportunities - ResearchAndMarkets . com | Artificial Intelligence ( AI ) in Drug Discovery Market Competitive Research And Precise Outlook 2021 To 2027 – KSU | Tablet Application Processor Market 2021 Global Insights and Business Scenario – Qualcomm Technologies Inc ., MediaTek Inc ., Nvidia Corporation , NXP Semiconductors NV , Texas Instruments Incorporated , Apple Inc ., HiSilicon Technologies Co . Ltd ,... | NVIDIA Chips Away At The Competition To Earn Top Buy Rating | DAILY DOSE : February 12 , 2021"
2021-02-16,15.288111686706543,15.330249786376953,15.3725004196167,14.949999809265137,15.064249992370605,321960000,0.024663779887164505,14.681790609349525,13.987027553729446,NVDA,Nvidia Corporation,"Lawsuits Filed Against SWI , QS and CLSK - Jakubowitz Law Pursues Shareholders Claims"
2021-02-17,14.865026473999023,14.906000137329102,15.22350025177002,14.779999732971191,15.170999526977539,274756000,-0.02767413146748554,14.7275995755119,14.066845637390315,NVDA,Nvidia Corporation,"Artificial Intelligence ( AI ) in Marketing Market expected to gain USD 21 billion at a Robust CAGR of 26 % during forecast period 2018 - 2023 | Global On - premises Telecommunication AI Market 2021 Global Industry Analysis & Forecast by 2028 : NVIDIA , Alphabet , Cisco Systems – KSU | Automotive Artificial Intelligence ( AI ) Market is Booming Worldwide with Alphabet , Intel , NVIDIA , IBM , Microsoft | Automotive Artificial Intelligence ( AI ) Market is Booming Worldwide with Alphabet , Intel , NVIDIA , IBM , Microsoft | Automotive Artificial Intelligence ( AI ) Market is Booming Worldwide with Alphabet , Intel , NVIDIA , IBM , Microsoft"
2021-02-18,14.788239479064941,14.829000473022461,14.873250007629395,14.574999809265137,14.729000091552734,233868000,-0.005165614408315644,14.742759551400159,14.132426895724372,NVDA,Nvidia Corporation,"Artificial Intelligence Market 2021 Global Trends , Top players , Demand , Share , Segmentation and Forecast to 2026 | Artificial Intelligence Market 2021 Global Trends , Top players , Demand , Share , Segmentation and Forecast to 2026 | Artificial Intelligence Market 2021 Global Trends , Top players , Demand , Share , Segmentation and Forecast to 2026 | Global Artificial Intelligence ( AI ) in Drug Discovery Market At A CAGR Of 40 . 5 % Growth , Trends And Absolute Opportunity Up To 2027||Atomwise , Inc ., DEEP GENOMICS , Cloud Pharmaceuticals , Inc ., Insilico Medicine , BenevolentAI Ltd – KSU | NVIDIA Corporation ( NASDAQ : NVDA ), Advanced Micro Devices , Inc . ( NYSE : AMD ) - Nvidia New Ethereum Mining Chip : What You Need To Know"
2021-02-19,14.88547134399414,14.92650032043457,15.177000045776367,14.846750259399414,15.024499893188477,271724000,0.0065749452507071204,14.778437499548655,14.200885481930715,NVDA,Nvidia Corporation,"SWI ACTION : Pawar Law Group Announces a Securities Class Action Lawsuit Against SolarWinds ...  | Glancy Prongay & Murray LLP Reminds Investors of Looming Deadline in the Class Action Lawsuit Against SolarWinds Corporation ( SWI )  | Glancy Prongay & Murray LLP Reminds Investors of Looming Deadline in the Class Action Lawsuit Against SolarWinds Corporation ( SWI )  | Lawsuits Filed Against SWI , PEN and QSR - Jakubowitz Law Pursues Shareholders Claims"
2021-02-22,14.316289901733398,14.35575008392334,15.13325023651123,14.324999809265137,14.774749755859375,325884000,-0.03823738120932196,14.66290060009484,14.211376792821868,NVDA,Nvidia Corporation,"Nvidia , Mattel , Domino and Other Stocks to Watch Out This Week"
2021-02-23,14.103126525878906,14.142000198364258,14.238750457763672,13.38949966430664,14.075249671936035,391780000,-0.014889568269268016,14.522957081540856,14.201535859463418,NVDA,Nvidia Corporation,"AI Infrastructure Market Forecast , Trends , Share , Size , Industry Growth , Drivers and Restraint Research Report by 2027 | Automotive Infotainment SOCs Market 2021 Top Companies , Upcoming Trends Emerging Technologies , Global Analysis with Forecast 2026 – KSU | Artificial Intelligence Robots Market | Overview , Trends , Key Drivers and Growth Forecast | Lifegraph , Sense . ly , Inc ., Zebra Medical Vision , Inc ., Baidu , Inc ., H2O ai , Enlitic , Inc . and Raven Industries . – KSU | Intelligent Robot Market to Set New Growth Story | Nvidia , CloudMinds , Promobot | Opportunities for The Global Artificial Intelligence Market to Reach $70 Billion By 2025"
2021-02-24,14.459144592285156,14.49899959564209,14.506750106811523,13.755999565124512,14.122750282287598,448320000,0.025243910685546656,14.507003959226932,14.224954835174485,NVDA,Nvidia Corporation,"Artificial intelligence market and is anticipated to grow at a CAGR of around 49 % in terms of revenue during the forecasting period 2019 to 2026 | NVIDIA Q4 Earnings Preview : Supply Shortages In Focus As Stock Falls | NVIDIA Corporation Q4 adjusted earnings Beat Estimates | Apple Inc . ( NASDAQ : AAPL ), Home Depot , Inc . ( The ) ( NYSE : HD ) - Strong Earnings From Home Depot And Lowe , With Nvidia Waiting In The Wings"
2021-02-25,13.270919799804688,13.307499885559082,14.374750137329102,13.2162504196167,14.045499801635742,824436000,-0.08217808355789313,14.19798291937137,14.138224377413593,NVDA,Nvidia Corporation,"Artificial Intelligence ( AI ) Enabled Medical Imaging Market Revenue , Growth Rate , Customer Needs , Trend , Manufacturers and Forecast to 2025 | NVIDIA Expects To Earn $5 Billion Revenue This Quarter Following Record Revenue In Q4 & FY 2021 | GPUs for gaming , data - center servers continue to drive up Nvidia revenues despite chip shortages everywhere |  ( AAL ), Apple Inc . ( NASDAQ : AAPL ) - Nvidia Becomes Latest Company To Beat Earnings Estimates But Get Punished | DEADLINE ALERT : Bragar Eagel & Squire , P . C . Reminds Investors That a Class Action Lawsuit Has Been Filed Against SolarWinds Corporation and Encourages Investors to Contact the Firm"
2021-02-26,13.676800727844238,13.714500427246094,13.854499816894531,13.361000061035156,13.7524995803833,500932000,0.030584234865583593,14.067687371489587,14.096276772907288,NVDA,Nvidia Corporation,"Re / Max ( NYSE : RMAX ), Kadant Inc ( NYSE : KAI ) -  Fast Money Halftime Report  Picks For February 26 | Haeggquist & Eck , LLP Is Investigating Claims Against SolarWinds Corporation Directors and Officers for Breach of Fiduciary Duty | Haeggquist & Eck , LLP Is Investigating Claims Against SolarWinds Corporation Directors and Officers for Breach of Fiduciary Duty | Haeggquist & Eck , LLP Is Investigating Claims Against SolarWinds Corporation Directors and Officers for Breach of Fiduciary Duty | Haeggquist & Eck , LLP Is Investigating Claims Against SolarWinds Corporation Directors and Officers for Breach of Fiduciary Duty"
2021-03-01,13.803702354431152,13.841750144958496,13.925000190734863,13.553250312805176,13.875,353184000,0.00927860463218999,14.00169111722498,14.069679098500366,NVDA,Nvidia Corporation,"AI - Enabled Diagnostic Imaging Market Size 2020 | Future Trends Analysis Report And Forecast To , 2025"
2021-03-02,13.369399070739746,13.40625,13.920499801635742,13.395999908447266,13.899999618530273,264116000,-0.03146281139219076,13.843618105603671,14.006017277794854,NVDA,Nvidia Corporation,The Law Offices of Frank R . Cruz Reminds Investors of Looming Deadline in the Class Action Lawsuit Against SolarWinds Corporation ( SWI ) 
2021-03-03,12.769554138183594,12.804750442504883,13.451499938964844,12.798749923706055,13.426250457763672,377592000,-0.04486700781256292,13.575102113748652,13.893611537830193,NVDA,Nvidia Corporation,Court Dismisses NVIDIA Securities Suit | Drones With  Most Advanced AI Ever  Coming Soon To Your Local Police Department
