Date,Adj Close,Close,High,Low,Open,Volume,Daily_Return,EMA_7,EMA_21,Ticker,Company,Headlines
2022-09-30,12.124433517456055,12.138999938964844,12.633000373840332,12.074999809265137,12.086999893188477,565638000,-0.00662849834699708,12.46417243158572,13.414887134186813,NVDA,Nvidia Corporation,AI In Computer Vision Market Rising New Business Opportuniti ...  | The Worldwide Artificial Intelligence Chip Industry is Expected to Reach $304 Billion by 2030 | The Worldwide Artificial Intelligence Chip Industry is Expected to Reach $304 Billion by 2030 | The Worldwide Artificial Intelligence Chip Industry is Expected to Reach $304 Billion by 2030
2022-10-03,12.496986389160156,12.51200008392334,12.678000450134277,12.104999542236328,12.347000122070312,547478000,0.0307274456301585,12.472375920979328,13.33144161191166,NVDA,Nvidia Corporation,"10 Best Machine Learning Stocks To Invest In | 10 Best Machine Learning Stocks To Invest In | GAM Holding AG Sells 78 , 313 Shares of NVIDIA Co . ( NASDAQ : NVDA )  | Ziegler Capital Management LLC Raises Stock Holdings in NVIDIA Co . ( NASDAQ : NVDA )  | Tower Bridge Advisors Increases Stock Holdings in NVIDIA Co . ( NASDAQ : NVDA ) "
2022-10-04,13.151200294494629,13.166999816894531,13.220000267028809,12.878999710083008,12.878999710083008,584182000,0.0523497333646723,12.642082014358152,13.315056037601021,NVDA,Nvidia Corporation,Stock Market | Daily Herald | The Stock Of Taiwan Semiconductor Manufacturing Company Limited ( NYSE : TSM ) Is Forecast To Pass $126 . 00 In A Year | Why Nvidia Stock Was Surging Today | The Motley Fool
2022-10-05,13.19314956665039,13.208999633789062,13.321000099182129,12.621000289916992,12.91100025177002,507131000,0.003189767566183388,12.779848902431212,13.303973631150964,NVDA,Nvidia Corporation,Why Nvidia Stock Was Surging Today | The Motley Fool
2022-10-06,13.11424446105957,13.130000114440918,13.656000137329102,13.102999687194824,13.220000267028809,644157000,-0.005980763364517361,12.863447792088301,13.286725524779017,NVDA,Nvidia Corporation,Global Microprocessor and GPU Market Report 2022 - 2026 : Microprocessor Giants Announce New Products to Improve Computing Power | NVIDIA will suspend all operations in Russia and relocate its staff .  | How To Invest In Artificial Intelligence
2022-10-07,12.061509132385254,12.076000213623047,12.670000076293945,12.022000312805176,12.505000114440918,672478000,-0.08027418825386612,12.66296312716254,13.175342216379585,NVDA,Nvidia Corporation,Selling Your Taiwan Semiconductor Manufacturing Company Limited ( NYSE : TSM ) Stock ? Here What You Need To Know – Stocks Register
2022-10-10,11.655996322631836,11.670000076293945,12.12399959564209,11.407999992370605,12.036999702453613,698699000,-0.03362040398946531,12.411221426029863,13.037219862402516,NVDA,Nvidia Corporation,"First Citizens Bank & Trust Co . Sells 727 Shares of NVIDIA Co . ( NASDAQ : NVDA )  | Venture Visionary Partners LLC Purchases 2 , 047 Shares of NVIDIA Co . ( NASDAQ : NVDA )  | NVIDIA Co . ( NASDAQ : NVDA ) Stock Holdings Decreased by Girard Partners LTD .  | Legacy Wealth Planning LLC Acquires 100 Shares of NVIDIA Co . ( NASDAQ : NVDA )  | Loring Wolcott & Coolidge Fiduciary Advisors LLP MA Boosts Stock Holdings in NVIDIA Co . ( NASDAQ : NVDA ) "
2022-10-11,11.572097778320312,11.586000442504883,11.845999717712402,11.282999992370605,11.560999870300293,667482000,-0.00719788699217605,12.201440514102476,12.90402694566777,NVDA,Nvidia Corporation,"Nvidia Stock Slides , Leading Chipmakers Lower , As Biden China Export Curbs Bite | U . S . Stocks Fall as Wall Street Awaits September Inflation Reports By Investing . com"
2022-10-12,11.486199378967285,11.5,11.734999656677246,11.345000267028809,11.579000473022461,492590000,-0.0074228891769263505,12.02263023031868,12.77513353051318,NVDA,Nvidia Corporation,Microsoft accuses united kingdom regulator of  adopting Sony complaint over Activision Blizzard deal
2022-10-13,11.945648193359375,11.960000038146973,12.07800006866455,10.812999725341797,10.970999717712402,850103000,0.04000007306449871,12.003384721078852,12.699725772590106,NVDA,Nvidia Corporation,10 Large - Cap Stocks to Buy According to Billionaire Richard Chilton
2022-10-14,11.213526725769043,11.22700023651123,12.111000061035156,11.204000473022461,12.057000160217285,713432000,-0.061287713796671195,11.8059202222514,12.564616768333646,NVDA,Nvidia Corporation,Texas Instruments Incorporated ( TXN ) Is Waiting On The Launchpad To Make A Splash . 
2022-10-17,11.873734474182129,11.887999534606934,11.947999954223633,11.517000198364258,11.517999649047852,580774000,0.05887601327920389,11.822873785234082,12.501809287047145,NVDA,Nvidia Corporation,These Numbers Show Just How Powerful Taiwan Semiconductor Manufacturing Company Limited ( NYSE : TSM ) Stock ‎Is
2022-10-18,11.95263957977295,11.967000007629395,12.491999626159668,11.618000030517578,12.343999862670898,659362000,0.006645348669568785,11.855315233868799,12.451884768204037,NVDA,Nvidia Corporation,"Artificial Intelligence In Manufacturing Market is expected to generate a revenue of USD 52 . 37 Billion by 2030 , Globally , at 47 . 80 % CAGR : Verified Market Research® | Artificial Intelligence In Manufacturing Market is expected to generate a revenue of USD 52 . 37 Billion by 2030 , Globally , at 47 . 80 % CAGR : Verified Market Research"
2022-10-19,12.036537170410156,12.050999641418457,12.350000381469727,11.833999633789062,11.878999710083008,523131000,0.007019168450388413,11.900620718004138,12.414125895677321,NVDA,Nvidia Corporation,5 Best Machine Learning Stocks to Buy - Insider Monkey | AI Eye Podcast 730 : Stocks Discussed : ( Nasdaqgs : $AMZN ) ( NYS ... 
2022-10-20,12.179367065429688,12.194000244140625,12.769000053405762,12.104999542236328,12.11299991607666,652398000,0.011866360980519852,11.970307304860526,12.392784183836627,NVDA,Nvidia Corporation,"The Global AI In Retail Market size is expected to reach | The Global Automotive Artificial Intelligence Market size | 3D Animation Market Size Will Attain USD 47 , 021 Million by 2030 growing at 12 . 5 % CAGR - Exclusive Report by Acumen Research and Consulting | An Update On Taiwan Semiconductor Manufacturing Company Limited ( TSM ) "
2022-10-21,12.451042175292969,12.465999603271484,12.498000144958496,11.88700008392334,12.097999572753906,609494000,0.022306176372203446,12.090491022468637,12.398080364878112,NVDA,Nvidia Corporation,"Cathie Wood Snags Tesla Shares , Unloads Nvidia"
2022-10-24,12.583881378173828,12.598999977111816,12.710000038146973,12.064000129699707,12.508000373840332,517457000,0.01066892240911832,12.213838611394934,12.414971366086814,NVDA,Nvidia Corporation,Aetina Corporation : Aetina Launches New MXM GPU Modules for AI Performance Boost at the Edge | Aetina Launches New MXM GPU Modules for AI Performance Boost at the Edge | Aetina Launches New MXM GPU Modules for AI Performance Boost at the Edge | Aetina Launches New MXM GPU Modules for AI Performance Boost at the Edge | Aetina Launches New MXM GPU Modules For AI Performance Boost ... 
2022-10-25,13.245085716247559,13.26099967956543,13.300000190734863,12.663999557495117,12.694000244140625,505482000,0.05254375166159453,12.47165038760809,12.490436307010517,NVDA,Nvidia Corporation,Global AI in Healthcare Market Report 2022 : Surging Investment in AI Deals in Healthcare Boosts Sector | Global AI in Healthcare Market Report 2022 : Surging Investment in AI Deals in Healthcare Boosts Sector | Nvidia : This Could Get Ugly ( NASDAQ : NVDA )  | US Wants To Break Up Taiwan Chip Hub To Shield Supply Chains In Event Of China Invasion
2022-10-26,12.880525588989258,12.895999908447266,13.387999534606934,12.708000183105469,12.869000434875488,532953000,-0.027524180293608813,12.573869187953381,12.525898969008585,NVDA,Nvidia Corporation,"Nvidia Stock : Reversing Course , Now Bullish Due To Data Center Demand ( NASDAQ : NVDA )  | After - Hours Movers : Meta Plunges After Results , NVIDIA Up on Meta Capex Guidance | Taiwan Semiconductor Manufacturing Company Limited ( NYSE : TSM ) Downward Trend Continues – Stocks Register"
2022-10-27,13.16019058227539,13.175999641418457,13.838000297546387,13.121999740600586,13.630000114440918,583113000,0.02171223459430882,12.720449536533884,12.583561842941931,NVDA,Nvidia Corporation,Taiwan Semiconductor Vs . Samsung Vs . Intel : Battle At The Leading Edge ( NASDAQ : INTC )  | semiconductor : How China pushback against US semiconductor restrictions could play out
2022-10-28,13.817399024963379,13.833999633789062,13.850000381469727,13.060999870300293,13.104000091552734,521040000,0.049939128052836956,12.994686908641258,12.695728859489336,NVDA,Nvidia Corporation,Global Artificial Intelligence in Manufacturing Market
2022-10-31,13.480803489685059,13.496999740600586,13.838000297546387,13.29699993133545,13.777999877929688,486341000,-0.024360267418651382,13.116216053902209,12.76709928041622,NVDA,Nvidia Corporation,Global Semiconductors Market Revenue to Reach $1042 . 69 Billion by 2028 | Taiwan to Start Losing Its Market Share
2022-11-01,13.526749610900879,13.543000221252441,13.925000190734863,13.519000053405762,13.810999870300293,432817000,0.003408262812448548,13.218849443151877,12.83615840136937,NVDA,Nvidia Corporation,
2022-11-02,13.203137397766113,13.218999862670898,14.210000038146973,13.211000442504883,13.850000381469727,672628000,-0.023923871029147614,13.214921431805436,12.86952012831453,NVDA,Nvidia Corporation,What Are You Thinking About Investing In Taiwan Semiconductor Manufacturing Company Limited ( NYSE : TSM ) Stock ? 
2022-11-03,13.40489387512207,13.420999526977539,13.781000137329102,12.956000328063965,13.043000221252441,500065000,0.015280949616573114,13.262414542634595,12.918190468933396,NVDA,Nvidia Corporation,"Data Center Accelerator Market Worth $64 . 0 billion by 2027 - Exclusive Report by MarketsandMarkets | Data Center Accelerator Market Worth $64 . 0 billion by 2027 - Exclusive Report by MarketsandMarkets™ | Global Edge AI Market to hit USD 70 Billion By 2032 : Global Market Insights Inc . – Padovanews | Global Deep Learning Market Research Report 2022 - 2027 Featuring AWS , Google , IBM , Intel , Micron Technology , Microsoft , Nvidia , Qualcomm , Samsung , & Sensory | Global Deep Learning Market Research Report 2022 - 2027 Featuring AWS , Google , IBM , Intel , Micron Technology , Microsoft , Nvidia , Qualcomm , Samsung , & Sensory"
2022-11-04,14.139013290405273,14.156000137329102,14.229000091552734,13.696999549865723,13.986000061035156,612576000,0.05476503000487343,13.481564229577264,13.029174361794475,NVDA,Nvidia Corporation,Earnings Roundup : How Data Center Players Fared During Q3 | Data Center Knowledge | News and analysis for the data center industry
2022-11-07,14.283838272094727,14.300999641418457,14.411999702453613,13.954000473022461,14.227999687194824,410061000,0.010242934122406622,13.68213274020663,13.143234717276314,NVDA,Nvidia Corporation,Is Now The Time To Buy Taiwan Semiconductor Manufacturing Company Limited ( NYSE : TSM ) Stock ? 
2022-11-08,14.584477424621582,14.60200023651123,14.890999794006348,14.215999603271484,14.800999641418457,595292000,0.021047504655257177,13.907718911310369,13.27425678158043,NVDA,Nvidia Corporation,"Nvidia Stock Jumps On Report Of New Chip Designed for China Market That Meets U . S . Export Rules | Stocks Higher Ahead of Mid - Terms , Nvidia , Lyft , Activision And Disney In Focus - Five Things To Know"
2022-11-09,13.759469985961914,13.776000022888184,14.211000442504883,13.758999824523926,14.161999702453613,454414000,-0.05656750081884232,13.870656679973255,13.318367072887836,NVDA,Nvidia Corporation,Research and Markets : Automotive Artificial Intelligence Global Market Report 2022 : Growing Demand for Autonomous Vehicles Driving Sector
2022-11-10,15.731100082397461,15.75,15.77299976348877,14.54699993133545,14.800000190734863,700819000,0.14329259037209297,14.335767530579307,13.53770643738871,NVDA,Nvidia Corporation,"Global AI Infrastructure Market Research Report 2022 : A $96 . 6 Billion Market by 2027 from $28 . 7 Billion in 2022 - Rising Need for Co - Processors due to Slowdown of Moore Law | Global AI Infrastructure Market Research Report 2022 : A $96 . 6 Billion Market by 2027 from $28 . 7 Billion in 2022 - Rising Need for Co - Processors due to Slowdown of Moore Law | Global AI Infrastructure Market Research Report 2022 : A $96 . 6 Billion Market by 2027 from $28 . 7 Billion in 2022 - Rising Need for Co - Processors due to Slowdown of Moore Law | Despite disappointing numbers , NVIDIA core business remains strong , as shown by Liftr Insights data | NVIDIA Up Over 12 %, on Track for Largest Percent Increase Since March 2020 Data Talk"
2022-11-11,16.307405471801758,16.32699966430664,16.388999938964844,15.482000350952148,15.807000160217285,655487000,0.0366347799191209,14.82867701588492,13.789497258698987,NVDA,Nvidia Corporation,
2022-11-14,16.275447845458984,16.295000076293945,16.540000915527344,15.92199993133545,16.218000411987305,527852000,-0.001959700235456441,15.190369723278437,14.015492766586258,NVDA,Nvidia Corporation,Retailers Get Ready to Report Q3 Earnings Just as Inflation Begins to Ease
2022-11-15,16.64600372314453,16.666000366210938,16.99799919128418,16.381999969482422,16.722000122070312,545876000,0.02276778379336175,15.55427822324496,14.254630126273373,NVDA,Nvidia Corporation,Taiwan Semiconductor Manufacturing Company Limited ( NYSE : TSM ) Jumps 11 . 49 % In Recent Session . Here Everything You Need To Know . – Stocks Register
2022-11-16,15.890907287597656,15.90999984741211,16.36199951171875,15.873000144958496,16.16200065612793,649547000,-0.045362024910338805,15.638435489333133,14.40338259548467,NVDA,Nvidia Corporation,"NVIDIA Corporation Q3 Profit Decreases , misses estimates"
2022-11-17,15.658188819885254,15.677000045776367,16.266000747680664,15.53499984741211,15.71500015258789,710894000,-0.014644756495057476,15.643373821971164,14.517455888611996,NVDA,Nvidia Corporation,"Dow futures tick higher amid NVIDIA , Cisco Earnings By Investing . com | Nvidia Q3 report is  no reason to turn materially bullish on stock   | Nvidia Is Facing Lawsuit Over RTX 4090 Melting Connector"
2022-11-18,15.390509605407715,15.409000396728516,16.00200080871582,15.119999885559082,15.965999603271484,492072000,-0.01709515816654339,15.5801577678303,14.596824408320696,NVDA,Nvidia Corporation,5 Best AI Stocks to Buy Now - Insider Monkey | Nvidia hit with class action lawsuit over 12VHPWR cable melting woes
2022-11-21,15.298619270324707,15.317000389099121,15.47700023651123,15.079999923706055,15.147000312805176,404739000,-0.005970584304155868,15.509773143453902,14.660623941230153,NVDA,Nvidia Corporation,Artificial Intelligence in Ultrasound Imaging Market ( 2022 - 2029 ) Growth Powered With Latest Developm | Does Taiwan Semiconductor Manufacturing Company Limited ( NYSE : TSM ) Still Need To Convince Analysts ? 
2022-11-22,16.018756866455078,16.038000106811523,16.058000564575195,15.121999740600586,15.32800006866455,472866000,0.047072064701109806,15.637019074204197,14.784090570796055,NVDA,Nvidia Corporation,"Edge Data Center Market to be Worth $34 . 91 Billion by 2030 : Grand View Research , Inc .  | Edge Data Center Market to be Worth $34 . 91 Billion by 2030 : Grand View Research , Inc .  | Edge Data Center Market to be Worth $34 . 91 Billion by 2030 : Grand View Research , Inc .  | Edge Data Center Market to be Worth $34 . 91 Billion by 2030 : Grand View Research , Inc .  | List of Global Sanctions Against Russia , Its Impact On Russian Economy and Companies Fleeing the Country"
2022-11-23,16.499177932739258,16.518999099731445,16.527000427246094,16.04800033569336,16.097999572753906,427241000,0.029991157883807462,15.852558788837962,14.940007603699982,NVDA,Nvidia Corporation,
2022-11-25,16.25047492980957,16.270000457763672,16.48699951171875,16.172000885009766,16.31800079345703,167934000,-0.015073660272260425,15.952037824080865,15.059140996982672,NVDA,Nvidia Corporation,"Asia Pacific AR / VR Chip Market Report 2022 : Applications in Robot Navigation , Building Modeling , Aircraft Simulation and More Driving Demand - ResearchAndMarkets . com | Asia Pacific AR / VR Chip Market Report 2022 : Applications in Robot Navigation , Building Modeling , Aircraft Simulation and More Driving Demand - ResearchAndMarkets . com | Virtual Reality Market to Garner a CAGR of 25 . 1 % During 2021 - 2030 , Claims GlobalData Plc | Virtual Reality Market to Garner a CAGR of 25 . 1 % During 2021 - 2030 , Claims GlobalData Plc | Virtual Reality Market to Garner a CAGR of 25 . 1 % During 2021 - 2030 , Claims GlobalData Plc"
2022-11-28,15.808008193969727,15.82699966430664,16.35700035095215,15.725000381469727,16.025999069213867,303741000,-0.02722792642990335,15.916030416553081,15.127219833072404,NVDA,Nvidia Corporation,
2022-11-29,15.620233535766602,15.638999938964844,15.932000160217285,15.520000457763672,15.82699966430664,298384000,-0.011878451472131402,15.84208119635646,15.172039260590058,NVDA,Nvidia Corporation,High Performance Computing As a Service Global Market Report 2022 : Ukraine - Russia War Impact
2022-11-30,16.907014846801758,16.92300033569336,16.93000030517578,15.597000122070312,15.696999549865723,565298000,0.08237913396677032,16.108314608967785,15.329764313882029,NVDA,Nvidia Corporation,Data Center Accelerator Global Market Report 2022 : Growing Use of Deep Learning Technology in Big Data Analytics Boosts Sector | Data Center Accelerator Global Market Report 2022 : Growing Use of Deep Learning Technology in Big Data Analytics Boosts Sector | Data Center Accelerator Global Market Report 2022 : Growing Use of Deep Learning Technology in Big Data Analytics Boosts Sector | Supply Chain Wars : How US Is Turning The Heat Against China On Semiconductors
2022-12-01,17.118816375732422,17.135000228881836,17.264999389648438,16.635000228881836,16.999000549316406,470977000,0.01252743496411668,16.360940050658943,15.492405410413882,NVDA,Nvidia Corporation,Insights on the Artificial Intelligence in Manufacturing Global Market to 2028 - Demand for AI in Manufacturing Being Driven by Increasing Volume of Complex Datasets | Insights on the Artificial Intelligence in Manufacturing Global Market to 2028 - Demand for AI in Manufacturing Being Driven by Increasing Volume of Complex Datasets | Insights on the Artificial Intelligence in Manufacturing Global Market to 2028 - Demand for AI in Manufacturing Being Driven by Increasing Volume of Complex Datasets | How to Invest in Artificial Intelligence | Taiwan Semiconductor Manufacturing Company Limited ( TSM ): Worth Taking A Bite At $81 . 62
2022-12-02,16.86005973815918,16.875999450683594,16.933000564575195,16.44499969482422,16.659000396728516,371389000,-0.01511533460572978,16.485719972534003,15.61673762202709,NVDA,Nvidia Corporation,12 Best Blockchain Stocks To Buy Now - Insider Monkey | 12 Best Blockchain Stocks To Buy Now | 10 Best Artificial Intelligence Stocks Under $10
2022-12-05,16.594314575195312,16.610000610351562,16.9950008392334,16.472000122070312,16.679000854492188,352255000,-0.015761816214826863,16.51286862319933,15.70560825413329,NVDA,Nvidia Corporation,"Artificial Intelligence in Healthcare Market to hit USD 70 Billion by 2032 , says Global Market Insights Inc . "
2022-12-06,15.97189998626709,15.987000465393066,16.572999954223633,15.819000244140625,16.530000686645508,352694000,-0.03750770097239142,16.377626463966273,15.72981659341818,NVDA,Nvidia Corporation,10 Cheap Gaming Stocks to Buy Now - Insider Monkey | 10 Cheap Gaming Stocks to Buy Now
2022-12-07,16.104774475097656,16.1200008392334,16.18600082397461,15.666999816894531,15.772000312805176,372388000,0.00831926627043833,16.30941346674912,15.76390367357086,NVDA,Nvidia Corporation,"Meticulous Market Research Pvt . Ltd .: Artificial Intelligence in Genomics Market to Reach $6 . 22 Billion by 2029 | SIMPLEX QUANTUM , Inc . Raises Round of Series A Funding | SIMPLEX QUANTUM , Inc . Raises Round of Series A Funding | Artificial Intelligence in Genomics Market to Reach $6 . 22 Billion by 2029 - Exclusive Report by Meticulous Research® | SIMPLEX QUANTUM , Inc . Raises Round of Series A Funding"
2022-12-08,17.15278434753418,17.16900062561035,17.179000854492188,15.958999633789062,16.273000717163086,515456000,0.06507448297751894,16.520256186945385,15.89016555302207,NVDA,Nvidia Corporation,
2022-12-09,16.984941482543945,17.000999450683594,17.58300018310547,16.975000381469727,17.15999984741211,465338000,-0.009785167328496325,16.636427510845024,15.98969063752406,NVDA,Nvidia Corporation,
2022-12-12,17.5184383392334,17.53499984741211,17.538000106811523,16.797000885009766,17.03700065612793,457328000,0.031409990857945935,16.856930217942118,16.128667701315816,NVDA,Nvidia Corporation,"Artificial Intelligence in Cybersecurity Market worth $60 . 6 Billion by 2028 - Exclusive Report by MarketsandMarkets™ | Artificial Intelligence in Cybersecurity Market worth $60 . 6 Billion by 2028 - Exclusive Report by MarketsandMarkets™ | Global AI in Oil and Gas Market Report to 2031 - Featuring IBM , Google , Microsoft and Oracle Among Others - ResearchAndMarkets . com | Global AI in Oil and Gas Market Report to 2031 - Featuring IBM , Google , Microsoft and Oracle Among Others - ResearchAndMarkets . com"
2022-12-13,18.054935455322266,18.07200050354004,18.790000915527344,17.711000442504883,18.5310001373291,656589000,0.03062471127277111,17.156431527287154,16.303782951680038,NVDA,Nvidia Corporation,15 Biggest AI Companies In The World - Insider Monkey
2022-12-14,17.65730857849121,17.673999786376953,18.25200080871582,17.420000076293945,17.98699951171875,496888000,-0.0220231680038403,17.281650790088168,16.4268307359356,NVDA,Nvidia Corporation,NVIDIA Announces Upcoming Events for Financial Community | NVIDIA Announces Upcoming Events for Financial Community | NVIDIA Vs AMD : Which Is Better For 2023 ? 
2022-12-15,16.93598747253418,16.95199966430664,17.31999969482422,16.700000762939453,17.145999908447266,478542000,-0.04085113553691244,17.195234960699672,16.473117711990017,NVDA,Nvidia Corporation,"UTXO Technologies , Inc ., Wholly Owned Subsidiary of IDGlobal Corp . Is Pleased to Announce a Real Estate Investment Transaction to Open the Company First AI Factory | UTXO Technologies , Inc ., Wholly Owned Subsidiary of IDGlobal Corp . Is Pleased to Announce a Real Estate Investment Transaction to Open the Company First AI Factory | UTXO Technologies , Inc ., Wholly Owned Subsidiary of IDGlobal Corp . Is Pleased to Announce a Real Estate Investment Transaction to Open the Company First AI Factory | UTXO Technologies , Inc ., Wholly Owned Subsidiary of IDGlobal Corp . Is Pleased to Announce a Real Estate Investment Transaction to Open the Company First AI Factory | UTXO Technologies , Inc ., Wholly Owned Subsidiary of IDGlobal Corp . Is Pleased to Announce a Real Estate Investment Transaction to Open the Company First AI Factory"
2022-12-16,16.555349349975586,16.570999145507812,17.041000366210938,16.40999984741211,16.86400032043457,478232000,-0.022475106525432387,17.03526355801865,16.48059331544325,NVDA,Nvidia Corporation,"Artificial Intelligence in Automotive Market Research Report by Technology , Process , Offerings , Application , Region - Global Forecast to 2027 | Artificial Intelligence in Automotive Market Research Report by Technology , Process , Offerings , Application , Region - Global Forecast to 2027"
2022-12-19,16.2386474609375,16.253999710083008,16.608999252319336,16.145000457763672,16.57200050354004,354039000,-0.019129882574090984,16.836109533748363,16.45859823776091,NVDA,Nvidia Corporation,
2022-12-20,16.069805145263672,16.084999084472656,16.309999465942383,15.85200023651123,16.06399917602539,403260000,-0.010397560269719719,16.644533436627192,16.42325341117025,NVDA,Nvidia Corporation,Such Is The Power Of Taiwan Semiconductor Manufacturing Company Limited ( NYSE : TSM )  | Democratizing Domain - Specific Computing
2022-12-21,16.485414505004883,16.500999450683594,16.62700080871582,16.101999282836914,16.11400032043457,325025000,0.0258627504182094,16.604753703721613,16.42890441970067,NVDA,Nvidia Corporation,"SambaNova Systems : SambaNova Accelerates AI for Banking and the Public Sector with a World Record Performance System , New Partnerships , and International Expansion in 2022"
2022-12-22,15.32451343536377,15.33899974822998,16.13800048828125,14.881999969482422,16.0939998626709,565045000,-0.0704198896114302,16.284693636632152,16.328505239306406,NVDA,Nvidia Corporation,Nvidia Stock : This Will Not End Well ( NASDAQ : NVDA ) 
2022-12-23,15.191638946533203,15.206000328063965,15.33899974822998,14.883000373840332,15.196000099182129,349326000,-0.008670715020806963,16.011429964107414,16.225153758145204,NVDA,Nvidia Corporation,"Thinking Of Selling Taiwan Semiconductor Manufacturing Company Limited ( NYSE : TSM ) Stock ? First , You Need To See This"
2022-12-27,14.107664108276367,14.121000289916992,15.100000381469727,14.055999755859375,15.074000358581543,464902000,-0.07135338340200637,15.535488500149652,16.032654699066217,NVDA,Nvidia Corporation,Is Taiwan Semiconductor Manufacturing Company Limited ( NYSE : TSM ) Stock On The Decline ? – Stocks Register
2022-12-28,14.022743225097656,14.03600025177002,14.26200008392334,13.883999824523926,13.927000045776367,351066000,-0.006019485758020804,15.157302181386653,15.849935474159984,NVDA,Nvidia Corporation,NVIDIA Corporation ( NASDAQ : NVDA ) Q3 2023 Earnings Call Transcript
2022-12-29,14.589208602905273,14.602999687194824,14.682999610900879,14.22700023651123,14.402000427246094,354923000,0.04039618844291226,15.015278786766308,15.735323940409556,NVDA,Nvidia Corporation,The Worldwide Subscription - based Gaming Industry is Expected to Reach $55 . 9 Billion by 2031 | The Worldwide Subscription - based Gaming Industry is Expected to Reach $55 . 9 Billion by 2031 | The Worldwide Subscription - based Gaming Industry is Expected to Reach $55 . 9 Billion by 2031
