Date,Adj Close,Close,High,Low,Open,Volume,Daily_Return,EMA_7,EMA_21,Ticker,Company,Headlines
2023-12-20,48.086891174316406,48.111000061035156,49.999000549316406,48.097999572753906,49.654998779296875,397894000,-0.030098239784292713,48.545019982151786,47.79115519138526,NVDA,Nvidia Corporation,"NVIDIA Co . ( NASDAQ : NVDA ) Director Sells $492 , 520 . 00 in Stock | Green Square Capital Advisors LLC Increases Stock Position in NVIDIA Co . ( NASDAQ : NVDA )  | StrongBox Wealth LLC Boosts Stock Position in NVIDIA Co . ( NASDAQ : NVDA )  | NVIDIA Co . ( NASDAQ : NVDA ) Shares Purchased by D Orazio & Associates Inc .  | Intel Confirms Acquisition Of AI - based Workload Optimization Startup Granulate , Reportedly For Up To $650M"
2023-12-21,48.965450286865234,48.9900016784668,49.095001220703125,48.41899871826172,48.81100082397461,300425000,0.018270241454454217,48.65012755833015,47.89790929097435,NVDA,Nvidia Corporation,NVIDIA Co . ( NASDAQ : NVDA ) Stock Position Increased by Castle Rock Wealth Management LLC
2023-12-22,48.80553436279297,48.83000183105469,49.382999420166016,48.46699905395508,49.19499969482422,252507000,-0.0032658930559280597,48.68897925944585,47.980420661139675,NVDA,Nvidia Corporation,"Apple , Tesla And Nvidia Were Among 2023  Magnificent Seven  Stocks Here What To Expect From Them All In 2024"
2023-12-26,49.25429916381836,49.27899932861328,49.599998474121094,48.959999084472656,48.96799850463867,244200000,0.009194957229430756,48.83030923553898,48.09622779774683,NVDA,Nvidia Corporation,"Hyperscale Data Centers Market Size , Share , Revenue , Trends And Drivers For 2024 - 2033 | Absci stock gains as AI drug discovery rallies ( NASDAQ : ABSI )  | Wedge Capital Management L L P NC Acquires 86 Shares of NVIDIA Co . ( NASDAQ : NVDA ) "
2023-12-27,49.39223098754883,49.41699981689453,49.68000030517578,49.084999084472656,49.51100158691406,233648000,0.0028004017125837777,48.97078967354144,48.214046269547005,NVDA,Nvidia Corporation,"Top tech trusts 2023 : Microsoft , Meta and Nvidia brought stellar returns for united kingdom investors"
2023-12-28,49.4971809387207,49.52199935913086,49.88399887084961,49.4119987487793,49.643001556396484,246587000,0.002124827104860616,49.102387489836254,48.33069487583552,NVDA,Nvidia Corporation,5 Best Stocks to Buy in 2024 According to Billionaire D . E . Shaw
2023-12-29,49.4971809387207,49.52199935913086,49.99700164794922,48.750999450683594,49.8129997253418,389293000,0.0,49.20108585205737,48.43673906337054,NVDA,Nvidia Corporation,Tevis Investment Management Trims Stock Holdings in NVIDIA Co . ( NASDAQ : NVDA )  | Powell Investment Advisors LLC Buys 533 Shares of NVIDIA Co . ( NASDAQ : NVDA )  | MinichMacGregor Wealth Management LLC Has $4 . 65 Million Stock Position in NVIDIA Co . ( NASDAQ : NVDA )  | First Affirmative Financial Network Purchases 527 Shares of NVIDIA Co . ( NASDAQ : NVDA )  | Bard Financial Services Inc . Purchases 290 Shares of NVIDIA Co . ( NASDAQ : NVDA ) 
2024-01-02,48.143856048583984,48.167999267578125,49.29499816894531,47.595001220703125,49.24399948120117,411254000,,48.143856048583984,48.143856048583984,NVDA,Nvidia Corporation,"Apple , Tesla and Nvidia were among 2023  magnificent seven  stocks – here what to expect from them all in 2024"
2024-01-03,47.545162200927734,47.569000244140625,48.183998107910156,47.31999969482422,47.48500061035156,320896000,-0.012435519229122005,47.99418258666992,48.08942933516069,NVDA,Nvidia Corporation,"BP , L & G , Lloyds and Tesla most bought shares for united kingdom investors in 2023 , bargain hunting rules in December | WASHINGTON TRUST Co Sells 4 , 349 Shares of NVIDIA Co . ( NASDAQ : NVDA )  | NVIDIA Co . ( NASDAQ : NVDA ) Shares Sold by Opal Wealth Advisors LLC | 12 Best Artificial Intelligence Stocks To Buy for 2024 According to Financial Media"
2024-01-04,47.97394561767578,47.99800109863281,48.5,47.507999420166016,47.766998291015625,306535000,0.009018444714437912,47.98912334442139,48.07893081538933,NVDA,Nvidia Corporation,3 AI - Backed Stocks That Could Return Magnificent Gains in 2024 | NVIDIA Co . ( NASDAQ : NVDA ) Shares Sold by North Growth Management Ltd . 
2024-01-05,49.072391510009766,49.09700012207031,49.547000885009766,48.305999755859375,48.46200180053711,415039000,0.0228967177535897,48.25994038581848,48.169245423991185,NVDA,Nvidia Corporation,Analyst who warned Nvidia stock could fall has a new price target
2024-01-08,52.22681427001953,52.25299835205078,52.275001525878906,49.479000091552734,49.512001037597656,642510000,0.06428100736370945,49.251658856868744,48.538115319084675,NVDA,Nvidia Corporation,NVIDIA Corporation ( NVDA ) Rose on Strong Execution and Leadership Position | NVIDIA and Developers Pioneer Lifelike Digital Characters for Games and Applications With NVIDIA Avatar Cloud Engine | Getty and Nvidia collaborate on new AI - generated images platform | Nvidia Is Still Misunderstood By A Lot Of Investors ( NASDAQ : NVDA )  | Wave of EV Makers Choose NVIDIA DRIVE for Automated Driving
2024-01-09,53.11336898803711,53.13999938964844,54.32500076293945,51.689998626708984,52.4010009765625,773100000,0.016975087039273973,50.217086389660835,48.95404747080762,NVDA,Nvidia Corporation,Asian stocks rise as tech surges on AI hype ; Inflation remains in focus By Investing . com
2024-01-10,54.32276153564453,54.349998474121094,54.599998474121094,53.48899841308594,53.61600112915039,533796000,0.022770021383501815,51.24350517615676,49.4421123857928,NVDA,Nvidia Corporation,Blue - Chip Bargains : 3 Stocks with 50 % Upside in 2024 | Ledge Wealth Management Inc . Purchases 241 Shares of NVIDIA Co . ( NASDAQ : NVDA ) 
2024-01-11,54.794525146484375,54.821998596191406,55.34600067138672,53.560001373291016,54.999000549316406,596759000,0.008684455603942265,52.13126016873866,49.92869536403749,NVDA,Nvidia Corporation,"US close : Markets gain ahead of CPI data , Meta leads tech stocks higher | First National Corp MA ADV Sells 305 Shares of NVIDIA Co . ( NASDAQ : NVDA )  | Raymond James & Associates Sells 42 , 783 Shares of NVIDIA Co . ( NASDAQ : NVDA ) "
2024-01-12,54.68258285522461,54.709999084472656,54.970001220703125,54.33000183105469,54.619998931884766,352994000,-0.0020429466440398114,52.76909084036015,50.36086695414541,NVDA,Nvidia Corporation,"NVIDIA Co . ( NASDAQ : NVDA ) Insider Sells $218 , 079 . 00 in Stock | 10 Best AI Stocks for 2024 - Insider Monkey"
2024-01-16,56.35374450683594,56.38199996948242,56.834999084472656,54.900001525878906,55.018001556396484,449580000,0.030561132345116704,53.6652542569791,50.90567400439,NVDA,Nvidia Corporation,"The future AI economy is already here | Supercharge Web AI model testing : WebGPU , WebGL , and Headless Chrome  | Blog"
2024-01-17,56.0249137878418,56.053001403808594,56.47100067138672,54.7400016784668,56.34700012207031,474394000,-0.0058351174686227525,54.25516913969477,51.37105943924925,NVDA,Nvidia Corporation,"Nvidia Left Out , But These Chip Stocks Make The Cut As Barclay Preferred Picks :  There Isnt A Ton Of Low - Hanging Fruit At These Level - iShares Semiconductor ETF ( NASDAQ : SOXX )  | Bellevue Asset Management LLC Sells 143 Shares of NVIDIA Co . ( NASDAQ : NVDA )  | 3 Artificial Intelligence ( AI ) Stocks That Could Make You a Millionaire"
2024-01-18,57.07838439941406,57.106998443603516,57.599998474121094,56.106998443603516,57.2599983215332,491650000,0.018803609686247835,54.960972954624594,51.88990716290059,NVDA,Nvidia Corporation,Purpose Investments announces the expansion of its Yield Shares suite with the launch of NVIDIA and Microsoft Yield Shares ETFs
2024-01-19,59.461181640625,59.49100112915039,59.5,57.224998474121094,57.98899841308594,543501000,0.04174605266569875,56.086025126124696,52.57820484269372,NVDA,Nvidia Corporation,"Stock Market Live Updates : Sensex and Nifty rebound after three - day slump , tracking Asian gains"
2024-01-22,59.62410354614258,59.65399932861328,60.33100128173828,59.06999969482422,60.04899978637695,452955000,0.0027399708687636526,56.970544731129166,53.218741088461805,NVDA,Nvidia Corporation,NVIDIA Corporation ( NVDA ) Stock Rocketed Over 200 % in 2023
2024-01-23,59.842994689941406,59.87300109863281,59.90999984741211,58.584999084472656,59.56999969482422,294654000,0.0036711854901001484,57.688657220832226,53.82094596132358,NVDA,Nvidia Corporation,"Myriad Venture Partners Launches Inaugural Fund , Secures $100M in Initial Capital Commitments to Support Transformational Founders in AI , B2B Software and Clean Tech"
2024-01-24,61.33124923706055,61.36199951171875,62.8489990234375,59.9379997253418,60.30400085449219,560271000,0.024869319371968013,58.59930522488931,54.50370080457239,NVDA,Nvidia Corporation,"REDW Wealth LLC Has $573 , 000 Stock Position in NVIDIA Co . ( NASDAQ : NVDA ) "
2024-01-25,61.586116790771484,61.617000579833984,62.71900177001953,60.849998474121094,62.349998474121094,482777000,0.004155590451546232,59.346008116359855,55.147556803317755,NVDA,Nvidia Corporation,"Cyngn Shares Jump After It Says Following Tesla Strategy , Shifts to Nvidia AI Computers For Autonomous Vehicles Why Autonomous Vehicle Technology Company Cyngn ( CYN ) Shares Are Jumping Today - Cyngn ( NASDAQ : CYN )  | Cyngn Shares Jump After It Says Following Tesla Strategy , Shifts to Nvidia AI Computers For Autonomous Vehicles Why Autonomous Vehicle Technology Company …  | AI chip revenues on track to surpass $126bn by 2027"
2024-01-26,61.00041198730469,61.03099822998047,61.78300094604492,60.573001861572266,60.959999084472656,390309000,-0.00951033827082537,59.75960908409606,55.67963454731657,NVDA,Nvidia Corporation,"Intel , Nvidia , AMD , Processa Pharmaceuticals , Tesla : Why These 5 Stocks Are On Investor Radars Today - Intel ( NASDAQ : INTC ), Advanced Micro Devices ( NASDAQ : AMD ) "
2024-01-29,62.43369674682617,62.46500015258789,62.48899841308594,60.90700149536133,61.231998443603516,348733000,0.02349631277604769,60.42813099977859,56.29364020181744,NVDA,Nvidia Corporation,AI Regulation in India : Current State and Future Perspectives | Morgan Lewis - Tech & Sourcing
2024-01-30,62.74253463745117,62.77399826049805,63.49300003051758,62.2599983215332,62.900001525878906,410735000,0.0049466539179534585,61.00673190919673,56.8799033323296,NVDA,Nvidia Corporation,"Gilbert & Cook Inc . Has $2 . 60 Million Stock Position in NVIDIA Co . ( NASDAQ : NVDA )  | Ingalls & Snyder LLC Sells 1 , 654 Shares of NVIDIA Co . ( NASDAQ : NVDA ) "
2024-01-31,61.49616622924805,61.527000427246094,62.26900100708008,60.70000076293945,61.439998626708984,453795000,-0.019864808066889394,61.12909048920956,57.299563595685825,NVDA,Nvidia Corporation,Big Tech earnings : Disappointed market expects infinite AI money glitch | Nvidia : Key Implications From AMD Q4 Earnings ( NASDAQ : NVDA ) 
2024-02-01,62.99541473388672,63.027000427246094,63.191001892089844,61.650001525878906,62.099998474121094,369146000,0.024379544231256878,61.59567155037885,57.81736824461318,NVDA,Nvidia Corporation,NVIDIA Sets Conference Call for Fourth - Quarter Financial Results | AI Salary Data : How Much Top Startups Like OpenAI and Anthropic Pay
2024-02-02,66.12683868408203,66.16000366210938,66.5999984741211,63.689998626708984,63.9739990234375,476578000,0.04970875996964974,62.72846333380465,58.57277464820125,NVDA,Nvidia Corporation,"AMD bets on AI - powered PCs as artificial intelligence race with Nvidia , Intel heats up | This Is How Much Nvidia Top Executives Made in 2023 | Aetina Introduces New MXM GPUs Powered by NVIDIA Ada Lovelace for Enhanced AI Capabilities at the Edge | Aetina Introduces New MXM GPUs Powered by NVIDIA Ada Lovelace for Enhanced AI Capabilities at the Edge | NVIDIA ( NASDAQ : NVDA ) Rating Reiterated by Cantor Fitzgerald"
2024-02-05,69.2972640991211,69.33200073242188,69.49700164794922,67.20500183105469,68.2249984741211,680078000,0.047944608847636294,64.37066352513375,59.54772823464851,NVDA,Nvidia Corporation,"Share Market Highlights 5 February 2024 : Sensex falls 354 pts ; Nifty settles above 21 , 750 pts ; Tata Motors gains over 5 %, UPL slumps over 10 % "
2024-02-06,68.18881225585938,68.2229995727539,69.75399780273438,66.30000305175781,69.62999725341797,683111000,-0.01599560758526075,65.32520070781516,60.33328132748586,NVDA,Nvidia Corporation,"Nvidia : Near All - Time Highs , Yet Reasonably Valued With Widening AI Tailwinds ( NVDA )  | Huawei Prioritizes AI Chip Production Over Mate 60 Amid Tech Race | Palantir Q4 : The  Nvidia Moment  Approaches ( NYSE : PLTR ) "
2024-02-07,70.06385803222656,70.0989990234375,70.22000122070312,67.5999984741211,68.31900024414062,495575000,0.027497850664000456,66.50986503891801,61.21787920973502,NVDA,Nvidia Corporation,"Artificial Intelligence Chip Market Size 2024 - 2032 : Top Companies Growth , Analysis And Forecast Report"
2024-02-08,69.60608673095703,69.64099884033203,70.79399871826172,69.45500183105469,70.0739974975586,414422000,-0.006533629664797758,67.28392046192776,61.980443529846106,NVDA,Nvidia Corporation,"NVIDIA Co . ( NASDAQ : NVDA ) Shares Purchased by Argonautica Private Wealth Management Inc .  | Arizona State Retirement System Has $304 . 12 Million Stock Position in NVIDIA Co . ( NASDAQ : NVDA )  | Sonata Capital Group Inc . Purchases Shares of 480 NVIDIA Co . ( NASDAQ : NVDA )  | 3 , 291 Shares in NVIDIA Co . ( NASDAQ : NVDA ) Acquired by Must Asset Management Inc . "
2024-02-09,72.09687042236328,72.13300323486328,72.18499755859375,70.21199798583984,70.53299713134766,436637000,0.03578399258435083,68.48715795203664,62.90011870189312,NVDA,Nvidia Corporation,AI All - Stars : 3 Top - Notch Stocks to Own for 2024 and Beyond | 3 Megacap Tech Stocks to Ride to Massive Gains
2024-02-12,72.21178436279297,72.24800109863281,74.61100006103516,71.25,72.5999984741211,613710000,0.0015938825049754968,69.41831455472573,63.74663376197492,NVDA,Nvidia Corporation,"Graphics Add - In Board ( AIB ) Market Share , Size , Trends , Segments And Forecast By 2024 - 32 | Beamr and NVIDIA team up to accelerate adoption of the newest video standard | NVIDIA ( NVDA )  Overweight  Rating Reiterated at Cantor Fitzgerald | NVIDIA ( NVDA )  Overweight  Rating Reiterated at Cantor Fitzgerald"
2024-02-13,72.09186553955078,72.12799835205078,73.44999694824219,69.62000274658203,70.4000015258789,602580000,-0.001660654480433732,70.08670230093199,64.50529119629999,NVDA,Nvidia Corporation,"WallStreetBets Is Buzzing About Chip Stocks : Here What Traders Are Saying About Nvidia , Arm , Super Micro Computer - ARM Holdings ( NASDAQ : ARM ) "
2024-02-14,73.86297607421875,73.9000015258789,74.23600006103516,71.93800354003906,73.2020034790039,504917000,0.024567411613121815,71.03077074425369,65.35598982156533,NVDA,Nvidia Corporation,Nvidia Stock : Buy Protection Before Earnings ( NASDAQ : NVDA )  | Stock Index Futures Mixed as Investors Await More Corporate Earnings and Fed Speak
2024-02-15,72.62158203125,72.65799713134766,73.9749984741211,72.4000015258789,73.86900329589844,420122000,-0.016806715745130263,71.42847356600276,66.01649820426394,NVDA,Nvidia Corporation,"Think Nvidia Stock Price Is Crazy ? Maybe Not , According to 1 Wall Street Analyst | Nvidia Stock : UBS Note Should Raise Alarms ( NASDAQ : NVDA )  | History Says the Nasdaq Will Surge in 2024 : 3 Artificial Intelligence ( AI ) Stocks to Buy Before It Does | History Says the Nasdaq Will Surge in 2024 : 3 Artificial Intelligence ( AI ) Stocks to Buy Before It Does | The Next Nvidia ? 3 Semiconductor Stocks That Investors Shouldnt Ignore"
2024-02-16,72.57660675048828,72.61299896240234,74.4020004272461,72.5009994506836,74.0999984741211,495327000,-0.000619310121092731,71.71550686212414,66.61287170846614,NVDA,Nvidia Corporation,"State of New Jersey Common Pension Fund D Sells 50 , 918 Shares of NVIDIA Co . ( NASDAQ : NVDA )  | Catalyst watch : Nvidia , Walmart and Home Depot are under the earnings spotlight | The Next Nvidia ? 3 Semiconductor Stocks That Investors Shouldnt Ignore | NVIDIA Co . ( NASDAQ : NVDA ) Stock Holdings Trimmed by Summit Place Financial Advisors LLC"
2024-02-20,69.41719818115234,69.4520034790039,71.95600128173828,67.73400115966797,71.9469985961914,704833000,-0.04353205131507032,71.1409296918812,66.86781047871034,NVDA,Nvidia Corporation,"US stocks slip as Nvidia drags tech lower ; Walmart jumps on earnings beat By Investing . com | Stocks Set to Open Lower as Investors Await FOMC Minutes and Nvidia Earnings | Nvidia flips Tesla , suffers pre - earnings performance anxiety | Could Nvidia become the most valuable stock on earth ?  | ASX to fall , Nvidia drops as profit taking hammers Nasdaq"
2024-02-21,67.43819427490234,67.47200012207031,68.88800048828125,66.24800109863281,68.00599670410156,673755000,-0.028508841585417444,70.21524583763649,66.91966355109143,NVDA,Nvidia Corporation,"Nvidia guidance tops estimates as AI - led chip demand continues ; shares jump By Investing . com | Asian chipmaking stocks on edge before Nvidia Q4 earnings test By Investing . com | NVIDIA Posts 769 % Annual Profit Growth In Q4 - Shares Soar By 10 %  | Nvidia guidance tops estimates as AI - led chip demand continues ; shares jump By | US close : Stocks mixed following FOMC minutes , Nvidia earnings in focus"
2024-02-22,78.49864959716797,78.53800201416016,78.57499694824219,74.22000122070312,75.0250015258789,865100000,0.16400877041842543,72.28609677751936,67.9722986461893,NVDA,Nvidia Corporation,"Nvidia Q4 Earnings : Great Company , Shaky Stock Valuation ( NASDAQ : NVDA )  | Stock Market Live Updates 22 February 2024 : Japan stocks , US futures rise ; oil gains over 1 %  | Nvidia guidance tops estimates as AI - led chip demand continues ; shares jump By Investing . com | Asian chip stocks rally as Nvidia earnings fuel AI hype By Investing . com |   Self - Driving Cars Will Take Time : Munster Explains What Nvidia Q4 Automotive Revenue Slide Means For Future Of EVs - KraneShares Electric Vehicles and Future Mobility Index ETF ( ARCA : KARS ) "
2024-02-23,78.77751159667969,78.81700134277344,82.39399719238281,77.56999969482422,80.79000091552734,829388000,0.0035524432705882347,73.90895048230945,68.95459073259752,NVDA,Nvidia Corporation,Thai Stock Market May See Additional Support On Friday | Thai Stock Market May See Additional Support On Friday | Pelosi husband made over $1 . 25 million on Nvidia stock bet in just three months
2024-02-26,79.05237579345703,79.09200286865234,80.64600372314453,78.50499725341797,79.69999694824219,503973000,0.003489120070009122,75.19480681009634,69.87257119267566,NVDA,Nvidia Corporation,"Pelosi banks $1 . 4M in 90 days from Nvidia stock option trade , outraging watchers By Investing . com | Pelosi banks $1 . 4M in 90 days from Nvidia stock option trade , outraging watchers"
2024-02-27,78.66156005859375,78.70099639892578,79.4800033569336,77.16200256347656,79.38099670410156,391705000,-0.004943756983147196,76.06149512222069,70.6715701804864,NVDA,Nvidia Corporation,"Connor Clark & Lunn Investment Management Ltd . Sells 21 , 318 Shares of NVIDIA Co . ( NASDAQ : NVDA )  | Cathie Wood Explains Why She Sold Nvidia  At The Bottom , But More Importantly Tells Why She Purchased The Shares In The First Place - NVIDIA ( NASDAQ : NVDA ), ARK Innovation ETF ( ARCA : ARKK )  | Certified Advisory Corp Trims Stock Holdings in NVIDIA Co . ( NASDAQ : NVDA )  | NVIDIA Co . ( NASDAQ : NVDA ) Shares Sold by Natixis Advisors L . P .  | Brasada Capital Management LP Purchases Shares of 4 , 835 NVIDIA Co . ( NASDAQ : NVDA ) "
2024-02-28,77.62408447265625,77.66300201416016,78.93299865722656,77.125,77.62000274658203,393110000,-0.013189105138071255,76.45214245982959,71.30361693432002,NVDA,Nvidia Corporation,Profund Advisors LLC Has $89 . 74 Million Stake in NVIDIA Co . ( NASDAQ : NVDA )  | Should You Hold Nvidia ( NVDA )? - Insider Monkey | NVIDIA Corporation ( NVDA ) Corporation Rose Due to Unprecedented Demand Acceleration For Generative AI | Should You Hold Nvidia ( NVDA )?  | Nvidia Momentum Appears Done ( NASDAQ : NVDA ) 
2024-02-29,79.07235717773438,79.11199951171875,79.98999786376953,78.3499984741211,79.09400177001953,507289000,0.018657517379007338,77.10719613930578,72.00986604735769,NVDA,Nvidia Corporation,"Tiemann Investment Advisors LLC Sells 289 Shares of NVIDIA Co . ( NASDAQ : NVDA )  | Treasurer of the State of North Carolina Buys 34 , 492 Shares of NVIDIA Co . ( NASDAQ : NVDA )  | Seven Mile Advisory Acquires 206 Shares of NVIDIA Co . ( NASDAQ : NVDA )  | NVIDIA Co . ( NASDAQ : NVDA ) Shares Sold by Rench Wealth Management Inc .  | Reuter James Wealth Management LLC Sells 239 Shares of NVIDIA Co . ( NASDAQ : NVDA ) "
2024-03-01,82.23776245117188,82.27899932861328,82.30000305175781,79.43499755859375,80.0,479135000,0.04003175555172178,78.38983771727231,72.9396748113408,NVDA,Nvidia Corporation,Major Stocks in AI - Live Trading News | S & P 500 Gains and Losses Today : Hormel Foods Shares Boosted by Volume Growth
2024-03-04,85.19427490234375,85.23699951171875,87.69499969482422,83.71900177001953,84.12999725341797,615616000,0.03595078906636462,80.09094701354017,74.05372936506834,NVDA,Nvidia Corporation,"US stock futures edge lower amid rate uncertainty , pre - earnings angst | NVIDIA Co . ( NASDAQ : NVDA ) Shares Bought by Alberta Investment Management Corp | NVIDIA Co . ( NASDAQ : NVDA ) Shares Purchased by LaSalle St . Investment Advisors LLC | LaSalle St . Investment Advisors LLC Acquires 73 Shares of NVIDIA Co . ( NASDAQ : NVDA )  | Legal & General Group Plc Sells 714 , 106 Shares of NVIDIA Co . ( NASDAQ : NVDA ) "
2024-03-05,85.9249496459961,85.96399688720703,86.09700012207031,83.41699981689453,85.2699966430664,520639000,0.008576570954913265,81.54944767165415,75.13293120878905,NVDA,Nvidia Corporation,"TSMC , Samsung Lead Recovery In Asia Emerging Markets With AI And Chip Sector Growth - Alibaba Gr Holding ( NYSE : BABA ), iShares MSCI Emerging Markets ex China ETF ( NASDAQ : EMXC )  | LaSalle St . Investment Advisors LLC Acquires 73 Shares of NVIDIA Co . ( NASDAQ : NVDA )  | TSMC Raising Prices 8 . 7 % In 2024 As Revenue Growth Underperforms Customers ( TSM )  | NVIDIA Co . ( NASDAQ : NVDA ) Shares Acquired by Lowe Brockenbrough & Co . Inc .  | CrowdStrike Earnings on Tap : Can AI Cybersecurity Demand Spur Nvidia - Like Growth ? "
2024-03-06,88.65970611572266,88.69999694824219,89.7239990234375,87.02999877929688,88.02200317382812,582520000,0.0318272688083443,83.32701228267128,76.36263801851028,NVDA,Nvidia Corporation,TSMC Raising Prices 8 . 7 % In 2024 As Revenue Growth Underperforms Customers ( TSM )  | Cito Capital Group LLC Cuts Stock Holdings in NVIDIA Co . ( NASDAQ : NVDA )  | NVIDIA Co . ( NASDAQ : NVDA ) Shares Sold by The Manufacturers Life Insurance Company | NVIDIA Co . ( NASDAQ : NVDA ) Shares Sold by Jericho Capital Asset Management L . P .  | Old North State Trust LLC Has $1 . 87 Million Stock Holdings in NVIDIA Co . ( NASDAQ : NVDA ) 
2024-03-07,92.62689208984375,92.66899871826172,92.76699829101562,89.60199737548828,90.15799713134766,608119000,0.04474621164368564,85.6519822344644,77.84120657044969,NVDA,Nvidia Corporation,"Why Im Holding Off On Buying Nvidia Stock At Current Prices ( Rating Downgrade ) ( NVDA )  | NVIDIA Co . ( NASDAQ : NVDA ) Shares Sold by Morgan Stanley | Stonebridge Capital Advisors LLC Sells 1 , 378 Shares of NVIDIA Co . ( NASDAQ : NVDA ) "
2024-03-08,87.48823547363281,87.52799987792969,97.4000015258789,86.50599670410156,95.13800048828125,1142269000,-0.05547694087832156,86.1110455442565,78.71820919801179,NVDA,Nvidia Corporation,"Stock Market Today : S & P 500 closes at record as Nvidia leads bullish run in tech By Investing . com | Mark A . Stevens Sells 12 , 000 Shares of NVIDIA Co . ( NASDAQ : NVDA ) Stock | Beaird Harris Wealth Management LLC Sells 98 Shares of NVIDIA Co . ( NASDAQ : NVDA )  | Maripau Wealth Management LLC Buys 49 Shares of NVIDIA Co . ( NASDAQ : NVDA ) "
2024-03-11,85.73503112792969,85.77400207519531,88.7969970703125,84.16600036621094,86.42900085449219,678364000,-0.02003931541437365,86.01704194017479,79.3561021007316,NVDA,Nvidia Corporation,Is Nvidia Stock Becoming Too Volatile To Buy ? Best - Performing Stock On S & P 500 Tests Investor Nerves | NVIDIA Co . ( NASDAQ : NVDA ) Stock Holdings Lowered by Josh Arnold Investment Consultant LLC | NVIDIA Co . ( NASDAQ : NVDA ) Stock Position Lowered by Josh Arnold Investment Consultant LLC | Nvidia Stock : Was That A Blow - Off Top ?  | Tompkins Financial Corp Sells 551 Shares of NVIDIA Co . ( NASDAQ : NVDA ) 
2024-03-12,91.87125396728516,91.91300201416016,91.95999908447266,86.1500015258789,88.04900360107422,668075000,0.0715719439140261,87.48059494695238,80.4938431795092,NVDA,Nvidia Corporation,"US stock futures cheered by positive Oracle earnings , CPI data awaited By Investing . com | Nvidia Stock : Avoid The Trap ( NASDAQ : NVDA )  | How To Earn $500 A Month From NVIDIA Stock | Top Stock Movers Now : Oracle , Southwest Airlines , 3M , and More | IMA Wealth Inc . Cuts Stock Position in NVIDIA Co . ( NASDAQ : NVDA ) "
2024-03-13,90.84671020507812,90.88800048828125,91.50399780273438,88.43499755859375,91.05500030517578,635713000,-0.01115195143164005,88.32212376148382,81.43501290910636,NVDA,Nvidia Corporation,"Nvidia Stock : Avoid The Trap ( NASDAQ : NVDA )  | Symmetry Partners LLC Sells 3 , 989 Shares of NVIDIA Co . ( NASDAQ : NVDA )  | Raleigh Capital Management Inc . Purchases 581 Shares of NVIDIA Co . ( NASDAQ : NVDA )  | GoalVest Advisory LLC Purchases 114 Shares of NVIDIA Co . ( NASDAQ : NVDA )  | NVIDIA Co . ( NASDAQ : NVDA ) Shares Acquired by IMPACTfolio LLC"
2024-03-14,87.90404510498047,87.94400024414062,90.64600372314453,86.5999984741211,89.5770034790039,602318000,-0.03239154278074419,88.21760409735799,82.02310674509492,NVDA,Nvidia Corporation,"Tech Shares May Weigh On Taiwan Stock Market | Tech Shares May Weigh On Taiwan Stock Market | Stocks Fall As Hot Inflation Data Derails Fed Cut Bets , Bonds Tumble , VIX Rallies , Oil Tops $80 : What Driving Markets Thursday ? ( CORRECTED )  | Thai Stock Market May Turn Lower Again On Thursday | Thai Stock Market May Turn Lower Again On Thursday"
