Date,Adj Close,Close,High,Low,Open,Volume,Daily_Return,EMA_7,EMA_21,Ticker,Company,Headlines
2021-10-14,21.70250701904297,21.746000289916992,21.7549991607666,21.121999740600586,21.288000106811523,243589000,0.03854040909224077,20.987651329879874,21.075925370359435,NVDA,Nvidia Corporation,"Global Artificial Intelligence ( AI ) Market Outlook , 2026 - Mandated Work - From - Home ( WFH ) Policy due to the COVID - 19 Pandemic Creates Massive Demand | Global Artificial Intelligence ( AI ) Market Outlook , 2026 - Mandated Work - From - Home ( WFH ) Policy due to the COVID - 19 Pandemic Creates Massive Demand | Artificial Intelligence in Manufacturing Market Size , Status and Regional Outlook 2021 - 2026 | Bullish Or Bearish For Taiwan Semiconductor Manufacturing Company Limited ( NYSE : TSM ) In 2021 | A $138 . 4 Billion Global Opportunity for Hyperscale Data Centers by 2026"
2021-10-15,21.818273544311523,21.86199951171875,21.930999755859375,21.66200065612793,21.809999465942383,226994000,0.005334246645651408,21.19530688348779,21.143411567991443,NVDA,Nvidia Corporation,Meghan and Harry  sustainable  investment firm has shares in Rupert Murdoch Fox News
2021-10-18,22.17755699157715,22.222000122070312,22.291000366210938,21.643999099731445,21.749000549316406,189494000,0.01646708877015146,21.44086941051013,21.237424788317416,NVDA,Nvidia Corporation,Railroad Corporation 2 Release Date - Everything We Know | Patent assignment activity of major semiconductor vendors remains robust
2021-10-19,22.245424270629883,22.290000915527344,22.378999710083008,22.03700065612793,22.275999069213867,161473000,0.0030601783180406184,21.642008125540066,21.329061104891274,NVDA,Nvidia Corporation,Global Artificial Intelligence Market Is Expected To Set A New Benchmark With A CAGR Of 40 . 2 % By 2028 | Global Artificial Intelligence Market Is Expected To Set A New Benchmark With A CAGR Of 40 . 2 % By 2028 | Global Artificial Intelligence Market Is Expected To Set A New Benchmark With A CAGR Of 40 . 2 % By 2028
2021-10-20,22.058795928955078,22.10300064086914,22.433000564575195,21.98200035095215,22.30500030517578,146276000,-0.008389515947385462,21.74620507639382,21.395400634351617,NVDA,Nvidia Corporation,"Artificial Intelligence ( Ai ) In Drug Discovery Market 2021 - Global Industry Brief Analysis by Trend , "
2021-10-21,22.646615982055664,22.691999435424805,22.711000442504883,22.08300018310547,22.097000122070312,187590000,0.02664787574960048,21.97130780280928,21.509147484142893,NVDA,Nvidia Corporation,NVIDIA Introduces the Next Generation in Cloud Gaming | NVIDIA Ampere and AMD RDNA2 : Cutting - edge GPUs for CAD | Taiwan Semiconductor Manufacturing Company Limited ( TSM ): Worth Noting At $115 . 59
2021-10-22,22.680543899536133,22.72599983215332,23.1299991607666,22.56100082397461,22.822999954223633,249384000,0.001498145131588302,22.148616826990995,21.61563806736046,NVDA,Nvidia Corporation,NVIDIA CORPORATION : NVDA Stock Price | US67066G1040
2021-10-25,23.119667053222656,23.166000366210938,23.354999542236328,22.770000457763672,22.972999572753906,230235000,0.01936122676914742,22.39137938354891,21.752367975166113,NVDA,Nvidia Corporation,"Healthcare AI Market to hit $34 . 5 billion by 2027 , Says Global Market Insights Inc . "
2021-10-26,24.667566299438477,24.716999053955078,25.259000778198242,23.923999786376953,23.98900032043457,485898000,0.06695162359615625,22.9604261125213,22.017386004645417,NVDA,Nvidia Corporation,"Artificial Intelligence in Healthcare Market Growth Strategi ...  | AI as Service Market is Going to Boom with Megvii Technology Limited , Clarifai , Nvidia Corporation , Intel Corporation | AI as Service Market is Going to Boom with Megvii Technology Limited , Clarifai , Nvidia Corporation , Intel Corporation | AI as Service Market is Going to Boom with Megvii Technology Limited , Clarifai , Nvidia Corporation , Intel Corporation | Artificial Intelligence and Robotics in Aerospace and Defense Market is Going to Boom with Airbus SE , General Electric , The Boeing Company , Thales SA"
2021-10-27,24.402099609375,24.451000213623047,25.09000015258789,24.281999588012695,24.474000930786133,245990000,-0.010761770611700694,23.320844486734725,22.234178150529925,NVDA,Nvidia Corporation,Key Demand of North America AI in Computer Vision Market 2021 to Experience Major Revenue Surge in Near Future
2021-10-28,24.89112091064453,24.94099998474121,24.950000762939453,24.523000717163086,24.878000259399414,234204000,0.02004013216476075,23.713413592712175,22.475718401449434,NVDA,Nvidia Corporation,"Cloud Gaming Market Seeking New Highs - Current trends and gr ...  | Gaming Gadgets Market to rise at 8 . 2 % CAGR between 2021 and 2031 | Artificial intelligence ( AI ) Chips Market is Going to Boom with Qualcomm , Adapteva , Intel Corporation , Baidu , Graphcore | Artificial intelligence ( AI ) Chips Market is Going to Boom with Qualcomm , Adapteva , Intel Corporation , Baidu , Graphcore | Artificial intelligence ( AI ) Chips Market is Going to Boom with Qualcomm , Adapteva , Intel Corporation , Baidu , Graphcore"
2021-10-29,25.515869140625,25.566999435424805,25.708999633789062,25.0,25.000999450683594,292503000,0.025099240497172604,24.164027479690382,22.752095741374486,NVDA,Nvidia Corporation,Gaming Gadgets Market to rise at 8 . 2 % CAGR between 2021 and 2031 | Gaming Gadgets Market to rise at 8 . 2 % CAGR between 2021 and 2031 | Gaming Gadgets Market to rise at 8 . 2 % CAGR between 2021 and 2031
2021-11-01,25.775346755981445,25.82699966430664,25.893999099731445,25.226999282836914,25.64900016784668,265740000,0.010169264230287078,24.566857298763146,23.026936742702393,NVDA,Nvidia Corporation,"Global AI Infrastructure Market to be Driven by Growing Adoption of the Cloud Machine Learning System , Increasing Demand for AI Hardware in High - Performance Data Centres in the Forecast Period of 2021 - 2026 | Global AI Infrastructure Market to be Driven by Growing Adoption of the Cloud Machine Learning System , Increasing Demand for AI Hardware in High - Performance Data Centres in the Forecast Period of 2021 - 2026 | Global AI Infrastructure Market to be Driven by Growing Adoption of the Cloud Machine Learning System , Increasing Demand for AI Hardware in High - Performance Data Centres in the Forecast Period of 2021 - 2026"
2021-11-02,26.34819793701172,26.400999069213867,26.67799949645996,25.799999237060547,25.82200050354004,294112000,0.022224771074993876,25.012192458325288,23.328869578548694,NVDA,Nvidia Corporation,"Artificial intelligence Market - Market scenario , dynamics & trends and size .  | Was The Smart Money Right About Taiwan Semiconductor Mfg . Co . Ltd . ( TSM )? "
2021-11-03,26.5448055267334,26.597999572753906,26.784000396728516,26.235000610351562,26.670000076293945,239910000,0.0074618989196790775,25.395345725427315,23.62122739202003,NVDA,Nvidia Corporation,"Global AI In Pharma Market Research Report 2021 : Emerging Role of CROs in AI Ecosystems , Investments in AI Driven Biotech Firms , Rise In Merger And Acquisition Activity | Taiwan Semiconductor Manufacturing Company Limited ( NYSE : TSM ) Stock Forecast : Bearish Expectations Portend - 82 . 65 % Downside In 2021"
2021-11-04,29.741397857666016,29.801000595092773,31.364999771118164,27.118000030517578,27.229000091552734,1153631000,0.12042251836101481,26.48185875848699,24.177606525260575,NVDA,Nvidia Corporation,"Nvidia Up Over 8 %, on Track for Record High Close Data Talk | Newswire & Press Release / Oracle Announces New AI Services for Oracle Cloud Infrastructure - Engineering / Artificial Intelligence - Oracle Corporation | Newswire & Press Release / Oracle Announces New AI Services for Oracle Cloud Infrastructure - Engineering / Artificial Intelligence - Oracle Corporation"
2021-11-05,29.692495346069336,29.75200080871582,31.399999618530273,29.40999984741211,30.187000274658203,851260000,-0.001644257335539967,27.284517905382575,24.678960054425005,NVDA,Nvidia Corporation,"Where to buy Nvidia stock ( NVDA ): its valuation topped $700 billion for the first time | Nvidia ( NVDA ) Stock Up 12 %, Optimism Grows for Metaverse Opportunity"
2021-11-08,30.742395401000977,30.804000854492188,31.100000381469727,29.906999588012695,30.14900016784668,503101000,0.0353591048072901,28.148987279287176,25.230181449568274,NVDA,Nvidia Corporation,TD Ameritrade Investor Movement Index : October IMX Score Remains High Despite Small Dip
2021-11-09,30.595685958862305,30.656999588012695,32.310001373291016,29.964000701904297,32.28200149536133,646746000,-0.0047722189577295016,28.760661949180957,25.717954586776823,NVDA,Nvidia Corporation,Craig Johnson Recommends Buying This Stock in Semiconductor Space
2021-11-10,29.400083541870117,29.458999633789062,30.850000381469727,28.777999877929688,29.356000900268555,636206000,-0.03907748362300967,28.920517347353247,26.052693582694396,NVDA,Nvidia Corporation,NVIDIA Announces Platform for Creating AI Avatars
2021-11-11,30.329221725463867,30.389999389648438,30.59000015258789,29.777000427246094,30.468000411987305,332172000,0.03160324977548168,29.272693441880904,26.44146886840071,NVDA,Nvidia Corporation,"Digital Cities , Talking Toys : Nvidia Presents Its Vision Of The Metaverse | Newswire & Press Release / Oracle Announces New AI Services for Oracle Cloud Infrastructure - Engineering / Artificial Intelligence - Oracle Corporation | Newswire & Press Release / Oracle Announces New AI Services for Oracle Cloud Infrastructure - Engineering / Artificial Intelligence - Oracle Corporation | Bright Memory : Infinite Review - Gaming Nexus"
2021-11-12,30.329221725463867,30.389999389648438,30.68000030517578,29.6299991607666,30.010000228881836,413054000,0.0,29.536825512776645,26.794900946315543,NVDA,Nvidia Corporation,"Hyperscale Data Center Market 2021 by Manufacturer Share , Pr ...  | Global Multimedia Chipsets Market 2021 Manufacturer Landscape : STMicroelectronics , NXP Semiconductors , Qualcomm , NVIDIA , MediaTek | AI in Agriculture Market to Grow Extensively at Unstoppable Rate | AI in Agriculture Market to Grow Extensively at Unstoppable Rate | AI in Agriculture Market to Grow Extensively at Unstoppable Rate"
2021-11-15,29.964950561523438,30.024999618530273,30.643999099731445,29.246999740600586,30.552000045776367,384909000,-0.012010567473104472,29.643856774963343,27.083087274970804,NVDA,Nvidia Corporation,"GigaIO to Showcase FabreX Composable Computing Solutions at SC21 This Week | Supermicro Accelerates Delivery of HPC Clusters for Total IT Solutions with a Broad Portfolio of Servers , Storage , AI Solutions , and Liquid Cooling"
2021-11-16,30.142589569091797,30.202999114990234,30.389999389648438,29.70599937438965,29.759000778198242,264484000,0.00592822628569456,29.768539973495457,27.361223847163618,NVDA,Nvidia Corporation,"Target , Nvidia , Cicso Earnings : 3 Things to Watch By Investing . com | UK NVIDIA probe details revealed as Arm acquisition remains in limbo | Proposed acquisition of ARM Limited by NVIDIA Corporation : Phase 1 report and Phase 2 reference under Section 45 ( 4 ) of the Enterprise Act 2002"
2021-11-17,29.20248031616211,29.26099967956543,30.509000778198242,28.799999237060547,30.417999267578125,428508000,-0.03118873548587464,29.627025059162122,27.528610798890753,NVDA,Nvidia Corporation,"NVIDIA Corporation Q3 adjusted earnings Beat Estimates | Forget NVIDIA , Buy These 3 A - Rated Semiconductor Stocks Instead | Why Have Taiwan Semiconductor Manufacturing Company Limited ( NYSE : TSM ) Shares Declined So Much ? "
2021-11-18,31.611648559570312,31.674999237060547,32.7599983215332,31.320999145507812,32.367000579833984,781711000,0.08249875412380114,30.12318093426417,27.89979604986162,NVDA,Nvidia Corporation,"Nvidia Stock Surges On Q3 Earnings Beat , Metaverse Revenue Outlook | Nvidia Stock Trades Like A Meme After Q3 Earnings | NVIDIA Corporation ( NVDA ) Q3 2021 Earnings Call Transcript | NVIDIA / Arm merger inquiry"
2021-11-19,32.919036865234375,32.98500061035156,33.0880012512207,31.905000686645508,32.24300003051758,533867000,0.04135780211526674,30.82214491700672,28.356090669440963,NVDA,Nvidia Corporation,Mobile Artificial Intelligence ( AI ) Market Size to Reach $84 ...  | Artificial Intelligence ( AI ) in Drug Discovery Market is Set to Fly High in Years to Come | Artificial Intelligence ( AI ) in Drug Discovery Market is Set to Fly High in Years to Come | Artificial Intelligence ( AI ) in Drug Discovery Market is Set to Fly High in Years to Come | AI In Computer Vision Market Research Report 2021
2021-11-22,31.892087936401367,31.95599937438965,34.64699935913086,31.899999618530273,33.516998291015625,754335000,-0.031196202156131836,31.08963067185538,28.677544966437363,NVDA,Nvidia Corporation,"Global Edge AI Processor Market to Generate $8 , 059 . 7 Million , Shortage of Skilled Professionals Can Hinder the Growth of the Market"
2021-11-23,31.68250846862793,31.746000289916992,32.36000061035156,30.8799991607666,31.53499984741211,532163000,-0.006571519186557406,31.237850121048517,28.950723466636504,NVDA,Nvidia Corporation,Taiwan Semiconductor Manufacturing Company Limited ( NYSE : TSM ) Stock Forecast : Could Pass $207 . 00 In A Year
2021-11-24,32.60865020751953,32.67399978637695,32.85499954223633,30.92799949645996,31.461000442504883,435162000,0.02923195743192708,31.58055014266627,29.283262261262234,NVDA,Nvidia Corporation,"After Pullback From Q3 Earnings Surge , Nvidia Looks Tempting"
2021-11-26,31.43999481201172,31.503000259399414,32.709999084472656,31.350000381469727,32.599998474121094,283069000,-0.03583881540850531,31.54541131000263,29.479328856784914,NVDA,Nvidia Corporation,Top 10 Stock Picks of Rajiv Jain GQG Partners
2021-11-29,33.30924606323242,33.375999450683594,33.4119987487793,32.0359992980957,32.36600112915039,454964000,0.05945456614727407,31.986369998310078,29.82750314828014,NVDA,Nvidia Corporation,Taiwan Semiconductor Manufacturing Company Limited ( NYSE : TSM ) Loss Of - 3 . 00 % Profited Investors | Nvidia at risk of $1 . 25bn loss if Arm takeover falls through
2021-11-30,32.61064910888672,32.67599868774414,33.35300064086914,31.86400032043457,33.16899871826172,622066000,-0.02097306414619904,32.14243977595424,30.080516417426193,NVDA,Nvidia Corporation,"Cloud Telecommunication AI Market Size , Status , Share Analysis and Forecast to 2027 | Stop limiting AI success with legacy infrastructure | Tango Blockchain Brings Metaverse to the Future with Recent ...  | Tango Blockchain Brings Metaverse to the Future with Recent ...  | Tango Brings Play - to - Earn Gaming and Blockchain to Households"
2021-12-01,31.37596893310547,31.434999465942383,33.28900146484375,31.3799991607666,33.21900177001953,484368000,-0.037861257273924864,31.950822065242043,30.198284827942487,NVDA,Nvidia Corporation,Healthcare Artificial Intelligence ( AI ) Market Size to Reach Revenues of USD 44 . 5 Billion by 2026 | Healthcare Artificial Intelligence ( AI ) Market Size to Reach Revenues of USD 44 . 5 Billion by 2026 | Arizton Advisory & Intelligence : Healthcare Artificial Intelligence ( AI ) Market Size to Reach Revenues of USD 44 . 5 Billion by 2026
2021-12-02,32.065677642822266,32.125999450683594,32.47800064086914,31.024999618530273,31.214000701904297,472890000,0.021982068862551385,31.979535959637097,30.368047811113374,NVDA,Nvidia Corporation,Hyperscale Data Center Market - Global Industry Research Report 2020 - 2027 | Taiwan Semiconductor Manufacturing Company Limited ( TSM ) Sits And Waits For Direction At $120 . 28 Price | Taiwan bargaining chips ? – TechCrunch
2021-12-03,30.635364532470703,30.69300079345703,32.12900161743164,30.1299991607666,32.0,544325000,-0.04460573471372531,31.643493102845497,30.39234933123677,NVDA,Nvidia Corporation,"Cloud Artificial Intelligence Market Analysis , Trends and Fo ...  | Enterprise Artificial Intelligence ( AI ) Market size Expand with Significant CAGR during 2028 | Regulators in US , united kingdom , EU All Alarmed By Chip Maker Nvidia $40B Deal to Buy Chip Designer | Regulators in US , united kingdom , EU All Alarmed By Chip Maker Nvidia $40B Deal to Buy Chip Designer"
2021-12-06,29.9805965423584,30.03700065612793,30.240999221801758,28.038000106811523,29.8799991607666,658938000,-0.0213729459435128,31.227768962723722,30.35491725952055,NVDA,Nvidia Corporation,"Artificial Intelligence in the Global Healthcare Market 2021 - 2025 : A US$22 . 68 Billion Market by 2025 | Hedge Funds Are Cashing Out Of NVIDIA Corporation ( NVDA )  | Is NVIDIA ( NVDA ) A Great Investment Choice ?  | Global Artificial Intelligence ( AI ) Robots Market Report 2021 - 2026 : AI Robots Becoming Integral Weapon for Crime Control and Modern Warfare | Embedded AI Computing Platform Market is going to Boom with Aaeon , IBM , Synaptics"
2021-12-07,32.36610412597656,32.426998138427734,32.44900131225586,30.650999069213867,30.957000732421875,593053000,0.07956838284547718,31.51235275353693,30.53775242919837,NVDA,Nvidia Corporation,"INTEL Bargain Teck Stocks Trading at 15 . 5 % Discount Sale :: The Market Oracle ::  | Where to buy NVDA stock price dip | Tech Stocks are Facing a Reckoning After Months of Rapid Gains | Liqid Raises $100 Million To Drive Agile , Scalable , Sustainable Software - Defined Data Centers | Liqid Raises $100M To Drive Agile , Scalable , Sustainable Software - Defined Data Centers"
2021-12-08,31.766233444213867,31.826000213623047,32.290000915527344,31.42099952697754,31.999000549316406,475551000,-0.01853391682322514,31.575822926206165,30.649432521472505,NVDA,Nvidia Corporation,Data Center Market Size by Investment to Reach USD 251 Billion by 2026 | Arizton Advisory & Intelligence : Data Center Market Size by Investment to Reach USD 251 Billion by 2026 | Artificial Intelligence in Healthcare Market is expected to ...  | Lenovo Delivers Artificial Intelligence at the Edge to Drive Business Transformation | Accelerating success : SparkLabs Taipei Edgar Chiu | Taiwan News
2021-12-09,30.4327449798584,30.489999771118164,32.20500183105469,30.42799949645996,31.733999252319336,488507000,-0.04197817366976375,31.29005343961922,30.62973365405304,NVDA,Nvidia Corporation,10 Best Stocks to Buy Now According to Quant Billionaire Jim Simon Fund
2021-12-10,30.141294479370117,30.197999954223633,31.30500030517578,29.861000061035156,31.149999618530273,488825000,-0.009576871908241413,31.002863699556947,30.58533009271823,NVDA,Nvidia Corporation,"Artificial Intelligence ( AI ) Market projected to reach $309 . 6 billion by 2026 , with a remarkable CAGR of 39 . 7 %  | Artificial Intelligence ( AI ) Market projected to reach $309 . 6 billion by 2026 , with a remarkable CAGR of 39 . 7 %  | Artificial Intelligence ( AI ) Market projected to reach $309 . 6 billion by 2026 , with a remarkable CAGR of 39 . 7 %  | FTC Seeks to Maintain the Neutrality of the  Switzerland  of the Computing Industry by Suing to Block Nvidia Deal to Buy Arm"
2021-12-13,28.108118057250977,28.160999298095703,30.29400062561035,28.115999221801758,30.249000549316406,598344000,-0.06745484748542319,30.279177288980456,30.360128998584845,NVDA,Nvidia Corporation,"Artificial Intelligence in Genomics Market worth $1 , 671 million by 2025 - Complete Analysis Of Key Players , Growth Rate , Opportunities , Challenges"
2021-12-14,28.283788681030273,28.336999893188477,28.67799949645996,27.25,27.698999404907227,667035000,0.0062498180568861805,29.78033013699291,30.171370787898063,NVDA,Nvidia Corporation,GPUaaS Market revenue to hit $15 Bn by 2027 ; Global Market Insights Inc . 
2021-12-15,30.40180206298828,30.458999633789062,30.5,27.83799934387207,28.399999618530273,698297000,0.0748843588758159,29.93569811849175,30.19231908563354,NVDA,Nvidia Corporation,Hyperscale Data Center Market revenue to cross USD 60 Bn by 2027 : Global Market Insights Inc . 
2021-12-16,28.333694458007812,28.386999130249023,31.15999984741211,28.093000411987305,31.152000427246094,707366000,-0.06802582296587678,29.535197203370764,30.023353210394834,NVDA,Nvidia Corporation,Where to buy Nvidia stock ( NVDA ) as it roars back
2021-12-17,27.748796463012695,27.801000595092773,28.922000885009766,27.760000228881836,27.985000610351562,713758000,-0.02064319553745353,29.08859701828125,29.816575324269184,NVDA,Nvidia Corporation,Chart Wars : Will Nvidia or AMD Stock Break From This Bullish Pattern First ? 
2021-12-20,27.666948318481445,27.7189998626709,28.143999099731445,27.145000457763672,27.30500030517578,461847000,-0.0029496106124944355,28.733184843331298,29.621154687379388,NVDA,Nvidia Corporation,"Meme Stocks , a Retail Resurgence and More From the Stock Market in 2021"
2021-12-21,29.020402908325195,29.075000762939453,29.1200008392334,27.400999069213867,28.374000549316406,524385000,0.04891954740594384,28.80498935957977,29.56654088928355,NVDA,Nvidia Corporation,
2021-12-22,29.34479331970215,29.399999618530273,29.55500030517578,28.448999404907227,28.891000747680664,395184000,0.01117801198011259,28.939940349610367,29.546382019321605,NVDA,Nvidia Corporation,Billionaire Israel Englander is Buying These 10 Stocks
2021-12-23,29.584341049194336,29.639999389648438,30.05900001525879,29.430999755859375,29.7549991607666,343022000,0.008163210654864361,29.10104052450636,29.549832840219125,NVDA,Nvidia Corporation,"Insights on the Social Credit Global Market to 2026 - Featuring Alibaba , Tencent and Baidu Among Others | Nvidia Features as Top Pick By UBS"
2021-12-27,30.88689422607422,30.94499969482422,31.086999893188477,29.639999389648438,29.65999984741211,403686000,0.04402846677280836,29.547503949898324,29.67138387529686,NVDA,Nvidia Corporation,NVIDIA vs . Taiwan Semiconductor Manufacturing : Which Chip Stock is a Better Buy ? 
2021-12-28,30.265058517456055,30.32200050354004,31.329999923706055,30.011999130249023,31.312000274658203,420591000,-0.020132671937381774,29.726892591787756,29.72535429731133,NVDA,Nvidia Corporation,
2021-12-29,29.94466209411621,30.000999450683594,30.54800033569336,29.365999221801758,30.273000717163086,343139000,-0.01058634739315134,29.78133496736987,29.745291369748138,NVDA,Nvidia Corporation,NVIDIA Announces Upcoming Event for Financial Community
2021-12-30,29.53044319152832,29.586000442504883,30.457000732421875,29.540000915527344,29.82699966430664,308864000,-0.013832812715869003,29.71861202340948,29.7257597171827,NVDA,Nvidia Corporation,NVIDIA Announces Upcoming Event for Financial Community | NVIDIA Announces Upcoming Event for Financial Community | S & P 500 generates double - digit gains for third consecutive year
2022-01-03,30.064443588256836,30.121000289916992,30.711000442504883,29.78499984741211,29.815000534057617,391547000,,30.064443588256836,30.064443588256836,NVDA,Nvidia Corporation,"Malaysia Artificial intelligence ( AI ) Market Size 2021 Analysis by Top Key Players | Google Inc ., IBM Corporation , Microsoft Corporation , Nvidia Corporation – Industrial IT | NVIDIA Display Control Panel"
2022-01-04,29.235000610351562,29.290000915527344,30.468000411987305,28.349000930786133,30.277000427246094,527154000,-0.027588835145755164,29.857082843780518,29.989039681174535,NVDA,Nvidia Corporation,"Global Healthcare Artificial Intelligence Market ( 2021 to 2026 ) - Rising Investments In Advanced Drug Discovery & Development Processes Presents Opportunities - ResearchAndMarkets . com - Press Release | NVIDIA Expands Reach With New GeForce Laptops and Desktops ,  | NVIDIA Expands Reach With New GeForce Laptops and Desktops , GeForce NOW Partners , and Omniverse for Creators | NVIDIA Expands Reach With New GeForce Laptops and Desktops , GeForce NOW Partners , and Omniverse for Creators | The Worldwide Healthcare Artificial Intelligence Industry is Expected to Reach $44 . 5 Billion by 2026"
2022-01-05,27.552165985107422,27.604000091552734,29.416000366210938,27.533000946044922,28.948999404907227,498064000,-0.057562325640871714,29.280853629112244,29.767505708804798,NVDA,Nvidia Corporation,"Artificial Intelligence Chipsets market a comprehensive study by key players | Artificial Intelligence Chipsets market a comprehensive study by key players | Artificial Intelligence Chipsets market a comprehensive study by key players | Discrete GPU Market to Witness Rapid Growth by 2029 | NXP Semiconductors ( Netherlands ), Broadcom Limited ( US ), Toshiba ( Japan ) – Industrial IT | Image Recognition in Retail Market is Booming with Strong Growth Prospects | Leading Players : IBM , Google , Microsoft , Trax"
2022-01-06,28.12508773803711,28.17799949645996,28.437999725341797,27.065000534057617,27.639999389648438,454186000,0.020794073077208042,28.99191215634346,29.618194984189554,NVDA,Nvidia Corporation,"Artificial Intelligence in Healthcare Global Market : Global ...  | Image Recognition in Retail Market is Booming with Strong Growth Prospects | Leading Players : IBM , Google , Microsoft , Trax | Image Recognition in Retail Market is Booming with Strong Growth Prospects | Leading Players : IBM , Google , Microsoft , Trax | Image Recognition in Retail Market is Booming with Strong Growth Prospects | Leading Players : IBM , Google , Microsoft , Trax | Image Recognition in Retail Market is Booming with Strong Growth Prospects | Leading Players : IBM , Google , Microsoft , Trax"
2022-01-07,27.195837020874023,27.246999740600586,28.422000885009766,27.05699920654297,28.141000747680664,409939000,-0.03303992242862741,28.5428933724761,29.39798062388814,NVDA,Nvidia Corporation,"Why AMD , Nvidia , Qualcomm And Taiwan Semiconductor Shares Are Falling"
2022-01-10,27.34855079650879,27.399999618530273,27.4689998626709,25.643999099731445,26.58099937438965,594681000,0.00561533647659207,28.244307728484273,29.21166882139911,NVDA,Nvidia Corporation,NVIDIA Vs Taiwan Semiconductor : Which Is The Better Semiconductor Stock ? 
