Date,Adj Close,Close,High,Low,Open,Volume,Daily_Return,EMA_7,EMA_21,Ticker,Company,Headlines             
2021-12-23,48.644676208496094,58.709999084472656,60.08000183105469,58.310001373291016,59.81999969482422,39203200,-0.014105839021026134,48.62731967861218,46.11819580302868,PFE,Pfizer,Pfizer pill adds to growing U . S . stockpile of COVID - 19 treatments
2021-12-27,49.05067443847656,59.20000076293945,59.380001068115234,58.22999954223633,58.849998474121094,27362600,0.008346200686799143,48.73315836857827,46.384784769887574,PFE,Pfizer,BBIO Stock Crashes As Pfizer - Rivaling Heart Drug Flops In Key Test
2021-12-28,48.0646858215332,58.0099983215332,59.45000076293945,57.08000183105469,59.04999923706055,36901700,-0.0201014283336729,48.566040231817006,46.537503047309905,PFE,Pfizer,"Making a killing : Pfizer domination of the market for COVID jabs | James Smith ,  till 2020 CEO of R ( EU ) TERS , also a board member of Pfizer ! UPDATE : Also a seat in the Economic Council of the World Economic Forum ! – Investment Watch | Pfizer Invites Public to View and Listen to Webcast of February 8 Conference Call with Analysts | Pfizer Invites Public to View and Listen to Webcast of February 8 Conference Call with Analysts | Over 242 thou teenagers receive Pfizer COVID - 19 vaccine in Kazakhstan"
2021-12-29,47.708404541015625,57.58000183105469,58.029998779296875,57.06999969482422,57.310001373291016,26170200,-0.0074125373843172415,48.35163130911666,46.64394863764679,PFE,Pfizer,Vaccine Stocks Extend Losses ; Are More Covid Boosters Coming ? | Investor Business Daily
2021-12-30,48.3878288269043,58.400001525878906,58.7400016784668,57.529998779296875,57.75,24559000,0.014241186483286317,48.36068068856357,46.802483200306554,PFE,Pfizer,Why Pfizer Stock Is a Surefire Winner in 2022 | BioNTech Stock Jumps As Next FDA Covid Booster Decision Looms | Investor Business Daily
2022-01-03,46.937843322753906,56.650001525878906,58.54999923706055,56.34000015258789,58.5,57219200,,46.937843322753906,46.937843322753906,PFE,Pfizer,"Vaccine Stocks Pfizer , BioNTech Crumble ; FDA Expands Boosters | Investor Business Daily | Why Pfizer , BioNTech , and Moderna Stocks Are Falling Today | Why Pfizer , BioNTech , and Moderna Stocks Are Falling Today | Why Pfizer , BioNTech , and Moderna Stocks Are Falling Today"
2022-01-04,45.18130111694336,54.529998779296875,56.43000030517578,53.939998626708984,56.220001220703125,66993100,-0.0374227293259346,46.49870777130127,46.77815766768022,PFE,Pfizer,"Pfizer Stock Topples Despite New CDC Guidance For Covid Boosters | Pfizer Covid Booster Shot for Younger Teens Wins FDA Clearance , Stock Drops ( But Pfizer Underperformed S & P 500 Index Since Fed COVID Stimulus ) – Investment Watch | PFE Stock Price : Pfizer Inc and vaccine stocks sink to start the year | Illinois to Follow CDC Guidance Shortening Waiting Period for Pfizer COVID Shot Boosters | Why Pfizer , Novavax , and Ocugen Stocks Are Sinking Today"
2022-01-05,46.09272003173828,55.630001068115234,56.439998626708984,55.369998931884766,55.84000015258789,52956400,0.020172480478946042,46.39721083641052,46.71584515532186,PFE,Pfizer,"As COVID Leads to US Doubling Pfizer Pill Order , Will Stock Prices Reflect Demand ? "
2022-01-06,45.438148498535156,54.84000015258789,55.630001068115234,54.4900016784668,55.15999984741211,37000400,-0.014201191267349866,46.15744525194168,46.5996909137958,PFE,Pfizer,Pfizer shameless pandemic profiteering
2022-01-07,46.16727828979492,55.720001220703125,55.77000045776367,54.630001068115234,55.36000061035156,27703400,0.01604664396224842,46.15990351140499,46.560380675250265,PFE,Pfizer,"COVID Pfizer vaccine wont be ready for youngest children for months | COVID Pfizer vaccine wont be ready for youngest children for months | DOH expects arrival of Pfizer COVID - 19 vaccines for kids aged 5 - 11 by end of January or early February | Pfizer Covid vaccine protects adolescents against multisystem inflammatory syndrome , CDC says | Michigan health department urges residents 12+ to receive Pfizer booster"
2022-01-10,46.5981330871582,56.2400016784668,56.2599983215332,54.7400016784668,55.709999084472656,34044700,0.009332471250715235,46.269460905343294,46.56381271269644,PFE,Pfizer,Beam Stock : New CRISPR Player Snags $1 . 35 Billion Pfizer Deal | Investor Business Daily
2022-01-11,46.97098922729492,56.689998626708984,57.43000030517578,55.810001373291016,56.75,33576600,0.008001525285129318,46.4448429858312,46.60082875947812,PFE,Pfizer,"PFE Stock Slightly Up , Pfizer CEO Says Omicron Vaccine to Be Ready in March | Pfizer announces deal worth up to $1 . 3 billion with Beam ; Beam stock is up 4 . 9 %  | Pfizer using children as legal human shields to protect itself from covid vaccine lawsuits | Pfizer mRNA Day : Up - to - $1 . 35B Beam Partnership ; Alliances with Acuity , Codex DNA , and BioNTech"
2022-01-12,46.937843322753906,56.650001525878906,57.15999984741211,55.900001525878906,56.34000015258789,27608500,-0.0007056675851687677,46.56809307006188,46.631466447048645,PFE,Pfizer,Vaccine Stocks : Pediatric Shots Win Survey Support ; Will Regulators Get There ? 
2022-01-13,46.01814651489258,55.540000915527344,56.75,55.220001220703125,56.529998779296875,28117900,-0.019593929817723232,46.43060643126955,46.57571008957991,PFE,Pfizer,Pfizer Stock : What Next As Pfizer Continues Its Covid Makeover ? 
2022-01-14,45.529296875,54.95000076293945,55.380001068115234,54.5099983215332,54.97999954223633,27072500,-0.010622975432840964,46.205279042202164,46.480581615527186,PFE,Pfizer,"Free COVID - 19 vaccine clinics being held Jan . 14 - 17 around Travis County | Reuters  Fact Check  Shields Pfizer CEO , Fails to Disclose Reuters Chairman Is on Pfizer Board | Doctors Create  Declaration Of Independence  From Biden Vaccine Mandates Following Supreme Court Decision | Pfizer CEO Condemns SCOTUS Ruling As A  Clear Violation Of Our Constitutional Right To Produce Experimental Drugs And Use The Full Power Of Government To Force The Entire Population To Inject Them Into Their Bodies   | Promising results for COVID - 19 and pneumococcal vaccine co - administration"
2022-01-18,44.833309173583984,54.11000061035156,54.54999923706055,53.43000030517578,54.5,35598000,-0.01528659015593492,45.86228657504762,46.33082957535053,PFE,Pfizer,"Kazakhstan has stock of some 5 mln doses of coronavirus vaccine | Is Bristol Myers Squibb Stock A Better Pick Over This Vaccine Company ?  | Why BioNTech , Moderna , and Novavax Stocks Are Sinking Today | Why BioNTech , Moderna , and Novavax Stocks Are Sinking Today | Why BioNTech , Moderna , and Novavax Stocks Are Sinking Today"
2022-01-19,44.361026763916016,53.540000915527344,54.4900016784668,53.45000076293945,53.650001525878906,27300400,-0.010534185817946295,45.48697162226472,46.15175659249284,PFE,Pfizer,Pfizer Shares In Vitro Efficacy of Novel COVID - 19 Oral Treatment Against Omicron Variant
2022-01-20,44.783592224121094,54.04999923706055,54.52000045776367,53.06999969482422,53.959999084472656,35105300,0.009525601435104836,45.31112677272881,46.02737801354995,PFE,Pfizer,"Vaccine Stocks : Fauci Says FDA Could OK Pfizer Pediatric Shot  Next Month   | What Happening With BioNTech Stock ?  | Why BioNTech , Moderna , Novavax , and Ocugen Stocks Are Plunging This Week | Why BioNTech , Moderna , Novavax , and Ocugen Stocks Are Plunging This Week"
2022-01-21,43.73960494995117,52.790000915527344,54.869998931884766,52.459999084472656,54.41999816894531,41059000,-0.023311825209225034,44.9182463170344,45.81939864413188,PFE,Pfizer,"Fauci Pfizer Vaccine for kids under 5 will be approved in the next month … Kids should sue Fauci – Investment Watch | Over 274 , 000 Kazakhstanis get fully vaccinated with Pfizer vaccine | Pfizer and OPKO Provide Update on the Biologics License Application for Somatrogon for Pediatric Growth Hormone Deficiency | People 30 and Older Now Eligible for Pfizer COVID - 19 Vaccine | Free COVID - 19 vaccine clinics being held Jan . 21 - 24 around Travis County"
2022-01-24,42.70391082763672,51.540000915527344,52.060001373291016,49.81999969482422,51.75,59036400,-0.023678634580708735,44.36466244468498,45.53617247899595,PFE,Pfizer,"Pfizer Stock Topples After FDA Rejects OPKO - Partnered Rare Disease Drug | Pfizer , Opko Shares Fall After FDA Declines to Approve Somatrogon | Pfizer , Opko Stock Fall After FDA Declines to Approve Somatrogon"
2022-01-25,43.532470703125,52.540000915527344,52.84000015258789,51.2400016784668,51.36000061035156,43983200,0.01940243550134202,44.15661450929498,45.35401777209859,PFE,Pfizer,Here What to Look For in Pfizer Upcoming Earnings Report
2022-01-26,43.9218864440918,53.0099983215332,53.619998931884766,52.459999084472656,52.56999969482422,39644800,0.008945408672585309,44.09793249299419,45.22382401500706,PFE,Pfizer,Why Coronavirus Vaccine Stocks Topped the Market Today
2022-01-27,44.5563850402832,53.369998931884766,54.58000183105469,53.0,53.02000045776367,36957200,0.014446068863618988,44.21254562981645,45.163147744577614,PFE,Pfizer,Pfizer pushes to intervene in lawsuit seeking COVID vaccine information from FDA – Investment Watch
2022-01-28,45.35784912109375,54.33000183105469,54.66999816894531,53.099998474121094,53.77000045776367,28590400,0.017987637015120184,44.49887150263577,45.18084786971544,PFE,Pfizer,Bolton at - risk 5 to 11 year olds to be offered vaccine | Pfizer sweeps in to control the FDA and facilitate sweeping redactions of the court - ordered disclosure of their vaccine injury data | Is Pfizer About to Have Another Megablockbuster Drug in Its Lineup ?  | APH and Travis County providing free COVID - 19 vaccine clinics Jan . 28 - 31 | Britain to start rolling out Pfizer COVID - 19 pill next month
2022-01-31,43.98868942260742,52.689998626708984,54.13999938964844,52.38999938964844,54.0,38644600,-0.030185728049648586,44.37132598262868,45.07246982906926,PFE,Pfizer,"Why Pfizer Stock Is Sliding Today | The Motley Fool | Why Pfizer Stock Is Sliding Today | The Motley Fool | IONS Stock Crumbles After Pfizer Backs Out Of Heart - Disease Deal | Moderna Stock : Will FDA Covid Vaccine Approval Extend Sales ?  | Pfizer and Alex Therapeutics announce a Strategic Commercial Partnership to provide evidence - based Digital Therapeutics to patients , starting in Germany"
2022-02-01,44.305931091308594,53.06999969482422,53.15999984741211,52.38999938964844,52.7400016784668,27883300,0.007211891803671877,44.35497725979866,45.002784489272834,PFE,Pfizer,Why BioNTech Stock Is Climbing Higher Today | Why BioNTech Stock Is Climbing Higher Today
2022-02-02,44.96546173095703,53.86000061035156,54.130001068115234,52.45000076293945,52.84000015258789,32039300,0.014885831837936792,44.50759837758825,44.99939151124412,PFE,Pfizer,"Pfizer Paxlovid contract with the government has some surprises : Shots | Over 531 thou teens receive 1st shot of Pfizer vaccine in Kazakhstan | Pfizer , BioNTech seek emergency authorization for COVID - 19 vaccine for kids under 5 years of age | FDA to meet in mid - February to discuss Pfizer - BioNTech COVID - 19 vaccine for kids under 5 - Xinhua | Maine CDC Director says kids 5 and under could be vaccine eligible by March"
2022-02-03,44.56473159790039,53.380001068115234,53.88999938964844,53.09000015258789,53.33000183105469,22635800,-0.008911954145035539,44.52188168266629,44.95987697366742,PFE,Pfizer,Pfizer net profit rises 2 % at Rs 144 crore in December quarter
2022-02-04,44.24748611450195,53.0,53.43000030517578,52.630001068115234,53.02000045776367,24932200,-0.007118756739317722,44.45328279062521,44.89511416828874,PFE,Pfizer,"Pharmaceuticals Stocks , ETFs Could Have Power Beyond 2022"
2022-02-07,44.42280960083008,53.209999084472656,53.58000183105469,52.2400016784668,53.29999923706055,32358500,0.00396233778964139,44.44566449317642,44.85217738942886,PFE,Pfizer,All eyes on Pfizer Q4 earnings amid bolstered COVID - 19 vaccine forecast | Pfizer Reports Earnings Tuesday . What to Expect .  | Pfizer and Peloton Earnings ; API Report - 3 Things To Watch By Investing . com
2022-02-08,43.162174224853516,51.70000076293945,51.79999923706055,49.689998626708984,50.63999938964844,67922000,-0.028378109968825727,44.124791926095696,44.69854073810382,PFE,Pfizer,"Pfizer Stock Fell 2 . 8 %. Did Investors Misunderstand the Revenue Guidance ?  | Pfizer Stock Drops After Earnings . Guidance Fell Short of Estimates .  | Pfizer Stock Price Falls on Weak Guidance , Drags Down Moderna , Novavax | Pfizer Stock Price Falls on Weak Guidance , Drags Down Moderna , Novavax | Pfizer forecasts $54 billion in revenue in 2022 from sales of its Covid vaccine and antiviral pill"
2022-02-09,42.970157623291016,51.470001220703125,51.720001220703125,50.900001525878906,51.63999938964844,38522200,-0.004448724027714346,43.836133350394526,44.54141500039356,PFE,Pfizer,"Pfizer Stock Is Falling . Did Investors Misunderstand the Revenue Guidance ?  | PFE Stock Down 3 %, Pfizer Reports Better - than - Expected Q4 2021 Earnings and Raises Full - Year Sales Forecast for Covid Vaccine | Pfizer faces  pandemic profiteering  accusations as profit d ...  | Pfizer COVID sales forecast wipes $21 billion off vaccine stocks | Pfizer COVID sales forecast wipes $21 billion off vaccine stocks"
2022-02-10,42.24382400512695,50.599998474121094,51.369998931884766,50.38999938964844,51.040000915527344,34200600,-0.016903210468336094,43.43805601407763,44.332543091732965,PFE,Pfizer,"Pfizer Made $37 Billion from Vax Sales in 2021 , Forecasts Huge Profit Boost in 2022 – Investment Watch | Pfizer Revenue Doubles :  It Nothing Short of Pandemic Profiteering   | Feb 9 - Pfizer Q4 Earnings Report Warns That Unfavorable Safety Data May Affect Business | Biden controversial science adviser kept up to $1M in BioNTech stock while touting vaccine | Pfizer , UAE renew partnership to deal with early cancer detection , spread awareness"
2022-02-11,42.39410400390625,50.779998779296875,51.2400016784668,50.08000183105469,50.33000183105469,34997800,0.003557443065785426,43.177068011534786,44.15632135647599,PFE,Pfizer,Does The Current Dip In Pfizer Stock Offer A Buying Opportunity ? 
2022-02-14,41.57594680786133,49.79999923706055,50.5,48.47999954223633,49.81999969482422,42973100,-0.019298843913991837,42.77678771061642,43.92174185205647,PFE,Pfizer,"Why Pfizer , BioNTech , Moderna , and Novavax Stocks Are Sliding Today | Why Pfizer , BioNTech , Moderna , and Novavax Stocks Are Sliding Today | Moderna , Pfizer stocks fall as omicron Covid wave subsides in U . S .  | Moderna , Pfizer stocks fall as Covid omicron wave subsides in U . S .  | EXCLUSIVE : Pfizer Trial Whistleblower Presses Forward With Lawsuit Without US Government Help"
2022-02-15,41.567588806152344,49.790000915527344,50.040000915527344,49.209999084472656,49.79999923706055,29150000,-0.0002010297383631121,42.4744879845004,43.70772793879246,PFE,Pfizer,"Shares of Moderna , Pfizer , BioNTech Decline as New Cases of Omicron Variant Eases"
2022-02-16,41.47576141357422,49.68000030517578,50.779998779296875,49.43000030517578,49.59000015258789,27672600,-0.002209110396235725,42.224806341768854,43.504821891045346,PFE,Pfizer,"Moderna , Pfizer Stocks Fall as Covid Omicron Wave Subsides in U . S . "
2022-02-17,40.82456588745117,48.900001525878906,49.959999084472656,48.75,49.810001373291016,21231700,-0.01570062860642074,41.87474622818944,43.261162254354964,PFE,Pfizer,CDC discusses updated COVID vaccine guidance for J & J recipients | Pfizer Prevails In Proposed Class Action Over Chantix Recall | Facts Matter ( Feb . 16 ): Exclusive : Pfizer Clinical Trial Whistleblower Presses Forward With Lawsuit Without US Government Help
2022-02-18,40.51567077636719,48.529998779296875,49.52000045776367,48.20000076293945,48.779998779296875,26955300,-0.007566402835380348,41.53497736523387,43.01157211999244,PFE,Pfizer,3 Charts That Show Just How Ridiculously Massive Pfizer COVID - 19 Revenue Will Be in 2022 | Lawsuit Over Pfizer Disclosures Before Chantix Recall Is Dismissed
2022-02-22,39.68081283569336,47.529998779296875,48.310001373291016,47.349998474121094,47.540000915527344,34814800,-0.020605803252819466,41.07143623284874,42.70877582141979,PFE,Pfizer,A South African non - profit is going to court to break open Pfizer and J & J Covid - 19 secrets | BioNTech shares have dropped by over 60 percent in last 6 months
2022-02-23,39.12980270385742,46.869998931884766,48.15999984741211,46.779998779296875,47.59000015258789,25793000,-0.01388605959554079,40.586027850600914,42.38341462891412,PFE,Pfizer,"New CDC vaccine guidance : Some people should wait 8 weeks between COVID - 19 shots to reduce myocarditis risk | Time between Pfizer and Moderna Covid - 19 vaccines can be up to 8 weeks for some people , updated CDC guidance says :: WRAL . com | Time between Pfizer and Moderna Covid - 19 vaccines can be up to 8 weeks for some people , updated CDC guidance says | Time between Pfizer and Moderna Covid - 19 vaccines can be up to 8 weeks for some people , updated CDC guidance says | Time between Pfizer and Moderna COVID - 19 vaccines can be up to 8 weeks for some people , updated CDC guidance says"
2022-02-24,38.37008285522461,45.959999084472656,46.7599983215332,45.400001525878906,45.86000061035156,44227300,-0.0194153764173699,40.03204160175684,42.01856628585143,PFE,Pfizer,"As the pandemic raged , at least 75 lawmakers bought and sold stock in companies that make COVID - 19 vaccines , treatments , and tests – Investment Watch | Moderna Stock Surges On Q4 Earnings Beat , 2022 Vaccine Sales Boost | To expand profits , Pfizer partnered with CCP - linked pharmaceutical company that engaged in  military combat  with China People Liberation Army | CDC New Guidance on Second Vaccine Dosage | Power 620 | CDC New Guidance on Second Vaccine Dosage | 98 . 5 WYLD"
2022-02-25,39.83943557739258,47.720001220703125,48.029998779296875,45.7400016784668,45.810001373291016,31199200,0.038294228545505904,39.98389009566577,41.82046349417335,PFE,Pfizer,"120 Million Reasons to Buy Pfizer Stock on the Dip | 120 Million Reasons to Buy Pfizer Stock on the Dip | To expand profits , Pfizer partnered with CCP - linked pharmaceutical company that engaged in  military combat  with China People Liberation Army | Studies : No to very slight risk of hearing loss after COVID vaccine"
2022-02-28,39.188232421875,46.939998626708984,47.16999816894531,46.34000015258789,46.81999969482422,35296100,-0.016345692304112647,39.78497567721808,41.58116976032805,PFE,Pfizer,"Covid - 19 vaccine Novavax approved for use , stocks arriving soon"
2022-03-01,38.19476318359375,45.75,47.13999938964844,45.439998626708984,46.689998626708984,29854500,-0.025351213282247764,39.387422553811994,41.27331461698857,PFE,Pfizer,"Covid - 19 vaccine Novavax approved for use , stocks arriving soon | Mask guidance , new Pfizer study : Breaking down latest COVID info | Coronavirus - Ethiopia : The United States Shares 6 . 9+ Million Doses of COVID - 19 Vaccine with Ethiopia"
2022-03-02,39.822731018066406,47.70000076293945,47.93000030517578,46.0,46.11000061035156,36516200,0.042622802153462036,39.496249669875596,41.14144338072292,PFE,Pfizer,"Why Pfizer Stock Is Catching Fire Today | Covid - 19 vaccine does not cause sudden hearing loss , study finds"
2022-03-03,39.9312744140625,47.83000183105469,48.59000015258789,47.47999954223633,47.68000030517578,30553300,0.002725664293261376,39.60500585592232,41.03142802011743,PFE,Pfizer,"The Fiji Times » Pfizer vaccines offered for primary series in Fiji ; AstraZeneca still out of stock | People over profit : Pfizer and Moderna must share vaccine technology | As vaccine demand falls , states are left with huge stockpile | As vaccine demand falls , states are left with huge stockpile | Pfizer Inc . ( NYSE : PFE ) Shares Purchased by Bedel Financial Consulting Inc . "
2022-03-04,40.6158561706543,48.650001525878906,48.77000045776367,47.40999984741211,47.5,33217300,0.017143999700413026,39.85771843460532,40.99364876107533,PFE,Pfizer,"As vaccine demand falls , states are left with huge stockpiles | SA has enough vaccines in stock to reach herd immunity – but risks discarding 100 , 000 doses | As vaccine demand falls , states are left with huge stockpile :: WRAL . com | As Vaccine Demand Falls , States Are Left With Huge Stockpile | As vaccine demand falls , states are left with huge stockpile"
2022-03-07,40.056495666503906,47.97999954223633,48.84000015258789,47.52000045776367,48.25,33171300,-0.013771973728687215,39.907412742579965,40.9084530252052,PFE,Pfizer,"Viridian Ria LLC Buys Shares of 8 , 331 Pfizer Inc . ( NYSE : PFE )  | As Vaccine Demand Falls , U . S . States Left with Huge Stockpile"
2022-03-08,39.60567092895508,47.439998626708984,48.41999816894531,46.470001220703125,47.58000183105469,32913300,-0.011254722362690761,39.83197728917374,40.790018289182456,PFE,Pfizer,COVID - 19 Vaccine Risks May Outweigh Benefits for Healthy Children : New Florida Guidance | Pfizer Inc . ( NYSE : PFE ) Shares Acquired by HighTower Trust Services LTA | States see stockpiles as vaccine demand falls | Why BioNTech Stock Dropped 12 . 4 % in February | Should you buy Pfizer shares ? 
2022-03-09,40.6993408203125,48.75,49.220001220703125,48.0,48.130001068115234,24718900,0.027613972082918492,40.04881817195843,40.78177488292155,PFE,Pfizer,Vaccine Stocks Pop ; But Does Anyone Care Anymore ? | Investor Business Daily
2022-03-10,41.07502365112305,49.20000076293945,49.290000915527344,48.04999923706055,48.310001373291016,24542300,0.009230685884304313,40.305369541749585,40.80843386184896,PFE,Pfizer,Moderna and Other Vaccine Stocks Finally Rallied Wednesday . Buyers May Be Back . 
2022-03-11,41.968318939208984,50.27000045776367,50.900001525878906,48.939998626708984,49.13999938964844,33701900,0.021747894673738388,40.72110689111443,40.91387795979078,PFE,Pfizer,Why Pfizer Stock Jumped While the Market Stumbled Today | Pfizer Stock Jumps After It Adds A New Way To Compete With Bristol Myers | Pfizer Delisting from New York Stock Exchange | Where to buy Pfizer stock : it is in the green again despite rumors of delisting from NYSE | Pfizer Completes Acquisition of Arena Pharmaceuticals
2022-03-14,43.621341705322266,52.25,52.90999984741211,50.38999938964844,50.720001220703125,42314500,0.03938739525182511,41.44616559466639,41.16001102756637,PFE,Pfizer,"Pfizer to continue humanitarian supplies of medicines to Russia , all profits of Russian branch to be directed to humanitarian aid to Ukraine | Pfizer to Continue Delivering Medicines to Russia , But Donate Profits to Ukraine | Pfizer Says Will Continue Deliveries of Medicines to Russia , But Donate Profits to Ukraine | Why BioNTech , Dynavax , Novavax , and Pfizer Stocks Are Jumping Today | Why BioNTech , Dynavax , Novavax , and Pfizer Stocks Are Jumping Today"
2022-03-15,43.58794403076172,52.209999084472656,52.91999816894531,51.18000030517578,52.619998931884766,30172100,-0.0007656269444016317,41.981610203690224,41.38073220967504,PFE,Pfizer,Pfizer Donates All Profits in Russia to Ukraine
2022-03-16,44.180702209472656,52.91999816894531,53.27000045776367,52.18000030517578,52.540000915527344,29891400,0.013599131408735587,42.53138320513583,41.63527493692936,PFE,Pfizer,How Much Money Would Pfizer Make With a 4th COVID Vaccine Dose ?  | Pfizer - BioNTech Seek FDA Emergency Authorization for 4th COVID - 19 Vaccine Dose for Ages 65 and Over | Pfizer seeks approval for 4th COVID - 19 booster dose for seniors | Pfizer seeks approval for 4th COVID - 19 booster dose for seniors | Pfizer seeks approval for 4th COVID - 19 booster dose for seniors
2022-03-17,45.282711029052734,54.2400016784668,54.25,52.790000915527344,52.91999816894531,30598600,0.024943216482960384,43.21921516111506,41.966860036213305,PFE,Pfizer,"  Were a Free State : DeSantis Defends Florida New Guidance on COVID - 19 Vaccines for Children | Alnylam Files Patent Infringement Lawsuits Against Pfizer , Moderna"
2022-03-18,45.508121490478516,54.5099983215332,55.0,53.709999084472656,54.380001068115234,51815000,0.004977848196437762,43.79144174345592,42.28879289569196,PFE,Pfizer,"Alnylam Files Patent Infringement Lawsuits Against Pfizer , Moderna"
2022-03-21,45.240970611572266,54.189998626708984,55.29999923706055,53.900001525878906,54.2400016784668,34592500,-0.005870400055123071,44.153823960485006,42.557172688044716,PFE,Pfizer,Vaccine Stocks : Will Another Covid Booster Be Their Saving Grace ?  | Select pharma shares gain on tie - up for Pfizer Covid - 19 oral treatment drug | Canadian Pfizer Partner Sues to Head Off Patent Lawsuit Over COVID - 19 Vaccine | Pfizer recalls some lots of BP drug due to potential cancer - causing impurity
2022-03-22,44.2808837890625,53.040000915527344,54.31999969482422,52.5,54.20000076293945,32253600,-0.021221623000815648,44.18558891762938,42.71387369722815,PFE,Pfizer,Pfizer recalls some lots of BP drug due to potential cancer - causing impurity | Pfizer recalls some lots of blood pressure drug due to potential carcinogen | UPDATE 1 - Pfizer recalls some lots of blood pressure drug due to potential carcinogen | Pfizer recalls some lots of BP drug due to potential cancer - causing impurity | Pfizer recalls some blood pressure drug products over elevated levels of cancer - causing impurity
2022-03-23,43.571250915527344,52.189998626708984,53.5,52.15999984741211,53.02000045776367,29183700,-0.01602571612878323,44.03200441710387,42.7918170807099,PFE,Pfizer,Pfizer shares slide after it recalls blood pressure drug over cancer - risk fears | Moderna Stock : Will Moderna Beat Pfizer To The Finish With A Pediatric Covid Shot ?  | Pfizer recalls 3 blood pressure medications | Pfizer drug recall : Blood pressure meds may contain carcinogen | Pfizer drug recall : Blood pressure meds may contain carcinogen
