Date,Adj Close,Close,High,Low,Open,Volume,Daily_Return,EMA_7,EMA_21,Ticker,Company,Headlines             
2024-01-11,25.397602081298828,28.399999618530273,28.920000076293945,28.270000457763672,28.829999923706055,46884700,-0.020351909873592255,26.057571803685278,26.34609940847647,PFE,Pfizer,"Meitav Investment House Ltd . Has $6 . 61 Million Stock Position in Pfizer Inc . ( NYSE : PFE )  | Pfizer 2024 Outlook : Is PFE Stock Poised for a Major Rebound ?  | As COVID Vaccine Injury Lawsuits Increase , Liability Questions Arise"
2024-01-12,25.665891647338867,28.700000762939453,28.940000534057617,28.440000534057617,28.459999084472656,30373500,0.010563578607981627,25.959651764598675,26.28426233928214,PFE,Pfizer,"Allspring Global Investments Holdings LLC Purchases 475 , 157 Shares of Pfizer Inc . ( NYSE : PFE )  | Altrius Capital Management Inc Buys 13 , 169 Shares of Pfizer Inc . ( NYSE : PFE )  | Individual investors among Pyxis Oncology , Inc . ( NASDAQ : PYXS ) largest shareholders , saw gain in holdings value after stock jumped 18 % last week | Pfizer attempts to dismiss Texas lawsuit that accuses it of working to censor vaccine criticism – NaturalNews . com"
2024-01-16,25.326059341430664,28.31999969482422,28.719999313354492,28.219999313354492,28.600000381469727,38826000,-0.013240619518606889,25.801253658806672,26.197152975841096,PFE,Pfizer,"Mitchell & Pahl Private Wealth LLC Lowers Stock Holdings in Pfizer Inc . ( NYSE : PFE )  | Byrne Asset Management LLC Sells 1 , 390 Shares of Pfizer Inc . ( NYSE : PFE )  | Pfizer Inc . ( NYSE : PFE ) Shares Sold by Physicians Financial Services Inc .  | Pfizer Inc . ( NYSE : PFE ) Shares Sold by Physicians Financial Services Inc .  | SHAREHOLDER ALERT : Pomerantz Law Firm Reminds Shareholders with Losses on their Investment in BioNTech SE of Class Action Lawsuit and Upcoming Deadlines"
2024-01-17,25.174030303955078,28.149999618530273,28.530000686645508,27.93000030517578,28.15999984741211,33312600,-0.006002869827714696,25.644447820093774,26.104141823851457,PFE,Pfizer,"Centurion Wealth Management LLC Purchases 800 Shares of Pfizer Inc . ( NYSE : PFE )  | Pfizer Inc . ( NYSE : PFE ) Shares Sold by TBH Global Asset Management LLC | AIA Group Ltd Buys 34 , 623 Shares of Pfizer Inc . ( NYSE : PFE )  | Pfizer Inc . ( NYSE : PFE ) Shares Acquired by Tower Bridge Advisors | Why Pfizer Stock Is a Fantastic Pharma Comeback Candidate"
2024-01-18,25.12037467956543,28.09000015258789,28.1299991607666,27.600000381469727,28.040000915527344,50321100,-0.0021313879319998508,25.513429534961688,26.01470844709818,PFE,Pfizer,Former Pfizer employee convicted of insider trading to profit off COVID - 19 antiviral drug | Former Pfizer employee convicted of insider trading to profit off COVID - 19 antiviral drug | Former Pfizer employee convicted of insider trading to profit off COVID - 19 antiviral drug | Former Pfizer employee convicted of insider trading to profit off COVID - 19 antiviral drug | Former Pfizer employee convicted of insider trading to profit off COVID - 19 antiviral drug
2024-01-19,25.2902889251709,28.280000686645508,28.3799991607666,27.93000030517578,28.030000686645508,35549300,0.006764001244921269,25.45764438251399,25.948852126922972,PFE,Pfizer,"Pfizer Inc . ( NYSE : PFE ) Shares Purchased by MRP Capital Investments LLC | Dividend Roundup : Costco , Target , Dell Technologies , Pfizer , and more"
2024-01-22,25.317115783691406,28.309999465942383,28.6200008392334,27.93000030517578,28.31999969482422,41663900,0.00106075729699584,25.422512232808344,25.891421550265555,PFE,Pfizer,"Pfizer Inc . ( NYSE : PFE ) Shares Bought by Liberty One Investment Management LLC | Heritage Investment Group Inc . Sells 1 , 149 Shares of Pfizer Inc . ( NYSE : PFE )  | ORG Partners LLC Sells 2 , 022 Shares of Pfizer Inc . ( NYSE : PFE )  | ORG Partners LLC Sells 2 , 022 Shares of Pfizer Inc . ( NYSE : PFE )  | Latitude Advisors LLC Purchases 1 , 324 Shares of Pfizer Inc . ( NYSE : PFE ) "
2024-01-23,25.42443084716797,28.43000030517578,28.649999618530273,28.149999618530273,28.440000534057617,33466700,0.004238834486260501,25.42299188639825,25.848967849983957,PFE,Pfizer,Pfizer Inc . ( NYSE : PFE ) Shares Acquired by Signaturefd LLC | Pfizer Inc . ( NYSE : PFE ) Shares Bought by HHM Wealth Advisors LLC | Pfizer Inc . ( NYSE : PFE ) Shares Sold by Certuity LLC | Pfizer Inc . ( NYSE : PFE ) Shares Sold by Virginia Wealth Management Group Inc .  | Pfizer Inc . ( NYSE : PFE ) Shares Purchased by Larson Financial Group LLC
2024-01-24,25.335002899169922,28.329999923706055,28.780000686645508,28.329999923706055,28.540000915527344,42720700,-0.003517402160764904,25.40099463959117,25.802243763546315,PFE,Pfizer,"Meridian Investment Counsel Inc . Lowers Stock Position in Pfizer Inc . ( NYSE : PFE )  | Pfizer Inc . ( NYSE : PFE ) Increases Dividend to $0 . 42 Per Share | Pfizer Inc . ( NYSE : PFE ) Shares Acquired by Signaturefd LLC | LSV Asset Management Sells 458 , 300 Shares of Pfizer Inc . ( NYSE : PFE )  | 912 Shares in Pfizer Inc . ( NYSE : PFE ) Purchased by Briaud Financial Planning Inc"
2024-01-25,24.935598373413086,27.469999313354492,27.920000076293945,27.450000762939453,27.81999969482422,47605500,-0.015764929151435902,25.284645573046646,25.72345781898875,PFE,Pfizer,"What Going On With Pfizer Stock Today ? - Pfizer ( NYSE : PFE )  | Clal Insurance Enterprises Holdings Ltd Sells 380 , 000 Shares of Pfizer Inc . ( NYSE : PFE )  | Meyer Handelman Co . Has $48 . 95 Million Stock Holdings in Pfizer Inc . ( NYSE : PFE )  | Pfizer Inc . ( NYSE : PFE ) Shares Sold by Kranot Hishtalmut Le Morim Ve Gananot Havera Menahelet LTD | 912 Shares in Pfizer Inc . ( NYSE : PFE ) Purchased by Briaud Financial Planning Inc"
2024-01-26,24.935598373413086,27.469999313354492,27.90999984741211,27.360000610351562,27.6299991607666,47073800,0.0,25.197383773138256,25.651834233027326,PFE,Pfizer,"How To Earn $500 A Month From Pfizer Stock Ahead Of Q4 Earnings Print | Thinking about trading options or stock in Advanced Micro Devices , NVIDIA , Apple , Pfizer , or Chevron ?  | What You Need To Know Ahead of Pfizer Earnings on Tuesday | BNTX STOCK NEWS : Shareholders with Significant Losses Should Contact Robbins LLP for Information About the BioNTech SE Class Action Lawsuit - January 26 , 2024 at 12 : 27 pm EST | Kelleher Financial Advisors Has $829 , 000 Stock Holdings in Pfizer Inc . ( NYSE : PFE ) "
2024-01-29,24.944673538208008,27.479999542236328,27.6299991607666,27.309999465942383,27.520000457763672,67082700,0.000363944135569616,25.134206214405694,25.58754689713466,PFE,Pfizer,"Pfizer Inc . ( NYSE : PFE ) Shares Sold by Flputnam Investment Management Co .  | Thinking about trading options or stock in Pfizer , Palo Alto Networks , Block , McGrath RentCorp , or Beam Therapeutics ?  | First County Bank CT Sells 4 , 582 Shares of Pfizer Inc . ( NYSE : PFE )  | Pfizer Inc . ( NYSE : PFE ) Shares Bought by GYL Financial Synergies LLC | Warner Financial Inc . Sells 556 Shares of Pfizer Inc . ( NYSE : PFE ) "
2024-01-30,24.527114868164062,27.020000457763672,28.3700008392334,26.950000762939453,27.889999389648438,86072400,-0.016739392055156288,24.982433377845286,25.49114398541006,PFE,Pfizer,Pfizer stays the course on 2024 outlook after delivering better earnings than Wall Street forecast | Pfizer stays the course on 2024 outlook after delivering better earnings than Wall Street forecast | Pfizer stock rises as earnings beat expectations | Pfizer stays the course on 2024 outlook after delivering better earnings than Wall Street forecast | Pfizer stock rises as earnings beat expectations
2024-01-31,24.581575393676758,27.079999923706055,27.510000228881836,26.780000686645508,27.170000076293945,81192100,0.0022204211871403867,24.882218881803155,25.40845593161612,PFE,Pfizer,"Pfizer posts surprise fourth quarter profit aided by demand for Covid treatment drug | Pfizer Full Year 2023 Earnings : Misses Expectations | Motco Acquires 3 , 911 Shares of Pfizer Inc . ( NYSE : PFE )  | Motco Has $5 . 93 Million Stock Holdings in Pfizer Inc . ( NYSE : PFE )  | Community Financial Services Group LLC Buys Shares of 185 , 501 Pfizer Inc . ( NYSE : PFE ) "
2024-02-01,24.77220344543457,27.290000915527344,27.329999923706055,26.729999542236328,27.100000381469727,53883000,0.007754915976900589,24.85471502271101,25.350614796508708,PFE,Pfizer,Thakur Family Foundation aims at protecting US pharmaceutical profits
2024-02-02,24.445417404174805,26.93000030517578,27.200000762939453,26.690000534057617,27.18000030517578,51718500,-0.013191642074939947,24.75239061807696,25.268324124478355,PFE,Pfizer,"Sax Wealth Advisors LLC Buys 1 , 055 Shares of Pfizer Inc . ( NYSE : PFE )  | Pfizer Inc . ( NYSE : PFE ) Shares Purchased by Kestra Private Wealth Services LLC | Sax Wealth Advisors LLC Acquires 1 , 055 Shares of Pfizer Inc . ( NYSE : PFE )  | Azurity Pharmaceuticals recalls ADHD drug Zenzedi after bottle mistake"
2024-02-05,24.11863136291504,26.56999969482422,26.940000534057617,26.520000457763672,26.940000534057617,42633400,-0.013367987785062652,24.59395080428648,25.16380660069987,PFE,Pfizer,"Applied Finance Capital Management LLC Purchases 85 , 405 Shares of Pfizer Inc . ( NYSE : PFE )  | Tanager Wealth Management LLP Sells 1 , 692 Shares of Pfizer Inc . ( NYSE : PFE )  | MRA Advisory Group Sells 3 , 024 Shares of Pfizer Inc . ( NYSE : PFE )  | D . A . Davidson & CO . Acquires 22 , 777 Shares of Pfizer Inc . ( NYSE : PFE )  | Pfizer Inc . ( NYSE : PFE ) Shares Sold by MRA Advisory Group"
2024-02-06,24.962827682495117,27.5,27.729999542236328,26.56999969482422,26.65999984741211,56958700,0.035001833515235115,24.68617002383864,25.145535789953982,PFE,Pfizer,"Holistic Financial Partners Has $257 , 000 Stock Holdings in Pfizer Inc . ( NYSE : PFE )  | Levi & Korsinsky Notifies BioNTech SE ( BNTX ) Investors of a Class Action Lawsuit and Upcoming Deadline"
2024-02-07,25.017292022705078,27.559999465942383,27.649999618530273,27.299999237060547,27.549999237060547,36843000,0.0021818177372652237,24.768950523555247,25.133877265658626,PFE,Pfizer,Pfizer Problems Go Far Beyond Just Declining COVID Revenue | Pfizer Inc . ( NYSE : PFE ) Shares Sold by Beverly Hills Private Wealth LLC | Pfizer Problems Go Far Beyond Just Declining COVID Revenue
2024-02-08,25.026371002197266,27.56999969482422,27.690000534057617,27.40999984741211,27.559999465942383,29048400,0.00036290816303963247,24.833305643215752,25.124103968980318,PFE,Pfizer,Wade G W & Inc . Has $13 . 41 Million Stock Position in Pfizer Inc . ( NYSE : PFE ) 
2024-02-09,25.017292022705078,27.559999465942383,27.59000015258789,27.3799991607666,27.559999465942383,29062700,-0.0003627765084833756,24.879302238088083,25.114393792046204,PFE,Pfizer,Moderna shares slide on concerns over drop in RSV vaccine efficacy | Moderna shares slide as longer - term data shows quick fall in RSV vaccine efficacy | BNTX Investors Have Opportunity to Lead BioNTech SE Securities Fraud Lawsuit
2024-02-12,25.108068466186523,27.65999984741211,28.020000457763672,27.520000457763672,27.540000915527344,30323700,0.0036285479419218003,24.936493795112693,25.113818762422596,PFE,Pfizer,"Pfizer Stock : It Time To Buy The Dip ( NYSE : PFE )  | Cornerstone Advisors LLC Acquires 19 , 600 Shares of Pfizer Inc . ( NYSE : PFE )  | Nichols & Pratt Advisers LLP MA Has $1 . 83 Million Stock Holdings in Pfizer Inc . ( NYSE : PFE )  | Pfizer 2023 Financial Report Reveals 42 % Earnings Reduction | Stocks in Focus : Hero Motocorp , ONGC , MCX , Pfizer , DOMS Industries , Bandhan Bank"
2024-02-13,24.481727600097656,26.969999313354492,27.829999923706055,26.860000610351562,27.540000915527344,37927500,-0.02494580046778072,24.822802246358933,25.056355929483967,PFE,Pfizer,"Behind the Scenes of Pfizer Latest Options Trends - Pfizer ( NYSE : PFE )  | Pfizer wins pharma ad Super Bowl , beating Astella Veozah spot | UT Southwestern partners with Pfizer on RNA delivery tech | Pfizer Trades Taylor Swift Travis Kelce for Queen in First NFL Super Bowl Ad | BNTX Securities Class Action Reminder : Kessler Topaz Meltzer & Check , LLP Reminds BioNTech ... "
2024-02-14,24.608814239501953,27.110000610351562,27.170000076293945,26.90999984741211,27.010000228881836,25270200,0.005191081343613568,24.769305244644688,25.015670321303784,PFE,Pfizer,Pfizer Inc . ( NYSE : PFE ) Shares Sold by SPC Financial Inc .  | Levi & Korsinsky Notifies BioNTech SE Investors of a Class Action Lawsuit and Upcoming Deadline – BNTX
2024-02-15,24.971906661987305,27.510000228881836,27.809999465942383,27.219999313354492,27.25,36111600,0.01475456797518171,24.819955598980343,25.01169180682047,PFE,Pfizer,"Pfizer Mixed Bag : A Look At The Fourth Quarter 2023 Earnings Call - Main Takeaways - Pfizer ( NYSE : PFE )  | SHAREHOLDER ALERT : Pomerantz Law Firm Reminds Shareholders with Losses on their Investment in BioNTech SE of Class Action Lawsuit and Upcoming Deadlines | How To Earn $1 , 000 Per Month From Pfizer Stock | Pfizer Mixed Bag : A Look At The Fourth Quarter 2023 Earnings Call | Pfizer Agrees To Pay $93M To Settle Lipitor Antitrust Lawsuit Despite Calling Allegations  Factually And Legally Without Merit  - Pfizer ( NYSE : PFE ) "
2024-02-16,25.071758270263672,27.6200008392334,27.889999389648438,27.209999084472656,27.549999237060547,35935300,0.003998557644313339,24.882906266801175,25.017152394406214,PFE,Pfizer,"WCG Wealth Advisors LLC Has $1 . 46 Million Stock Holdings in Pfizer Inc . ( NYSE : PFE )  | How To Earn $1 , 000 Per Month From Pfizer Stock | Health News Roundup : Pfizer agrees to pay $93 million to settle Lipitor antitrust lawsuit ; Alvotech settles with J & J to launch Stelara biosimilar in Europe , Canada and more"
2024-02-20,25.044527053833008,27.59000015258789,28.139999389648438,27.520000457763672,27.610000610351562,34232000,-0.0010861311016612252,24.923311463559134,25.01964099980865,PFE,Pfizer,"Healthcare of Ontario Pension Plan Trust Fund Trims Stock Holdings in Pfizer Inc . ( NYSE : PFE )  | Cardiff Park Advisors LLC Has $290 , 000 Stock Holdings in Pfizer Inc . ( NYSE : PFE )  | Cardiff Park Advisors LLC Has $290 , 000 Stock Holdings in Pfizer Inc . ( NYSE : PFE ) "
2024-02-21,25.117145538330078,27.670000076293945,27.68000030517578,27.360000610351562,27.600000381469727,27348300,0.002899574998600496,24.97176998225187,25.028505048765144,PFE,Pfizer,"Moderna Stock Q4 Earnings Preview : RSV mRNA Vaccine Scrutiny , Diminishing Spikevax Revenue , FDA Approval In Focus - Moderna ( NASDAQ : MRNA )  | BioNTech SE Securities Fraud Class Action Lawsuit Pending : Contact ... "
2024-02-22,25.008214950561523,27.549999237060547,27.700000762939453,27.190000534057617,27.59000015258789,31957500,-0.004336901564006235,24.980881224329284,25.026660494382995,PFE,Pfizer,"Personal CFO Solutions LLC Cuts Stock Holdings in Pfizer Inc . ( NYSE : PFE )  | Schwerin Boyle Capital Management Inc . Sells 187 , 750 Shares of Pfizer Inc . ( NYSE : PFE )  | Moderna reports surprise profit , sets out road map for RSV vaccine | Moderna reports surprise profit , sets out road map for RSV vaccine | Moderna reports surprise profit , sets out road map for RSV vaccine By Reuters"
2024-02-23,25.198841094970703,27.760000228881836,28.09000015258789,27.690000534057617,27.75,33182600,0.007622541024460361,25.03537119198964,25.042313276254603,PFE,Pfizer,Pfizer ( PFE ) stock is the new Buy at Guggenheim | Pfizer stock adds bull at Guggenheim on pipeline ( NYSE : PFE ) 
2024-02-26,24.672353744506836,27.18000030517578,27.670000076293945,27.06999969482422,27.670000076293945,45685500,-0.020893316025114572,24.94461683011894,25.00868059155026,PFE,Pfizer,"Vinva Investment Management Ltd Sells 24 , 218 Shares of Pfizer Inc . ( NYSE : PFE )  | Seven Mile Advisory Buys 902 Shares of Pfizer Inc . ( NYSE : PFE )  | Synovus Financial Corp Buys 9 , 184 Shares of Pfizer Inc . ( NYSE : PFE )  | Synovus Financial Corp Buys 9 , 184 Shares of Pfizer Inc . ( NYSE : PFE )  | Summit Financial Wealth Advisors LLC Sells 2 , 653 Shares of Pfizer Inc . ( NYSE : PFE ) "
2024-02-27,24.409107208251953,26.889999389648438,27.200000762939453,26.809999465942383,27.1200008392334,38598400,-0.010669696899652026,24.81073942465219,24.954173920341322,PFE,Pfizer,"Morningstar Investment Services LLC Acquires 668 , 912 Shares of Pfizer Inc . ( NYSE : PFE )  | California State Teachers Retirement System Sells 351 , 940 Shares of Pfizer Inc . ( NYSE : PFE )  | Roundview Capital LLC Sells 2 , 314 Shares of Pfizer Inc . ( NYSE : PFE )  | Seven Mile Advisory Buys 902 Shares of Pfizer Inc . ( NYSE : PFE )  | Pfizer Inc . ( NYSE : PFE ) Shares Sold by Schulhoff & Co . Inc . "
2024-02-28,24.545272827148438,27.040000915527344,27.239999771118164,26.81999969482422,26.959999084472656,31010200,0.005578476006302013,24.744372775276254,24.91700109368742,PFE,Pfizer,"Morningstar Investment Services LLC Acquires 668 , 912 Shares of Pfizer Inc . ( NYSE : PFE )  | Pfizer Stock : A Value Trap , Not A Bargain ( NYSE : PFE )  | Tower Research Capital LLC TRC Has $6 . 10 Million Stock Holdings in Pfizer Inc . ( NYSE : PFE )  | Levi & Korsinsky Notifies BioNTech SE Investors of a Class Action Lawsuit ...  | BNTX Investors Have Opportunity to Lead BioNTech SE Securities Fraud Lawsuit"
2024-02-29,24.10955238342285,26.559999465942383,27.190000534057617,26.549999237060547,27.06999969482422,54643200,-0.01775170505514423,24.585667677312905,24.843596665481552,PFE,Pfizer,"Pfizer Inc . ( NYSE : PFE ) Shares Purchased by Caxton Associates LP | COVID - 19 and Its Vaccines Linked to Sudden Hearing Loss , Considered an  Emergency : Doctor"
2024-03-01,24.13678741455078,26.59000015258789,26.899999618530273,26.510000228881836,26.829999923706055,46392100,0.0011296365313964163,24.473447611622376,24.7793412790333,PFE,Pfizer,"COVID - 19 And Its Vaccines Linked To Sudden Hearing Loss , Considered An  Emergency : Doctor"
2024-03-04,23.501367568969727,25.889999389648438,26.459999084472656,25.610000610351562,26.299999237060547,86777700,-0.026325783736985353,24.230427600959214,24.6631618508457,PFE,Pfizer,"Pfizer Inc . ( NYSE : PFE ) Shares Sold by Legal & General Group Plc | Legal & General Group Plc Trims Stock Position in Pfizer Inc . ( NYSE : PFE )  | 23 , 353 Shares in Pfizer Inc . ( NYSE : PFE ) Acquired by KPP Advisory Services LLC | London Co . of Virginia Sells 4 , 518 , 686 Shares of Pfizer Inc . ( NYSE : PFE )  | BridgeBio Stock Could Soar As Bayer Snags European Rights To A Pfizer Rival"
2024-03-05,23.673837661743164,26.079999923706055,26.420000076293945,25.690000534057617,25.8700008392334,73646100,0.007338725811052882,24.0912801161552,24.573223288200015,PFE,Pfizer,"EHP Funds Inc . Sells 6 , 400 Shares of Pfizer Inc . ( NYSE : PFE ) "
2024-03-06,24.68143081665039,27.190000534057617,27.299999237060547,26.790000915527344,26.899999618530273,84919500,0.04256146254375537,24.238817791278997,24.58306033624096,PFE,Pfizer,"Charting Success : Vaccines Storage Equipment Market Impact | Pfizer wins diversity program challenge in appeals court | Group suing over Pfizer diversity fellowship program loses US appeal | Group suing over Pfizer diversity fellowship program loses US appeal | RSV vaccine roll - out recap : 5 notes on safety , efficacy"
2024-03-07,24.318336486816406,26.790000915527344,27.31999969482422,26.760000228881836,27.200000762939453,46423800,-0.01471123503865246,24.25869746516335,24.558994531747818,PFE,Pfizer,"J . P . Marvel Investment Advisors LLC Sells 1 , 315 Shares of Pfizer Inc . ( NYSE : PFE )  | Stocks That Bottomed : Pfizer , Newmont , Albemarle , And More | Pfizer Inc . ( NYSE : PFE ) Shares Sold by The Manufacturers Life Insurance Company | The Manufacturers Life Insurance Company Decreases Stock Holdings in Pfizer Inc . ( NYSE : PFE ) "
2024-03-08,24.708662033081055,27.219999313354492,27.299999237060547,26.850000381469727,26.8799991607666,45906600,0.016050668041222904,24.371188607142777,24.572600668232656,PFE,Pfizer,"S & P index error may have sparked turbulence in Morgan Stanley , Pfizer shares , traders say | S & P index error may have sparked turbulence in Morgan Stanley , Pfizer shares , traders say | Integrated Wealth Concepts LLC Sells 9 , 578 Shares of Pfizer Inc . ( NYSE : PFE )  | Pfizer Inc . ( NYSE : PFE ) Stock Holdings Lowered by Stonebridge Capital Advisors LLC | Integrated Wealth Concepts LLC Reduces Stock Holdings in Pfizer Inc . ( NYSE : PFE ) "
2024-03-11,25.7525634765625,28.3700008392334,28.389999389648438,27.309999465942383,27.309999465942383,52600100,0.04224840026075971,24.716532324497706,24.679870014444457,PFE,Pfizer,"3 Pharmaceutical Stocks to Buy Hand Over Fist in March | Chelsea Counsel Co . Lowers Stock Holdings in Pfizer Inc . ( NYSE : PFE )  | Comerica Bank Raises Stock Position in Pfizer Inc . ( NYSE : PFE )  | Pfizer Inc . ( NYSE : PFE ) Shares Sold by Hohimer Wealth Management LLC | Chelsea Counsel Co . Sells 5 , 300 Shares of Pfizer Inc . ( NYSE : PFE ) "
2024-03-12,25.425777435302734,28.010000228881836,28.34000015258789,27.760000228881836,28.309999465942383,48758200,-0.012689456781930675,24.893843602198963,24.74767977997703,PFE,Pfizer,"Key Dividend Stocks for March : Gilead , Novartis , Pfizer | Pfizer Inc . ( NYSE : PFE ) Shares Acquired by Tucker Asset Management LLC | B . Riley Wealth Advisors Inc . Sells 1 , 078 Shares of Pfizer Inc . ( NYSE : PFE )  | Pfizer Inc . ( NYSE : PFE ) Shares Purchased by Tucker Asset Management LLC"
2024-03-13,25.61640167236328,28.219999313354492,28.690000534057617,28.190000534057617,28.290000915527344,39273000,0.007497282533271532,25.074483119740044,24.82665449746669,PFE,Pfizer,"Birmingham Capital Management Co . Inc . AL Purchases 11 , 888 Shares of Pfizer Inc . ( NYSE : PFE )  | Pfizer Inc . ( NYSE : PFE ) Shares Purchased by Birmingham Capital Management Co . Inc . AL | Moss Adams Wealth Advisors LLC Increases Stock Position in Pfizer Inc . ( NYSE : PFE )  | Big Pharma trying to transition seasonal flu shots to mRNA vaccines as COVID - 19 jab revenues slide – NaturalNews . com | Pfizer : Seagen Acquisition Starting To Bear Fruit ( NYSE : PFE ) "
2024-03-14,25.534704208374023,28.1299991607666,28.280000686645508,27.770000457763672,28.25,36428000,-0.0031892638565782505,25.189538391898537,24.89102265300372,PFE,Pfizer,"Over 1 , 000 gallons of methylene chloride spilled at Kalamazoo Pfizer plant | Pfizer chemical spill prompts no - contact advisory of Kalamazoo River | Canandaigua National Bank & Trust Co . Has $5 . 94 Million Stake in Pfizer Inc . ( NYSE : PFE )  | Pharmaceutical Company Discloses Why It Stopped Trials of New Vaccine | Pfizer Adcetris combination shows promise in phase 3 large B - cell lymphoma study"
2024-03-15,25.36223602294922,27.940000534057617,28.280000686645508,27.860000610351562,27.959999084472656,75727900,-0.006754266037992451,25.232712799661208,24.93386023208967,PFE,Pfizer,"Decoding Pfizer Options Activity : What the Big Picture ? - Pfizer ( NYSE : PFE )  | Pfizer Leases Space at San Diego Campus for Cancer - Drug Push | Pfizer Leases Space at San Diego Campus for Cancer - Drug Push | Pfizer assures no health risks after methylene chloride spill in Kalamazoo | Vaccines cut risk of post - COVID heart failure , blood clots for at least 6 months , data suggest"
2024-03-18,25.162532806396484,27.719999313354492,28.030000686645508,27.610000610351562,28.010000228881836,36226500,-0.007874038250098692,25.215167801345025,24.954648647935745,PFE,Pfizer,"Pfizer Plans to Sell About £2 Billion of Shares in Haleon | Pfizer ( PFE ) Plans to Sell About £2 Billion of Shares in Haleon ( HLN )  | Winthrop Advisory Group LLC Has $457 , 000 Stock Position in Pfizer Inc . ( NYSE : PFE )  | Winthrop Advisory Group LLC Has $457 , 000 Stock Position in Pfizer Inc . ( NYSE : PFE )  | Silvia Mccoll Wealth Management LLC Trims Stock Position in Pfizer Inc . ( NYSE : PFE ) "
2024-03-19,25.080833435058594,27.6299991607666,27.780000686645508,27.31999969482422,27.670000076293945,29026600,-0.0032468659640305653,25.18158420977342,24.96611999221964,PFE,Pfizer,"Repeat & Correct : Pfizer to Raise Around $4 . 27 Billion From Haleon Shares Sale - March 19 , 2024 at 06 : 09 am EDT | Haleon to buy back shares from Pfizer for GBP315 million | Foundation Resource Management Inc . Has $16 . 38 Million Stock Holdings in Pfizer Inc . ( NYSE : PFE )  | Baugh & Associates LLC Has $3 . 67 Million Stock Position in Pfizer Inc . ( NYSE : PFE ) "
2024-03-20,25.144378662109375,27.700000762939453,27.739999771118164,27.209999084472656,27.479999542236328,34468000,0.0025336170432819216,25.172282822857408,24.98232532584598,PFE,Pfizer,"BioNTech shifts focus toward cancer drug development after earnings , revenue plunge | Why Is BioNTech Stock Trading Lower On Wednesday ? - BioNTech ( NASDAQ : BNTX )  | Community Trust & Investment Co . Purchases 2 , 784 Shares of Pfizer Inc . ( NYSE : PFE )  | Why Is BioNTech Stock Trading Lower On Wednesday ?  | After Earnings Plunge , BioNTech Pins Hopes on Cancer Drug Launches"
2024-03-21,25.108068466186523,27.65999984741211,28.040000915527344,27.6299991607666,27.75,29633700,-0.0014440681319187743,25.156229233689686,24.993756520422394,PFE,Pfizer,Pfizer Inc . ( NYSE : PFE ) Shares Bought by 1834 Investment Advisors Co .  | Haleon buys back shares worth GBP315 million from Pfizer | BioNTech Se ( BNTX ) Q4 2023 Earnings Call Transcript
2024-03-22,24.835744857788086,27.360000610351562,27.84000015258789,27.34000015258789,27.469999313354492,28830100,-0.010846059654695428,25.076108139714286,24.979391823819274,PFE,Pfizer,"Argus downgrades Pfizer ( PFE ), lowers earnings estimates on  near - term headwinds   | Pfizer ( NYSE : PFE ) Shares Down 0 %  | BioNTech ( BNTX ) PT Lowered to $90 at HSBC ,  near - term COVID - 19 revenue still remains a risk overhang  "
