Date,Adj Close,Close,High,Low,Open,Volume,Daily_Return,EMA_7,EMA_21,Ticker,Company,Headlines,Headline_List,negative,neutral,positive
2022-06-23,252.04180908203125,258.8599853515625,259.3699951171875,253.6300048828125,255.57000732421875,25861400,0.0226365067805385,247.09022484715416,251.60670034921395,MSFT,Microsoft Corporation,Alliance Entertainment to Become an NYSE American Publicly Traded Company Via Business Combination with Adara Acquisition Corp . in $480 Million Transaction â Consumer Electronics Net,['Alliance Entertainment to Become an NYSE American Publicly Traded Company Via Business Combination with Adara Acquisition Corp . in $480 Million Transaction â\x80\x93 Consumer Electronics Net'],0.9955701231956482,0.00440604891628027,2.387559288763441e-05
2022-06-24,260.64898681640625,267.70001220703125,267.9800109863281,261.7200012207031,261.8099975585937,33923200,0.0341498014385923,250.4799153394672,252.428726391686,MSFT,Microsoft Corporation,10 Value Stocks to Buy According to Billionaire David Tepper,['10 Value Stocks to Buy According to Billionaire David Tepper'],0.9995282888412476,9.450301149627194e-05,0.00037718561361543834
2022-06-27,257.9130554199219,264.8900146484375,268.29998779296875,263.2799987792969,268.2099914550781,24615100,-0.0104966124361399,252.33820035958087,252.92730175788924,MSFT,Microsoft Corporation,"Apple makes $1 , 700 in profit per SECOND , followed closely by Google and Microsoft | Oakworth Capital Inc . Has $14 . 95 Million Stock Position in Microsoft Co . ( NASDAQ : MSFT ) ","['Apple makes $1 , 700 in profit per SECOND , followed closely by Google and Microsoft', 'Oakworth Capital Inc . Has $14 . 95 Million Stock Position in Microsoft Co . ( NASDAQ : MSFT )']",0.9999962449073792,1.1320040584905655e-06,2.6401885406812653e-06
2022-06-28,249.72450256347656,256.4800109863281,266.9100036621094,256.32000732421875,263.9800109863281,27295500,-0.0317492762943431,251.6847759105548,252.6361381947608,MSFT,Microsoft Corporation,"Transparency Market Research : Revenue of Online Project Management Software Market estimated at US$ 11 . 7 Bn by 2031 , TMR Report | Stock Market | Daily Herald","['Transparency Market Research : Revenue of Online Project Management Software Market estimated at US$ 11 . 7 Bn by 2031 , TMR Report', 'Stock Market', 'Daily Herald']",0.9983368515968323,5.61018823646009e-05,0.0016070165438577533
2022-06-29,253.4049835205078,260.260009765625,261.9700012207031,255.75999450683597,257.5899963378906,20069800,0.01473816513498,252.11482781304304,252.70603322437412,MSFT,Microsoft Corporation,"Blockchain Technology In The Healthcare Market Recent And Fu ...  | Financier Chanos Sees Golden Opportunity For Amazon , Microsoft , Google | A $82 . 1 Billion Global Opportunity for Intelligent Apps by 2026 - New Research from StrategyR | A $82 . 1 Billion Global Opportunity for Intelligent Apps by 2026 - New Research from StrategyR | Agita Labs brings always - encrypted computing to Azure Cloud","['Blockchain Technology In The Healthcare Market Recent And Fu ...', 'Financier Chanos Sees Golden Opportunity For Amazon , Microsoft , Google', 'A $82 . 1 Billion Global Opportunity for Intelligent Apps by 2026 - New Research from StrategyR', 'A $82 . 1 Billion Global Opportunity for Intelligent Apps by 2026 - New Research from StrategyR', 'Agita Labs brings always - encrypted computing to Azure Cloud']",0.39040422439575195,0.6094454526901245,0.00015034136595204473
2022-06-30,250.0652618408203,256.8299865722656,259.5299987792969,252.8999938964844,257.04998779296875,31730900,-0.0131793843723567,251.60243631998736,252.4659630985965,MSFT,Microsoft Corporation,Stock Market | Daily Herald | Billionaire Ken Griffin is Selling These 10 Stocks in 2022 | Strive Asset Management Aims to Lure Companies Away From ESG - Based Strategies at Odds with Profitability,"['Stock Market', 'Daily Herald', 'Billionaire Ken Griffin is Selling These 10 Stocks in 2022', 'Strive Asset Management Aims to Lure Companies Away From ESG - Based Strategies at Odds with Profitability']",0.8492765426635742,0.14803045988082886,0.0026930009480565786
2022-07-01,252.7428436279297,259.5799865722656,259.7699890136719,254.6100006103516,256.3900146484375,22837700,0.0107075319754481,251.88753814697293,252.49113405580863,MSFT,Microsoft Corporation,"Demand for Digital Agriculture Market Size , and Research Forecast 2029 | Betterment in Digitalization to Improve the Industry Growth | Artificial Intelligence ( AI ) in Insurance Market May See a Big Move : Google , Microsoft , IBM : Long Term Growth Story | Worldwide On - Site Photovoltaic Solar Power for Data Centers Industry to 2027 - Featuring Alphabet , Microsoft and Dell Technologies Among Others - ResearchAndMarkets . com | Buy Microsoft , Sell Zoom : The Software King Wins In Cloud Communications | Former Harris aide will lobby for Airbnb","['Demand for Digital Agriculture Market Size , and Research Forecast 2029', 'Betterment in Digitalization to Improve the Industry Growth', 'Artificial Intelligence ( AI ) in Insurance Market May See a Big Move : Google , Microsoft , IBM : Long Term Growth Story', 'Worldwide On - Site Photovoltaic Solar Power for Data Centers Industry to 2027 - Featuring Alphabet , Microsoft and Dell Technologies Among Others - ResearchAndMarkets . com', 'Buy Microsoft , Sell Zoom : The Software King Wins In Cloud Communications', 'Former Harris aide will lobby for Airbnb']",0.49984487891197205,0.500023603439331,0.0001315081462962553
2022-07-05,255.92677307128903,262.8500061035156,262.9800109863281,254.7400054931641,256.1600036621094,22941000,0.0125975058191816,252.897346878052,252.8034648753977,MSFT,Microsoft Corporation,Stock Market | Daily Herald | 10 Best Stocks to Buy in 2022 According to Billionaire Richard Chilton,"['Stock Market', 'Daily Herald', '10 Best Stocks to Buy in 2022 According to Billionaire Richard Chilton']",0.9982767105102539,9.32923358050175e-05,0.0016300277784466743
2022-07-06,259.1982421875,266.2099914550781,267.989990234375,262.3999938964844,263.75,23824400,0.0127828326710455,254.472570705414,253.38480826740704,MSFT,Microsoft Corporation,CMA Begins Merger Probe Into Activision Blizzard - Microsoft Deal | UK CMA Opens Probe into Microsoft Acquisition of Activision Blizzard | The CMA to investigate Microsoft acquisition of Activision,"['CMA Begins Merger Probe Into Activision Blizzard - Microsoft Deal', 'UK CMA Opens Probe into Microsoft Acquisition of Activision Blizzard', 'The CMA to investigate Microsoft acquisition of Activision']",0.9972600936889648,4.219736729282886e-05,0.002697700634598732
2022-07-07,261.33056640625,268.3999938964844,269.0599975585937,265.0199890136719,265.1199951171875,20859900,0.0082266152762235,256.187069630623,254.1071499163928,MSFT,Microsoft Corporation,Brazilian Billionaire Jorge Paulo Lemann Loves These 5 Tech Stocks | Brazilian Billionaire Jorge Paulo Lemann Loves These 5 Tech Stocks | Disney ( DIS ) and 9 Other Stocks Billionaire Phill Gross Was Buying Up in Q1 | Billionaire Stephen Mandel 10 Must - Buy Tech Stocks | Brazilian Billionaire Jorge Paulo Lemann Has Lost Faith in These 5 Tech Stocks,"['Brazilian Billionaire Jorge Paulo Lemann Loves These 5 Tech Stocks', 'Brazilian Billionaire Jorge Paulo Lemann Loves These 5 Tech Stocks', 'Disney ( DIS ) and 9 Other Stocks Billionaire Phill Gross Was Buying Up in Q1', 'Billionaire Stephen Mandel 10 Must - Buy Tech Stocks', 'Brazilian Billionaire Jorge Paulo Lemann Has Lost Faith in These 5 Tech Stocks']",0.7981193661689758,0.00020064129785168916,0.2016800194978714
2022-07-08,260.61004638671875,267.6600036621094,268.1000061035156,263.2900085449219,264.7900085449219,19658800,-0.0027571211031287,257.29281381964694,254.69832232278603,MSFT,Microsoft Corporation,"Recommendation Engines Market Size is projected to reach USD 54 Billion by 2030 , grow at a CAGR of 37 %: Straits Research | Artificial Intelligence In Genomics Market Research Report | IoT Device Management Market Research Report by Component ,  | Computer training programme launched for students in Coimbatore Corporation schools | Coimbatore News | Computer Training Programme Starts For Corpn School Students | Coimbatore News","['Recommendation Engines Market Size is projected to reach USD 54 Billion by 2030 , grow at a CAGR of 37 %: Straits Research', 'Artificial Intelligence In Genomics Market Research Report', 'IoT Device Management Market Research Report by Component ,', 'Computer training programme launched for students in Coimbatore Corporation schools', 'Coimbatore News', 'Computer Training Programme Starts For Corpn School Students', 'Coimbatore News']",0.9073077440261841,0.09254099428653717,0.00015123686171136796
2022-07-11,257.5430603027344,264.510009765625,266.5299987792969,262.17999267578125,265.6499938964844,19455200,-0.0117684875410876,257.3553754404188,254.95693486641767,MSFT,Microsoft Corporation,"Insights on the Hybrid Cloud Global Market to 2027 â by Service , Service Type , Service Model , Organization Size , Vertical and Region â ResearchAndMarkets . com â Consumer Electronics Net | Why does an AI faculty shortage exist ? It complicated | The Agenda : Oak Island to discuss paid parking , Southport hears three annexation requests","['Insights on the Hybrid Cloud Global Market to 2027 â\x80\x93 by Service , Service Type , Service Model , Organization Size , Vertical and Region â\x80\x93 ResearchAndMarkets . com â\x80\x93 Consumer Electronics Net', 'Why does an AI faculty shortage exist ? It complicated', 'The Agenda : Oak Island to discuss paid parking , Southport hears three annexation requests']",0.9152308106422424,0.003453116863965988,0.0813160389661789
2022-07-12,246.9885406494141,253.6699981689453,265.94000244140625,252.0399932861328,265.8800048828125,35868500,-0.0409815727160878,254.7636667426676,254.2325353921446,MSFT,Microsoft Corporation,"Healthcare Supply Chain Management Market : Market Segments :  | Global Top 20 Military Electro - Optical and Infrared ( EOIR ) Systems market is projected to grow at a CAGR of 5 . 0 % By 2032 : Visiongain Reports Ltd | Global Top 20 Military Electro - Optical and Infrared ( EOIR ) Systems market is projected to grow at a CAGR of 5 . 0 % By 2032 : Visiongain Reports Ltd | Metaverse Market to Surpass US$ 993 . 86 Billion by 2030 , Says The Brainy Insights | Artificial Intelligence in Manufacturing Market Size to reach USD 78 , 744 Million by 2030 Exclusive Report by Acumen Research and Consulting","['Healthcare Supply Chain Management Market : Market Segments :', 'Global Top 20 Military Electro - Optical and Infrared ( EOIR ) Systems market is projected to grow at a CAGR of 5 . 0 % By 2032 : Visiongain Reports Ltd', 'Global Top 20 Military Electro - Optical and Infrared ( EOIR ) Systems market is projected to grow at a CAGR of 5 . 0 % By 2032 : Visiongain Reports Ltd', 'Metaverse Market to Surpass US$ 993 . 86 Billion by 2030 , Says The Brainy Insights', 'Artificial Intelligence in Manufacturing Market Size to reach USD 78 , 744 Million by 2030 Exclusive Report by Acumen Research and Consulting']",0.36092063784599304,0.6390607953071594,1.8530150555307046e-05
2022-07-13,246.06358337402344,252.72000122070312,253.5500030517578,248.1100006103516,250.19000244140625,29497400,-0.0037449400403702,252.58864590050655,253.48990339049723,MSFT,Microsoft Corporation,Microsoft Q4 2022 Earnings Preview ( MSFT ): Waiting Game Now | Business . Scoop Â» Statement Of Preliminary Issues Released For Microsoft Acquisition Of Activision Blizzard,"['Microsoft Q4 2022 Earnings Preview ( MSFT ): Waiting Game Now', 'Business . Scoop Â» Statement Of Preliminary Issues Released For Microsoft Acquisition Of Activision Blizzard']",0.8762587308883667,0.12220913916826248,0.0015321794198825955
2022-07-14,247.38775634765625,254.0800018310547,255.13999938964844,245.94000244140625,250.57000732421875,25102800,0.0053814260341809,251.288423512294,252.93516275023896,MSFT,Microsoft Corporation,"Data Bridge Market Research : Life Science Software Market Size , Share , Trends , Key Players , Revenue Outlook and Market to Gain USD 40 . 76 Billion by 2029 | Life Science Software Market Size , Share , Trends , Key Players , Revenue Outlook and Market to Gain USD 40 . 76 Billion by 2029 | Microsoft Co . Forecasted to Earn FY2023 Earnings of $10 . 38 Per Share ( NASDAQ : MSFT ) ","['Data Bridge Market Research : Life Science Software Market Size , Share , Trends , Key Players , Revenue Outlook and Market to Gain USD 40 . 76 Billion by 2029', 'Life Science Software Market Size , Share , Trends , Key Players , Revenue Outlook and Market to Gain USD 40 . 76 Billion by 2029', 'Microsoft Co . Forecasted to Earn FY2023 Earnings of $10 . 38 Per Share ( NASDAQ : MSFT )']",0.3375645577907562,0.6624323725700378,3.1191757443593815e-06
2022-07-15,249.95819091796875,256.7200012207031,260.3699951171875,254.7700042724609,255.72000122070312,29774100,0.0103903063282575,250.9558653637127,252.6645289473053,MSFT,Microsoft Corporation,"Engage with Brex , Dropbox , Microsoft and more at TechCrunch Disrupt â TechCrunch | Opinion | Putin long game in Ukraine could falter - The Washington Post","['Engage with Brex , Dropbox , Microsoft and more at TechCrunch Disrupt â\x80\x93 TechCrunch', 'Opinion', 'Putin long game in Ukraine could falter - The Washington Post']",0.3333144187927246,0.33297160267829895,0.3337138891220093
2022-07-18,247.5532684326172,254.25,260.8399963378906,253.3000030517578,259.75,20975000,-0.0096212989721181,250.1052161309388,252.19986890051547,MSFT,Microsoft Corporation,10 Blue Chip Stocks To Buy Now According To Billionaire Andreas Halvorsen | Billionaire Daniel Sundheim D1 Capital Portfolio : Top 10 Stock Picks,"['10 Blue Chip Stocks To Buy Now According To Billionaire Andreas Halvorsen', 'Billionaire Daniel Sundheim D1 Capital Portfolio : Top 10 Stock Picks']",0.8307210206985474,0.16917765140533447,0.00010123835818376392
2022-07-19,252.69418334960935,259.5299987792969,259.7200012207031,253.67999267578125,257.5799865722656,25012600,0.0207669038245459,250.7524579356065,252.24480657770584,MSFT,Microsoft Corporation,"AI Infrastructure Market worth $96 . 6 billion by 2027 - Exclusive Report by MarketsandMarketsâ¢ | Industrial IoT Market to Reach $276 . 79 Billion by 2029 - Market Size , Share , Forecasts , & Trends Analysis Report with COVID - 19 Impact by Meticulous ResearchÂ® | Industrial IoT Market to Reach $276 . 79 Billion by 2029 - Market Size , Share , Forecasts , & Trends Analysis Report with COVID - 19 Impact by Meticulous ResearchÂ® | Public Key Infrastructure Market Forecasted to Hit USD 21 . 25 Billion by 2030 , at a CAGR of 21 . 74 % - Report by Market Research Future ( MRFR )  | Endpoint Detection and Response Market to Garner $18 . 3 Bn , Globally , by 2031 at 25 . 3 % CAGR : Allied Market Research","['AI Infrastructure Market worth $96 . 6 billion by 2027 - Exclusive Report by MarketsandMarketsâ\x84¢', 'Industrial IoT Market to Reach $276 . 79 Billion by 2029 - Market Size , Share , Forecasts , & Trends Analysis Report with COVID - 19 Impact by Meticulous ResearchÂ®', 'Industrial IoT Market to Reach $276 . 79 Billion by 2029 - Market Size , Share , Forecasts , & Trends Analysis Report with COVID - 19 Impact by Meticulous ResearchÂ®', 'Public Key Infrastructure Market Forecasted to Hit USD 21 . 25 Billion by 2030 , at a CAGR of 21 . 74 % - Report by Market Research Future ( MRFR )', 'Endpoint Detection and Response Market to Garner $18 . 3 Bn , Globally , by 2031 at 25 . 3 % CAGR : Allied Market Research']",0.9977046847343445,0.0022584176622331142,3.690857920446433e-05
2022-07-20,255.3620147705078,262.2699890136719,264.8699951171875,258.9100036621094,259.8999938964844,22788300,0.0105575497842282,251.9048471443318,252.52818914068783,MSFT,Microsoft Corporation,"Fermata Advisors LLC Sells 758 Shares of Microsoft Co . ( NASDAQ : MSFT )  | MorganRosel Wealth Management LLC Has $317 , 000 Stock Holdings in Microsoft Co . ( NASDAQ : MSFT )  | Microsoft Co . ( NASDAQ : MSFT ) Shares Acquired by PCG Wealth Advisors LLC","['Fermata Advisors LLC Sells 758 Shares of Microsoft Co . ( NASDAQ : MSFT )', 'MorganRosel Wealth Management LLC Has $317 , 000 Stock Holdings in Microsoft Co . ( NASDAQ : MSFT )', 'Microsoft Co . ( NASDAQ : MSFT ) Shares Acquired by PCG Wealth Advisors LLC']",0.999978244304657,1.4674643580292468e-06,2.0363631847430952e-05
2022-07-21,257.8642883300781,264.8399963378906,264.8900146484375,257.0299987792969,259.7900085449219,22404700,0.0097989262883091,253.3947074407684,253.013289066996,MSFT,Microsoft Corporation,Microsoft Co . ( NASDAQ : MSFT ) Shares Acquired by Louisiana State Employees Retirement System,['Microsoft Co . ( NASDAQ : MSFT ) Shares Acquired by Louisiana State Employees Retirement System'],0.9999445676803589,4.889831870968919e-06,5.049747778684832e-05
2022-07-22,253.50233459472656,260.3599853515625,265.3299865722656,259.07000732421875,265.239990234375,21881300,-0.016915695320199,253.42161422925795,253.05774775133517,MSFT,Microsoft Corporation,"Disaster Recovery Solutions Market Size , Shares and Analysis , Trends with Top Most Key Players - International Business Machines Corporation , Microsoft Corporation , Sungard Availability Services .  | SAP Q2 2022 : Revenue up 13 %, Ukraine war impact steady at â¬300m | Microsoft Co . ( NASDAQ : MSFT ) Stock Position Raised by Sonata Capital Group Inc .  | DB Fitzpatrick & Co Inc Sells 1 , 053 Shares of Microsoft Co . ( NASDAQ : MSFT ) ","['Disaster Recovery Solutions Market Size , Shares and Analysis , Trends with Top Most Key Players - International Business Machines Corporation , Microsoft Corporation , Sungard Availability Services .', 'SAP Q2 2022 : Revenue up 13 %, Ukraine war impact steady at â\x82¬300m', 'Microsoft Co . ( NASDAQ : MSFT ) Stock Position Raised by Sonata Capital Group Inc .', 'DB Fitzpatrick & Co Inc Sells 1 , 053 Shares of Microsoft Co . ( NASDAQ : MSFT )']",0.7499958276748657,0.25000065565109253,3.5563296023610746e-06
2022-07-25,252.01263427734372,258.8299865722656,261.5,256.8099975585937,261.0,21056000,-0.0058764757325189,253.0693692412794,252.9627374355177,MSFT,Microsoft Corporation,"Microsoft : Earnings May Disappoint , But Company Remains A Solid Long - Term Play | 10 Best Stocks to Buy Now According to Billionaire Marc Lasry Avenue Capital","['Microsoft : Earnings May Disappoint , But Company Remains A Solid Long - Term Play', '10 Best Stocks to Buy Now According to Billionaire Marc Lasry Avenue Capital']",0.4999229609966278,0.2677403390407562,0.23233672976493835
2022-07-26,245.26513671875,251.8999938964844,259.8800048828125,249.57000732421875,259.8599853515625,39348000,-0.0267744415987019,251.11831111064703,252.2629555521752,MSFT,Microsoft Corporation,Microsoft Stock Higher As Robust Outlook Offsets Q4 Earnings Miss | US stocks in red midday as focus remains on earnings and Fed rate decision | US stocks stumble into the red Tuesday as focus remains on earnings and Fed rate decision | Microsoft shares rebound on upbeat guidance | Stock Market | Daily Herald,"['Microsoft Stock Higher As Robust Outlook Offsets Q4 Earnings Miss', 'US stocks in red midday as focus remains on earnings and Fed rate decision', 'US stocks stumble into the red Tuesday as focus remains on earnings and Fed rate decision', 'Microsoft shares rebound on upbeat guidance', 'Stock Market', 'Daily Herald']",0.4990582764148712,0.33336177468299866,0.16757993400096893
2022-07-27,261.66162109375,268.739990234375,270.04998779296875,258.8500061035156,261.1600036621094,45994000,0.0668520793226399,253.7541386064228,253.1173796923184,MSFT,Microsoft Corporation,"Microsoft Stock Higher As Robust Outlook Offsets Q4 Earnings Miss | Microsoft ( MSFT ) Stock Advances 5 % on Impressive Financial Guidance Despite Missing Estimates in Q4 2022 Results | Stock Market Today : Dow Racks Up Gains After Fed Rate Hikes , Tech Rallies By Investing . com | 10 Safe Stocks to Buy Now According to Billionaire Dan Loeb | Microsoft blames economic woes for missing profit targets","['Microsoft Stock Higher As Robust Outlook Offsets Q4 Earnings Miss', 'Microsoft ( MSFT ) Stock Advances 5 % on Impressive Financial Guidance Despite Missing Estimates in Q4 2022 Results', 'Stock Market Today : Dow Racks Up Gains After Fed Rate Hikes , Tech Rallies By Investing . com', '10 Safe Stocks to Buy Now According to Billionaire Dan Loeb', 'Microsoft blames economic woes for missing profit targets']",0.20150601863861084,0.5984150171279907,0.20007899403572083
2022-07-28,269.12957763671875,276.4100036621094,277.8399963378906,267.8699951171875,269.75,33459300,0.0285405116415335,257.5979983639968,254.57303405090025,MSFT,Microsoft Corporation,"Hunter Associates Investment Management LLC Sells 5 , 847 Shares of Microsoft Co . ( NASDAQ : MSFT )  | These 10 Stocks are Gaining After Announcing Share Buybacks | Argent Advisors Inc . Has $4 . 37 Million Stock Holdings in Microsoft Co . ( NASDAQ : MSFT )  | Microsoft Co . ( NASDAQ : MSFT ) Shares Sold by Confluence Wealth Services Inc .  | Microsoft Co . ( NASDAQ : MSFT ) Shares Sold by Grandview Asset Management LLC","['Hunter Associates Investment Management LLC Sells 5 , 847 Shares of Microsoft Co . ( NASDAQ : MSFT )', 'These 10 Stocks are Gaining After Announcing Share Buybacks', 'Argent Advisors Inc . Has $4 . 37 Million Stock Holdings in Microsoft Co . ( NASDAQ : MSFT )', 'Microsoft Co . ( NASDAQ : MSFT ) Shares Sold by Confluence Wealth Services Inc .', 'Microsoft Co . ( NASDAQ : MSFT ) Shares Sold by Grandview Asset Management LLC']",0.7999945878982544,0.19999995827674866,5.431279987533344e-06
2022-07-29,273.3454895019531,280.739990234375,282.0,276.6300048828125,277.70001220703125,32152800,0.0156649889702022,261.5348711484859,256.27962091008686,MSFT,Microsoft Corporation,"Cardinal Strategic Wealth Guidance Sells 201 Shares of Microsoft Co . ( NASDAQ : MSFT )  | Diligent Investors LLC Sells 177 Shares of Microsoft Co . ( NASDAQ : MSFT )  | First Citizens Bank & Trust Co . Raises Stock Holdings in Microsoft Co . ( NASDAQ : MSFT )  | Kanawha Capital Management LLC Acquires 1 , 112 Shares of Microsoft Co . ( NASDAQ : MSFT )  | Microsoft Co . ( NASDAQ : MSFT ) Shares Sold by Arrow Financial Corp","['Cardinal Strategic Wealth Guidance Sells 201 Shares of Microsoft Co . ( NASDAQ : MSFT )', 'Diligent Investors LLC Sells 177 Shares of Microsoft Co . ( NASDAQ : MSFT )', 'First Citizens Bank & Trust Co . Raises Stock Holdings in Microsoft Co . ( NASDAQ : MSFT )', 'Kanawha Capital Management LLC Acquires 1 , 112 Shares of Microsoft Co . ( NASDAQ : MSFT )', 'Microsoft Co . ( NASDAQ : MSFT ) Shares Sold by Arrow Financial Corp']",0.9989800453186035,0.001002533477731049,1.7478731024311855e-05
2022-08-01,270.6874694824219,278.010009765625,281.2799987792969,275.8399963378906,277.82000732421875,21539600,-0.0097240310215993,263.8230207319699,257.58942532575367,MSFT,Microsoft Corporation,"Machine Learning Market Outlook , Size , Share , Revenue , Regio ...  | Stock Market | Daily Herald | Perennial Advisors LLC Acquires 4 , 665 Shares of Microsoft Co . ( NASDAQ : MSFT )  | Microsoft Co . ( NASDAQ : MSFT ) Shares Sold by Threadgill Financial LLC | Microsoft Co . ( NASDAQ : MSFT ) Shares Bought by KRS Capital Management LLC","['Machine Learning Market Outlook , Size , Share , Revenue , Regio ...', 'Stock Market', 'Daily Herald', 'Perennial Advisors LLC Acquires 4 , 665 Shares of Microsoft Co . ( NASDAQ : MSFT )', 'Microsoft Co . ( NASDAQ : MSFT ) Shares Sold by Threadgill Financial LLC', 'Microsoft Co . ( NASDAQ : MSFT ) Shares Bought by KRS Capital Management LLC']",0.9990496635437012,0.00012785152648575604,0.0008224602788686752
2022-08-02,267.5814819335937,274.82000732421875,277.8900146484375,272.3800048828125,276.0,22754200,-0.0114744415571472,264.7626360323759,258.4977941082845,MSFT,Microsoft Corporation,"Europe SaaS SCM Market Report 2022 : Driven by Acceleration of Supply Chain Digitization , E - Commerce Boost and EU Regulations on Data Storage - ResearchAndMarkets . com | Research and Markets : Europe SaaS SCM Market Report 2022 : Driven by Acceleration of Supply Chain Digitization , E - Commerce Boost and EU Regulations on Data Storage | Stock Market | Daily Herald | Top 5 Stock Picks of Alexander Captain Cat Rock Capital | Activision Blizzard Inc revenues fall less than expected , Microsoft Corp deal expected to close soon","['Europe SaaS SCM Market Report 2022 : Driven by Acceleration of Supply Chain Digitization , E - Commerce Boost and EU Regulations on Data Storage - ResearchAndMarkets . com', 'Research and Markets : Europe SaaS SCM Market Report 2022 : Driven by Acceleration of Supply Chain Digitization , E - Commerce Boost and EU Regulations on Data Storage', 'Stock Market', 'Daily Herald', 'Top 5 Stock Picks of Alexander Captain Cat Rock Capital', 'Activision Blizzard Inc revenues fall less than expected , Microsoft Corp deal expected to close soon']",0.4990658462047577,0.33347561955451965,0.16745854914188385
2022-08-03,275.030029296875,282.4700012207031,283.5,276.6099853515625,276.760009765625,23518900,0.0278365577074193,267.32948434850067,260.0007245799746,MSFT,Microsoft Corporation,Stock Market Today : Dow Delivers Swashbuckling Gains as Earnings Shine By Investing . com | Stock Market | Daily Herald,"['Stock Market Today : Dow Delivers Swashbuckling Gains as Earnings Shine By Investing . com', 'Stock Market', 'Daily Herald']",0.6650037169456482,0.3333892524242401,0.0016070351703092456
