Date,Adj Close,Close,High,Low,Open,Volume,Daily_Return,EMA_7,EMA_21,Ticker,Company,Headlines,Headline_List,negative,neutral,positive
2021-01-04,209.27316284179688,217.69000244140625,223.0,214.80999755859372,222.52999877929688,37130100,,209.27316284179688,209.27316284179688,MSFT,Microsoft Corporation,"Arlington Asset Investment Corp ( NYSE : AI ), Adobe Systems Incorporated ( NASDAQ : ADBE ) - Is C3 . ai The  LeBron  Of Artificial Intelligence ? 4 Analyst Takes On Recent IPO | AI in Construction Market 2021 Business Trends , COVID - 19 Outbreak , Regional Analysis , Share , Size , Global Segments and Industry Profit Growth | EQUITY ALERT : Rosen Law Firm Files Securities Class Action Lawsuit Against SolarWinds Corporation","['Arlington Asset Investment Corp ( NYSE : AI ), Adobe Systems Incorporated ( NASDAQ : ADBE ) - Is C3 . ai The  LeBron  Of Artificial Intelligence ? 4 Analyst Takes On Recent IPO', 'AI in Construction Market 2021 Business Trends , COVID - 19 Outbreak , Regional Analysis , Share , Size , Global Segments and Industry Profit Growth', 'EQUITY ALERT : Rosen Law Firm Files Securities Class Action Lawsuit Against SolarWinds Corporation']",0.830906093120575,0.14322364330291748,0.025870291516184807
2021-01-05,209.47503662109372,217.8999938964844,218.5200042724609,215.6999969482422,217.25999450683597,23823000,0.000964642463255,209.3236312866211,209.29151500355115,MSFT,Microsoft Corporation,"Industrial Ethernet Switch Market 2020 Global Overview , Sales Revenue , Opportunities , Competitive Landscape and Comprehensive Research Study 2023 | Industrial Ethernet Switch Market 2020 Global Overview , Sales Revenue , Opportunities , Competitive Landscape and Comprehensive Research Study 2023 | Industrial Ethernet Switch Market 2020 Global Overview , Sales Revenue , Opportunities , Competitive Landscape and Comprehensive Research Study 2023 | Financial Research Software Market Will Hit Big Revenues In Future | Money Dashboard , Quicken , PocketSmith , Moneyspire | Financial Research Software Market Will Hit Big Revenues In Future | Money Dashboard , Quicken , PocketSmith , Moneyspire","['Industrial Ethernet Switch Market 2020 Global Overview , Sales Revenue , Opportunities , Competitive Landscape and Comprehensive Research Study 2023', 'Industrial Ethernet Switch Market 2020 Global Overview , Sales Revenue , Opportunities , Competitive Landscape and Comprehensive Research Study 2023', 'Industrial Ethernet Switch Market 2020 Global Overview , Sales Revenue , Opportunities , Competitive Landscape and Comprehensive Research Study 2023', 'Financial Research Software Market Will Hit Big Revenues In Future', 'Money Dashboard , Quicken , PocketSmith , Moneyspire', 'Financial Research Software Market Will Hit Big Revenues In Future', 'Money Dashboard , Quicken , PocketSmith , Moneyspire']",0.7052146196365356,0.290790855884552,0.003994483035057783
2021-01-06,204.04347229003903,212.25,216.4900054931641,211.94000244140625,212.1699981689453,35930700,-0.0259294110585572,208.0035915374756,208.81442021141368,MSFT,Microsoft Corporation,"Retail Sector Blockchain Market Outbreak : Key Trends , Growth , Insights and Forecast to 2027 : COVID - 19 imapct | SaaS Security Market : A Straight Overview of Growing Market & Future Trend by 2027 | Cloud API Market To See Extraordinary Growth | IBM Corporation ( Red Hat ), Microsoft Corporation , Google | Cloud API Market To See Extraordinary Growth | IBM Corporation ( Red Hat ), Microsoft Corporation , Google | Cloud API Market To See Extraordinary Growth | IBM Corporation ( Red Hat ), Microsoft Corporation , Google","['Retail Sector Blockchain Market Outbreak : Key Trends , Growth , Insights and Forecast to 2027 : COVID - 19 imapct', 'SaaS Security Market : A Straight Overview of Growing Market & Future Trend by 2027', 'Cloud API Market To See Extraordinary Growth', 'IBM Corporation ( Red Hat ), Microsoft Corporation , Google', 'Cloud API Market To See Extraordinary Growth', 'IBM Corporation ( Red Hat ), Microsoft Corporation , Google', 'Cloud API Market To See Extraordinary Growth', 'IBM Corporation ( Red Hat ), Microsoft Corporation , Google']",0.6234822869300842,0.37620455026626587,0.00031317706452682614
2021-01-07,209.84999084472656,218.2899932861328,219.33999633789065,213.7100067138672,214.0399932861328,27694500,0.0284572620212706,208.46519136428836,208.90856299626032,MSFT,Microsoft Corporation,"Artificial Intelligence Ai In Market Growth Factors , Trends , Consumption , Production , Revenue and Forecast 2020 - 2023 | Block chain IoT Market 2021 Business Trends , COVID - 19 Outbreak , Strategy , Applications Analysis and Industry Profit Growth by Forecast to 2025 | AI in Insurance Market 2021 Sales Revenue , Grow Pricing , Industry Growth Analysis , COVID - 19 Outbreak , Global Segments and Business Trends | AI in Insurance Market 2021 Sales Revenue , Grow Pricing , Industry Growth Analysis , COVID - 19 Outbreak , Global Segments and Business Trends | Turkey Albayrak Group files lawsuit against Microsoft , seeking $1 . 5 mln in damages","['Artificial Intelligence Ai In Market Growth Factors , Trends , Consumption , Production , Revenue and Forecast 2020 - 2023', 'Block chain IoT Market 2021 Business Trends , COVID - 19 Outbreak , Strategy , Applications Analysis and Industry Profit Growth by Forecast to 2025', 'AI in Insurance Market 2021 Sales Revenue , Grow Pricing , Industry Growth Analysis , COVID - 19 Outbreak , Global Segments and Business Trends', 'AI in Insurance Market 2021 Sales Revenue , Grow Pricing , Industry Growth Analysis , COVID - 19 Outbreak , Global Segments and Business Trends', 'Turkey Albayrak Group files lawsuit against Microsoft , seeking $1 . 5 mln in damages']",0.7364227771759033,0.13272766768932343,0.13084955513477325
2021-01-08,211.1285400390625,219.6199951171875,220.5800018310547,217.02999877929688,218.67999267578125,22956200,0.0060926816779418,209.13102853298187,209.1103790910605,MSFT,Microsoft Corporation,"Ai In Computer Vision Market 2020 Insights , Revenue , Price and Gross Margin , Forecast 2023 | RM LAW Announces Class Action Lawsuit Against SolarWinds Corporation | RM LAW Announces Class Action Lawsuit Against SolarWinds Corporation | Notice of Lead Plaintiff Deadline for Shareholders in the SolarWinds Corporation Class Action Lawsuit | Deadline Reminder : Law Offices of Howard G . Smith Reminds Investors of Looming Deadline in the Class Action Lawsuit Against SolarWinds Corporation ( SWI ) ","['Ai In Computer Vision Market 2020 Insights , Revenue , Price and Gross Margin , Forecast 2023', 'RM LAW Announces Class Action Lawsuit Against SolarWinds Corporation', 'RM LAW Announces Class Action Lawsuit Against SolarWinds Corporation', 'Notice of Lead Plaintiff Deadline for Shareholders in the SolarWinds Corporation Class Action Lawsuit', 'Deadline Reminder : Law Offices of Howard G . Smith Reminds Investors of Looming Deadline in the Class Action Lawsuit Against SolarWinds Corporation ( SWI )']",0.9298785328865051,0.022371521219611168,0.047749944031238556
2021-01-11,209.08090209960935,217.4900054931641,218.91000366210935,216.72999572753903,218.47000122070312,23031300,-0.0096985369153514,209.11849692463875,209.10769936456492,MSFT,Microsoft Corporation,"Microsoft Corporation ( NASDAQ : MSFT )- Stocks in Volatile Measures : AK Steel Holding ( NYSE : AKS )  | LAWSUITS FILED AGAINST BABA , SWI and GDRX - Jakubowitz Law Pursues Shareholders Claims","['Microsoft Corporation ( NASDAQ : MSFT )- Stocks in Volatile Measures : AK Steel Holding ( NYSE : AKS )', 'LAWSUITS FILED AGAINST BABA , SWI and GDRX - Jakubowitz Law Pursues Shareholders Claims']",0.7550594210624695,0.025274720042943954,0.21966582536697388
2021-01-12,206.619873046875,214.92999267578125,217.1000061035156,213.32000732421875,216.5,23249300,-0.011770702288064,208.4938409551978,208.88153333568405,MSFT,Microsoft Corporation,"Artificial Intelligence ( AI ) in Supply Chain Market 2021 Key Findings , Regional Study , Industry Profit Growth , Emerging Audience , Business Trends and Future Prospects | Blockchain IoT Market Will Hit Big Revenues In Future | Microsoft , Intel , Amazon | Blockchain IoT Market Will Hit Big Revenues In Future | Microsoft , Intel , Amazon | Blockchain IoT Market Will Hit Big Revenues In Future | Microsoft , Intel , Amazon | Microsoft announces quarterly earnings release date","['Artificial Intelligence ( AI ) in Supply Chain Market 2021 Key Findings , Regional Study , Industry Profit Growth , Emerging Audience , Business Trends and Future Prospects', 'Blockchain IoT Market Will Hit Big Revenues In Future', 'Microsoft , Intel , Amazon', 'Blockchain IoT Market Will Hit Big Revenues In Future', 'Microsoft , Intel , Amazon', 'Blockchain IoT Market Will Hit Big Revenues In Future', 'Microsoft , Intel , Amazon', 'Microsoft announces quarterly earnings release date']",0.5894805788993835,0.28826138377189636,0.12225804477930069
2021-01-13,207.9753570556641,216.33999633789065,216.75999450683597,213.92999267578125,214.0200042724609,20087100,0.0065602789741407,208.3642199803144,208.79915367386403,MSFT,Microsoft Corporation,"Artificial Intelligence ( AI ) in Supply Chain Market 2021 Key Findings , Regional Study , Industry Profit Growth , Emerging Audience , Business Trends and Future Prospects | Artificial Intelligence ( AI ) in Supply Chain Market 2021 Key Findings , Regional Study , Industry Profit Growth , Emerging Audience , Business Trends and Future Prospects | Affective Computing Market Will Generate Record Revenue By 2026 | GestureTek , Numenta , Pyreos , Eyesight , IBM , Microsoft | Affective Computing Market Will Generate Record Revenue By 2026 | GestureTek , Numenta , Pyreos , Eyesight , IBM , Microsoft | Affective Computing Market Will Generate Record Revenue By 2026 | GestureTek , Numenta , Pyreos , Eyesight , IBM , Microsoft","['Artificial Intelligence ( AI ) in Supply Chain Market 2021 Key Findings , Regional Study , Industry Profit Growth , Emerging Audience , Business Trends and Future Prospects', 'Artificial Intelligence ( AI ) in Supply Chain Market 2021 Key Findings , Regional Study , Industry Profit Growth , Emerging Audience , Business Trends and Future Prospects', 'Affective Computing Market Will Generate Record Revenue By 2026', 'GestureTek , Numenta , Pyreos , Eyesight , IBM , Microsoft', 'Affective Computing Market Will Generate Record Revenue By 2026', 'GestureTek , Numenta , Pyreos , Eyesight , IBM , Microsoft', 'Affective Computing Market Will Generate Record Revenue By 2026', 'GestureTek , Numenta , Pyreos , Eyesight , IBM , Microsoft']",0.5526027679443359,0.4470752775669098,0.00032197701511904597
2021-01-14,204.78375244140625,213.0200042724609,217.4600067138672,212.7400054931641,215.91000366210935,29480800,-0.0153460710895838,207.46910309558731,208.43411719818607,MSFT,Microsoft Corporation,"Apple Inc . ( NASDAQ : AAPL ), HYUNDAI MOTOR REG S ( HYMTF ) - Study : Investors Say Tesla , Apple And Microsoft Were 2020 Top Stocks | CI Security Adds Chief Revenue Officer & Vice President of Security Operations to Fuel Growth â Consumer Electronics Net | CI Security Adds Chief Revenue Officer & Vice President of Security Operations to Fuel Growth | Bragar Eagel & Squire , P . C . Reminds Investors That Class Action Lawsuits Have Been Filed Against Triterras , Restaurant Brands International , CD Projekt , and SolarWinds and Encourages Investors to Contact the Firm | Bragar Eagel & Squire , P . C . Reminds Investors That Class Action Lawsuits Have Been Filed Against Triterras , Restaurant Brands International , CD Projekt , and SolarWinds and Encourages Investors to Contact the Firm","['Apple Inc . ( NASDAQ : AAPL ), HYUNDAI MOTOR REG S ( HYMTF ) - Study : Investors Say Tesla , Apple And Microsoft Were 2020 Top Stocks', 'CI Security Adds Chief Revenue Officer & Vice President of Security Operations to Fuel Growth â\x80\x93 Consumer Electronics Net', 'CI Security Adds Chief Revenue Officer & Vice President of Security Operations to Fuel Growth', 'Bragar Eagel & Squire , P . C . Reminds Investors That Class Action Lawsuits Have Been Filed Against Triterras , Restaurant Brands International , CD Projekt , and SolarWinds and Encourages Investors to Contact the Firm', 'Bragar Eagel & Squire , P . C . Reminds Investors That Class Action Lawsuits Have Been Filed Against Triterras , Restaurant Brands International , CD Projekt , and SolarWinds and Encourages Investors to Contact the Firm']",0.570972740650177,0.4287591576576233,0.00026818414335139096
2021-01-15,204.42800903320312,212.6499938964844,214.50999450683597,212.02999877929688,213.5200042724609,31746500,-0.0017371661763299,206.7088295799913,208.069925546824,MSFT,Microsoft Corporation,"Retail Analytics Market 2021 Emerging Audience , COVID - 19 Pandemic Impact , Segments , Sales Profits and Comprehensive Research till 2023 | Retail Analytics Market 2021 Emerging Audience , COVID - 19 Pandemic Impact , Segments , Sales Profits and Comprehensive Research till 2023 | Retail Analytics Market 2021 Emerging Audience , COVID - 19 Pandemic Impact , Segments , Sales Profits and Comprehensive Research till 2023 | CI Security Adds Chief Revenue Officer & Vice President of Security Operations to Fuel Growth | CI Security Adds Chief Revenue Officer & Vice President of Security Operations to Fuel Growth","['Retail Analytics Market 2021 Emerging Audience , COVID - 19 Pandemic Impact , Segments , Sales Profits and Comprehensive Research till 2023', 'Retail Analytics Market 2021 Emerging Audience , COVID - 19 Pandemic Impact , Segments , Sales Profits and Comprehensive Research till 2023', 'Retail Analytics Market 2021 Emerging Audience , COVID - 19 Pandemic Impact , Segments , Sales Profits and Comprehensive Research till 2023', 'CI Security Adds Chief Revenue Officer & Vice President of Security Operations to Fuel Growth', 'CI Security Adds Chief Revenue Officer & Vice President of Security Operations to Fuel Growth']",0.5999850034713745,0.40000754594802856,7.469971023965627e-06
2021-01-19,208.07151794433597,216.44000244140625,216.97999572753903,212.6300048828125,213.75,30480900,0.0178229437754835,207.04950167107745,208.07007031023417,MSFT,Microsoft Corporation,"Healthcare AI Market revenue to cross USD 21 Bn by 2026 : Global Market Insights , Inc .  | Worldwide Fog Computing Market Exclusive Profitable Comprehensive Report | Cisco Systems Inc , Microsoft Corporation | General Motors Company ( NYSE : GM ), Microsoft Corporation ( NASDAQ : MSFT ) - Microsoft , General Motors Strike Autonomous Vehicle Partnership : What Investors Need To Know","['Healthcare AI Market revenue to cross USD 21 Bn by 2026 : Global Market Insights , Inc .', 'Worldwide Fog Computing Market Exclusive Profitable Comprehensive Report', 'Cisco Systems Inc , Microsoft Corporation', 'General Motors Company ( NYSE : GM ), Microsoft Corporation ( NASDAQ : MSFT ) - Microsoft , General Motors Strike Autonomous Vehicle Partnership : What Investors Need To Know']",0.9957308769226074,0.003954416140913963,0.00031473604030907154
2021-01-20,215.66604614257807,224.33999633789065,225.7899932861328,217.2899932861328,217.6999969482422,37777300,0.0364996049112011,209.20363778895265,208.76061356772,MSFT,Microsoft Corporation,"Application Hosting Market Research , Size , Share , Revenue , COVID - 19 Pandemic Impact , Production Value , Outstanding Growth and Demand by Forecast to 2023 | Application Hosting Market Research , Size , Share , Revenue , COVID - 19 Pandemic Impact , Production Value , Outstanding Growth and Demand by Forecast to 2023 | Application Hosting Market Research , Size , Share , Revenue , COVID - 19 Pandemic Impact , Production Value , Outstanding Growth and Demand by Forecast to 2023 | Blockchain in Retail Market 2021 COVID - 19 Pandemic Impact , Emerging Audience , Segments , Sales Profits and Comprehensive Research till 2023 | Blockchain in Retail Market 2021 COVID - 19 Pandemic Impact , Emerging Audience , Segments , Sales Profits and Comprehensive Research till 2023","['Application Hosting Market Research , Size , Share , Revenue , COVID - 19 Pandemic Impact , Production Value , Outstanding Growth and Demand by Forecast to 2023', 'Application Hosting Market Research , Size , Share , Revenue , COVID - 19 Pandemic Impact , Production Value , Outstanding Growth and Demand by Forecast to 2023', 'Application Hosting Market Research , Size , Share , Revenue , COVID - 19 Pandemic Impact , Production Value , Outstanding Growth and Demand by Forecast to 2023', 'Blockchain in Retail Market 2021 COVID - 19 Pandemic Impact , Emerging Audience , Segments , Sales Profits and Comprehensive Research till 2023', 'Blockchain in Retail Market 2021 COVID - 19 Pandemic Impact , Emerging Audience , Segments , Sales Profits and Comprehensive Research till 2023']",0.9997720718383789,0.00019634960335679352,3.161472704960033e-05
2021-01-21,216.2716522216797,224.97000122070312,226.3000030517578,222.4199981689453,224.6999969482422,30709400,0.0028080733612614,210.9706413971344,209.4434352635345,MSFT,Microsoft Corporation,"Blockchain in Fintech Market 2023 Size , Share , Industry Trends , Business Revenue Forecast Statistics and Growth Prospective | Blockchain in Fintech Market 2023 Size , Share , Industry Trends , Business Revenue Forecast Statistics and Growth Prospective | Blockchain in Fintech Market 2023 Size , Share , Industry Trends , Business Revenue Forecast Statistics and Growth Prospective | Cybersecurity Market to Surpass with CAGR of 11 . 2 % and Garner Revenue of $300 Billion in 2019 - 2027 - Exclusive Report By Meticulous Research | Glancy Prongay & Murray LLP Reminds Investors of Looming Deadline in the Class Action Lawsuit Against SolarWinds Corporation ( SWI ) ","['Blockchain in Fintech Market 2023 Size , Share , Industry Trends , Business Revenue Forecast Statistics and Growth Prospective', 'Blockchain in Fintech Market 2023 Size , Share , Industry Trends , Business Revenue Forecast Statistics and Growth Prospective', 'Blockchain in Fintech Market 2023 Size , Share , Industry Trends , Business Revenue Forecast Statistics and Growth Prospective', 'Cybersecurity Market to Surpass with CAGR of 11 . 2 % and Garner Revenue of $300 Billion in 2019 - 2027 - Exclusive Report By Meticulous Research', 'Glancy Prongay & Murray LLP Reminds Investors of Looming Deadline in the Class Action Lawsuit Against SolarWinds Corporation ( SWI )']",0.7973048090934753,0.20018640160560608,0.002508692443370819
2021-01-22,217.2137908935547,225.9499969482422,230.07000732421875,225.8000030517578,227.0800018310547,30172700,0.0043562744455722,212.53142877123943,210.1498312299,MSFT,Microsoft Corporation,"Edge Computing Market to Surpass with CAGR of 34 . 9 % and Garner Revenue of $28 . 07 Billion in 2019 - 2027 - Exclusive Report By Meticulous Research |  ( CODX ), ( DDOG ) - Schaeffer Investment Research : Top 2 Contrarian Stock Picks For 2021 | Software Defined Data Center ( SDDC ) Market 2021 | Trends and Analysis Research Report 2025 | Microsoft and SAP Expand Partnership and Plan Integration of Microsoft Teams across Solutions | # site _ titleMicrosoft and SAP Expand Partnership and Plan Integration of Microsoft Teams across Solutions | Deadline Reminder : Law Offices of Howard G . Smith Reminds Investors of Looming Deadline in the Class Action Lawsuit Against SolarWinds Corporation ( SWI ) ","['Edge Computing Market to Surpass with CAGR of 34 . 9 % and Garner Revenue of $28 . 07 Billion in 2019 - 2027 - Exclusive Report By Meticulous Research', '( CODX ), ( DDOG ) - Schaeffer Investment Research : Top 2 Contrarian Stock Picks For 2021', 'Software Defined Data Center ( SDDC ) Market 2021', 'Trends and Analysis Research Report 2025', 'Microsoft and SAP Expand Partnership and Plan Integration of Microsoft Teams across Solutions', '# site _ titleMicrosoft and SAP Expand Partnership and Plan Integration of Microsoft Teams across Solutions', 'Deadline Reminder : Law Offices of Howard G . Smith Reminds Investors of Looming Deadline in the Class Action Lawsuit Against SolarWinds Corporation ( SWI )']",0.5386340618133545,0.459461510181427,0.00190444674808532
2021-01-25,220.65538024902344,229.52999877929688,229.77999877929688,224.22000122070312,229.1199951171875,33152100,0.015844248844933,214.56241664068543,211.1048811407294,MSFT,Microsoft Corporation,"United States $50+ Billion Software Defined Data Center Market Forecast to 2027 - ResearchAndMarkets . com | United States $50+ Billion Software Defined Data Center Market Forecast to 2027 - ResearchAndMarkets . com - Press Release | Amazon . com , Inc . ( NASDAQ : AMZN ), Microsoft Corporation ( NASDAQ : MSFT ) - Work Hard ( From Home ), Play Hard ( From Home ) - Microsoft Earnings To Feature Cloud And Gaming Tech | Facebook , Inc . ( NASDAQ : FB ), Microsoft Corporation ( NASDAQ : MSFT ) - Revenue And Regulatory Risk : Facebook Prepares To Open The Books On Q4","['United States $50+ Billion Software Defined Data Center Market Forecast to 2027 - ResearchAndMarkets . com', 'United States $50+ Billion Software Defined Data Center Market Forecast to 2027 - ResearchAndMarkets . com - Press Release', 'Amazon . com , Inc . ( NASDAQ : AMZN ), Microsoft Corporation ( NASDAQ : MSFT ) - Work Hard ( From Home ), Play Hard ( From Home ) - Microsoft Earnings To Feature Cloud And Gaming Tech', 'Facebook , Inc . ( NASDAQ : FB ), Microsoft Corporation ( NASDAQ : MSFT ) - Revenue And Regulatory Risk : Facebook Prepares To Open The Books On Q4']",0.8173533082008362,6.673153256997466e-05,0.18257996439933777
2021-01-26,223.3470916748047,232.3300018310547,234.17999267578125,230.0800018310547,231.8600006103516,49169600,0.0121987119586364,216.7585853992153,212.21780937109983,MSFT,Microsoft Corporation,"Microsoft Corporation Profit Advances In Q2 | Microsoft earnings press release available on Investor Relations website | Microsoft earnings press release available on Investor Relations website | Microsoft earnings press release available on Investor Relations website |  ( AAL ), Apple Inc . ( NASDAQ : AAPL ) - Earnings Continue With Johnson & Johnson , 3M Early , Followed By Microsoft Later","['Microsoft Corporation Profit Advances In Q2', 'Microsoft earnings press release available on Investor Relations website', 'Microsoft earnings press release available on Investor Relations website', 'Microsoft earnings press release available on Investor Relations website', '( AAL ), Apple Inc . ( NASDAQ : AAPL ) - Earnings Continue With Johnson & Johnson , 3M Early , Followed By Microsoft Later']",0.9934865832328796,0.0034214023035019636,0.003091997466981411
2021-01-27,223.89505004882807,232.8999938964844,240.44000244140625,230.13999938964844,238.0,69870600,0.0024533938181798,218.5427015616185,213.2793767054388,MSFT,Microsoft Corporation,Microsoft Corporation ( NASDAQ : MSFT ) - PreMarket Prep Stock Of The Day : Microsoft | A Peek Into The Markets : US Stock Futures Mixed ; Microsoft Beats Q2 Estimates | Microsoft Strong Ad Revenue Drives Optimism Among Alphabet & Facebook Investors | Microsoft registers 17 % revenue growth on cloud computing push,"['Microsoft Corporation ( NASDAQ : MSFT ) - PreMarket Prep Stock Of The Day : Microsoft', 'A Peek Into The Markets : US Stock Futures Mixed ; Microsoft Beats Q2 Estimates', 'Microsoft Strong Ad Revenue Drives Optimism Among Alphabet & Facebook Investors', 'Microsoft registers 17 % revenue growth on cloud computing push']",0.2503197491168976,0.7024630904197693,0.04721715301275253
2021-01-28,229.69192504882807,238.92999267578125,242.63999938964844,235.08999633789065,235.6100006103516,49111200,0.0258910368886484,221.3300074334209,214.7714265548378,MSFT,Microsoft Corporation,Apple Inc . ( AAPL ) Stock To The Moon ? - ETF Daily News,['Apple Inc . ( AAPL ) Stock To The Moon ? - ETF Daily News'],0.9999871253967285,3.612307864386821e-06,9.2473137556226e-06
2021-01-29,222.991455078125,231.9600067138672,238.0200042724609,231.3500061035156,235.9900054931641,42503100,-0.0291715521530795,221.74536934459687,215.51870187513663,MSFT,Microsoft Corporation,"Microsoft Corporation ( NASDAQ : MSFT ), SPDR S & P 500 ETF ( ETF : SPY ) - $1 , 000 , 5 Years Later : How Much Would Microsoft Stock Be Worth ?  | Nokia is  Clueles on their Stock Share Gain , Teases New Phone | Microsoft , Netflix , AMD : Big Tech Earnings Power Remains Intact","['Microsoft Corporation ( NASDAQ : MSFT ), SPDR S & P 500 ETF ( ETF : SPY ) - $1 , 000 , 5 Years Later : How Much Would Microsoft Stock Be Worth ?', 'Nokia is  Clueles on their Stock Share Gain , Teases New Phone', 'Microsoft , Netflix , AMD : Big Tech Earnings Power Remains Intact']",0.6658440232276917,0.3339592218399048,0.00019671466725412756
