Date,Adj Close,Close,High,Low,Open,Volume,Daily_Return,EMA_7,EMA_21,Ticker,Company,Headlines,Headline_List,negative,neutral,positive
2023-03-31,282.8015441894531,288.29998779296875,289.2699890136719,283.0,283.7300109863281,32766000,0.0149621592351476,275.36731202743664,266.29057261209465,MSFT,Microsoft Corporation,"FOSS Patents : Microsoft acquisition of Activision Blizzard unconditionally cleared by Chile competition authority FNE : no substantial lessening of competition , no consumer harm","['FOSS Patents : Microsoft acquisition of Activision Blizzard unconditionally cleared by Chile competition authority FNE : no substantial lessening of competition , no consumer harm']",0.9868596196174622,0.00820833444595337,0.004932112526148558
2023-04-03,281.7519836425781,287.2300109863281,288.2699890136719,283.95001220703125,286.5199890136719,24883300,-0.0037112970860296,276.963479931222,267.6961554330477,MSFT,Microsoft Corporation,"AI In Oil And Gas Market Size , Share , Revenue , Trends And Dr ...  | AI In Oil And Gas Market Size , Share , Revenue , Trends And Drivers For 2023 - 2032","['AI In Oil And Gas Market Size , Share , Revenue , Trends And Dr ...', 'AI In Oil And Gas Market Size , Share , Revenue , Trends And Drivers For 2023 - 2032']",0.9652767181396484,0.000763130490668118,0.03396021947264671
2023-04-04,281.7029113769531,287.17999267578125,290.45001220703125,285.6700134277344,287.2300109863281,25824300,-0.0001741683057225,278.1483377926548,268.9694968824936,MSFT,Microsoft Corporation,"Brandessence Market Research and Consulting Private Limited : IoT In Healthcare Market Size Growing at 19 . 20 % CAGR , Set to Reach USD 388 . 18 Billion by 2027 says Brandessence Market Research | Gesture Recognition Market Is Expected to Generate $88 . 2 Billion by 2031 : Allied Market Research | IoT In Healthcare Market Size Growing at 19 . 20 % CAGR , Set to Reach USD 388 . 18 Billion by 2027 says Brandessence Market Research | IoT In Healthcare Market Size Growing at 19 . 20 % CAGR , Set to Reach USD 388 . 18 Billion by 2027 says Brandessence Market Research | Blockchain in Healthcare Market Size & Share to Surpass $1189 . 8 Million by 2028","['Brandessence Market Research and Consulting Private Limited : IoT In Healthcare Market Size Growing at 19 . 20 % CAGR , Set to Reach USD 388 . 18 Billion by 2027 says Brandessence Market Research', 'Gesture Recognition Market Is Expected to Generate $88 . 2 Billion by 2031 : Allied Market Research', 'IoT In Healthcare Market Size Growing at 19 . 20 % CAGR , Set to Reach USD 388 . 18 Billion by 2027 says Brandessence Market Research', 'IoT In Healthcare Market Size Growing at 19 . 20 % CAGR , Set to Reach USD 388 . 18 Billion by 2027 says Brandessence Market Research', 'Blockchain in Healthcare Market Size & Share to Surpass $1189 . 8 Million by 2028']",0.7938040494918823,0.20617131888866425,2.4701017537154257e-05
2023-04-05,278.9170837402344,284.3399963378906,287.1499938964844,282.9200134277344,285.8500061035156,22064800,-0.0098892397778274,278.3405242795497,269.87382296047,MSFT,Microsoft Corporation,Willing To Accept Profit Cuts Loss For Certain Period Sridhar Vembu On Persisting With No Layoffs,['Willing To Accept Profit Cuts Loss For Certain Period Sridhar Vembu On Persisting With No Layoffs'],0.06975781917572021,0.0008419463993050158,0.9294002652168274
2023-04-06,286.03863525390625,291.6000061035156,292.0799865722656,282.0299987792969,283.2099914550781,29770300,0.0255328623767787,280.2650520231388,271.3433513507824,MSFT,Microsoft Corporation,24 . 5 % CAGR of Artificial Intelligence ( AI ) in Agriculture Market to Cross to USD 10 . 2 billion in Revenues by 2032,['24 . 5 % CAGR of Artificial Intelligence ( AI ) in Agriculture Market to Cross to USD 10 . 2 billion in Revenues by 2032'],0.8944327235221863,0.1054651290178299,0.00010216143709840253
2023-04-10,283.8707275390625,289.3900146484375,289.6000061035156,284.7099914550781,289.2099914550781,23103000,-0.0075790730609498,281.1664709021197,272.48220373153515,MSFT,Microsoft Corporation,Global Blockchain Supply Chain Market Projected To Garner Significant Revenues By 2031,['Global Blockchain Supply Chain Market Projected To Garner Significant Revenues By 2031'],2.3526736185885966e-05,0.9999746084213257,1.9171613985236036e-06
2023-04-11,277.4358215332031,282.8299865722656,285.9800109863281,281.6400146484375,285.75,27276600,-0.0226684380656116,280.2338085598906,272.9325326225959,MSFT,Microsoft Corporation,Comstock Mining ( LODE ) Appoints New Director and Audit Committee Chair | Comstock Appoints New Director and Audit Committee Chair,"['Comstock Mining ( LODE ) Appoints New Director and Audit Committee Chair', 'Comstock Appoints New Director and Audit Committee Chair']",0.9999797344207764,5.702547127839352e-07,1.962697751878295e-05
2023-04-12,278.0832824707031,283.489990234375,287.010009765625,281.9599914550781,284.7900085449219,27403400,0.0023337322985976,279.6961770375937,273.40078260878744,MSFT,Microsoft Corporation,"Global Digital Twin Markets , Segments , Outlook , and Revenue Forecasts Report 2022 - 2028 : Increasing the Use of Digital Twins in Manufacturing Sectors to Cut Costs and Enhance Supply Chain Efficiency","['Global Digital Twin Markets , Segments , Outlook , and Revenue Forecasts Report 2022 - 2028 : Increasing the Use of Digital Twins in Manufacturing Sectors to Cut Costs and Enhance Supply Chain Efficiency']",3.1927820600685664e-06,0.9999955892562866,1.158383270194463e-06
2023-04-13,284.3121643066406,289.8399963378906,289.8999938964844,283.1700134277344,283.5899963378906,24222700,0.0223993394374353,280.8501738548554,274.3927263995014,MSFT,Microsoft Corporation,"Electronic Data Management Market to Reach $19 . 3 Billion , Globally , by 2031 at 12 . 2 % CAGR : Allied Market Research | Electronic Data Management Market to Reach $19 . 3 Billion , Globally , by 2031 at 12 . 2 % CAGR : Allied Market Research | Electronic Data Management Market to Reach $19 . 3 Billion , Globally , by 2031 at 12 . 2 % CAGR : Allied Market Research | Electronic Data Management Market to Reach $19 . 3 Billion , Globally , by 2031 at 12 . 2 % CAGR : Allied Market Research | Blockchain - As - A - Service Market Research | Industry Trends & ... ","['Electronic Data Management Market to Reach $19 . 3 Billion , Globally , by 2031 at 12 . 2 % CAGR : Allied Market Research', 'Electronic Data Management Market to Reach $19 . 3 Billion , Globally , by 2031 at 12 . 2 % CAGR : Allied Market Research', 'Electronic Data Management Market to Reach $19 . 3 Billion , Globally , by 2031 at 12 . 2 % CAGR : Allied Market Research', 'Electronic Data Management Market to Reach $19 . 3 Billion , Globally , by 2031 at 12 . 2 % CAGR : Allied Market Research', 'Blockchain - As - A - Service Market Research', 'Industry Trends & ...']",0.9978695511817932,0.00103025755379349,0.001100180670619011
2023-04-14,280.6827697753906,286.1400146484375,288.4800109863281,283.69000244140625,287.0,20987900,-0.0127655267234206,280.8083228349892,274.9645485245822,MSFT,Microsoft Corporation,"United States Green Data Center Market Outlook & Forecast Report 2023 - 2028 : Hyperscale Players Such as AWS , Google , Meta , Microsoft , and Apple are Procuring Renewable Energy for Their Facilities â ResearchAndMarkets . com | United States Green Data Center Market Outlook & Forecast Report 2023 - 2028 : Hyperscale Players Such as AWS , Google , Meta , Microsoft , and Apple are Procuring Renewable Energy for Their Facilities - ResearchAndMarkets . com | Cloud Microservices Platform Market to Reach $6 . 4 Billion , Globally , by 2031 at 21 . 2 % CAGR : Allied Market Research | Cloud Microservices Platform Market to Reach $6 . 4 Billion , Globally , by 2031 at 21 . 2 % CAGR : Allied Market Research | Cloud Microservices Platform Market to Reach $6 . 4 Billion , Globally , by 2031 at 21 . 2 % CAGR : Allied Market Research","['United States Green Data Center Market Outlook & Forecast Report 2023 - 2028 : Hyperscale Players Such as AWS , Google , Meta , Microsoft , and Apple are Procuring Renewable Energy for Their Facilities â\x80\x93 ResearchAndMarkets . com', 'United States Green Data Center Market Outlook & Forecast Report 2023 - 2028 : Hyperscale Players Such as AWS , Google , Meta , Microsoft , and Apple are Procuring Renewable Energy for Their Facilities - ResearchAndMarkets . com', 'Cloud Microservices Platform Market to Reach $6 . 4 Billion , Globally , by 2031 at 21 . 2 % CAGR : Allied Market Research', 'Cloud Microservices Platform Market to Reach $6 . 4 Billion , Globally , by 2031 at 21 . 2 % CAGR : Allied Market Research', 'Cloud Microservices Platform Market to Reach $6 . 4 Billion , Globally , by 2031 at 21 . 2 % CAGR : Allied Market Research']",0.9973371624946594,0.002648533321917057,1.4412357813853305e-05
2023-04-17,283.2919616699219,288.79998779296875,291.6000061035156,286.1600036621094,289.92999267578125,23836200,0.0092958748291502,281.4292325437224,275.72158608324946,MSFT,Microsoft Corporation,"Global Quantum Technologies Market to Generate Revenue of US$ 21 . 38 Billion by 2031 | IBM and Microsoft Contribute over 34 % Revenue : Astute Analytica | AI in Fintech Market 2021 â Growth Factor , Industry Revenue & SWOT Analysis with Key Players Cognizant , Capgemini , FICO | Alphabet Inc stock falls on reports Google may lose Samsung business to Microsoft Bing","['Global Quantum Technologies Market to Generate Revenue of US$ 21 . 38 Billion by 2031', 'IBM and Microsoft Contribute over 34 % Revenue : Astute Analytica', 'AI in Fintech Market 2021 â\x80\x93 Growth Factor , Industry Revenue & SWOT Analysis with Key Players Cognizant , Capgemini , FICO', 'Alphabet Inc stock falls on reports Google may lose Samsung business to Microsoft Bing']",0.5884683728218079,0.1612931787967682,0.25023844838142395
2023-04-18,282.8702087402344,288.3699951171875,291.760009765625,287.010009765625,291.57000732421875,20161800,-0.0014887571366352,281.7894765928504,276.3714608702481,MSFT,Microsoft Corporation,US close : Stocks higher as traders await earnings | Lawsuits pile up against companies who failed to honor DE & I pledges after murder of George Floyd,"['US close : Stocks higher as traders await earnings', 'Lawsuits pile up against companies who failed to honor DE & I pledges after murder of George Floyd']",0.2036857306957245,0.5004041790962219,0.2959100902080536
2023-04-19,282.9486694335937,288.45001220703125,289.04998779296875,284.5400085449219,285.989990234375,17150300,0.0002773734770755,282.07927480303624,276.9693889214613,MSFT,Microsoft Corporation,AI Eye Podcast : AI Stocks in the News : ( NasdaqGS : $MSFT ) ( NYSE : $ORCL ) ,['AI Eye Podcast : AI Stocks in the News : ( NasdaqGS : $MSFT ) ( NYSE : $ORCL )'],0.9999964237213135,2.5427343643968925e-06,1.1022756325473893e-06
2023-04-20,280.6532897949219,286.1099853515625,289.0299987792969,285.0799865722656,285.25,23244400,-0.0081123535348894,281.72277855100765,277.3042890008668,MSFT,Microsoft Corporation,Elon Musk Warns Lawsuit Against Microsoft For Twitter Data Mining | FOSS Patents : Microsoft wants private U . S . lawsuit over Activision Blizzard purchase thrown out for good as transaction benefits gamers ; politicians take FTC to task ; and all eyes on London after another clearance,"['Elon Musk Warns Lawsuit Against Microsoft For Twitter Data Mining', 'FOSS Patents : Microsoft wants private U . S . lawsuit over Activision Blizzard purchase thrown out for good as transaction benefits gamers ; politicians take FTC to task ; and all eyes on London after another clearance']",0.06377644091844559,0.47421225905418396,0.46201130747795105
2023-04-21,280.3100280761719,285.760009765625,286.2699890136719,283.0599975585937,285.010009765625,21676400,-0.0012230810442337,281.3695909322987,277.5775380077127,MSFT,Microsoft Corporation," [ Latest ] Global Gamifi Market Size / Share Worth USD 95 . 3 Billion by 2030 at a 25 . 40 % CAGR : Zion Market Research ( Gamification Industrial Trends , Report , Analysis , Players , Outlook , Forecast , Growth , Value , Segmentation )  | NEC APAC recognized at the 2023 Microsoft Singapore and Asia Pacific Partner of the Year Awards | NEC APAC recognized at the 2023 Microsoft Singapore and Asia Pacific Partner of the Year Awards | Pope loses verified  blue tick  on Twitter as paid subscription takes effect | World News | Elon Musk forms X . AI artificial intelligence company","['[ Latest ] Global Gamifi Market Size / Share Worth USD 95 . 3 Billion by 2030 at a 25 . 40 % CAGR : Zion Market Research ( Gamification Industrial Trends , Report , Analysis , Players , Outlook , Forecast , Growth , Value , Segmentation )', 'NEC APAC recognized at the 2023 Microsoft Singapore and Asia Pacific Partner of the Year Awards', 'NEC APAC recognized at the 2023 Microsoft Singapore and Asia Pacific Partner of the Year Awards', 'Pope loses verified  blue tick  on Twitter as paid subscription takes effect', 'World News', 'Elon Musk forms X . AI artificial intelligence company']",0.8296166062355042,0.0036182187031954527,0.16676513850688934
2023-04-24,276.3960876464844,281.7699890136719,284.95001220703125,278.7200012207031,282.0899963378906,26611000,-0.0139628983541891,280.1262151108451,277.4701334294192,MSFT,Microsoft Corporation,"U . S . stocks muted as investors await wave of earnings , including big tech | Stocks Set to Open Lower as Investors Await Big Tech Earnings , Economic Data","['U . S . stocks muted as investors await wave of earnings , including big tech', 'Stocks Set to Open Lower as Investors Await Big Tech Earnings , Economic Data']",0.004803223069757223,0.00012432529183570296,0.9950724840164185
2023-04-25,270.167236328125,275.4200134277344,281.6000061035156,275.3699951171875,279.510009765625,45772200,-0.0225359605173796,277.6364704151651,276.8062336929379,MSFT,Microsoft Corporation,Higher Open Called For Thai Stock Market | Taiwan Stock Market May Spin Its Wheels On Tuesday | Higher Open Called For Thai Stock Market | 10 Cheap AI Stocks to Buy in 2023 - Insider Monkey | 10 Cheap AI Stocks to Buy in 2023,"['Higher Open Called For Thai Stock Market', 'Taiwan Stock Market May Spin Its Wheels On Tuesday', 'Higher Open Called For Thai Stock Market', '10 Cheap AI Stocks to Buy in 2023 - Insider Monkey', '10 Cheap AI Stocks to Buy in 2023']",0.675179660320282,0.32473716139793396,8.314710430568084e-05
2023-04-26,289.7366943359375,295.3699951171875,299.57000732421875,292.7300109863281,296.70001220703125,64599200,0.0724346085549947,280.6615263953582,277.9817301150288,MSFT,Microsoft Corporation,"Microsoft Fiscal Q3 2023 Report Beats Estimates , MSFT Stock Up 7 % in Pre - market | Stock market today : Dow falls as banking jitters overshadow Microsoft rally By | Midday movers : Microsoft , Enphase Energy , Chipotle Mexican Grill and more By Investing . com | Midday movers : Microsoft , Enphase Energy , Chipotle Mexican Grill and more | Activision stock dives as united kingdom blocks Microsoft merger","['Microsoft Fiscal Q3 2023 Report Beats Estimates , MSFT Stock Up 7 % in Pre - market', 'Stock market today : Dow falls as banking jitters overshadow Microsoft rally By', 'Midday movers : Microsoft , Enphase Energy , Chipotle Mexican Grill and more By Investing . com', 'Midday movers : Microsoft , Enphase Energy , Chipotle Mexican Grill and more', 'Activision stock dives as united kingdom blocks Microsoft merger']",0.6395119428634644,0.20026198029518127,0.1602260172367096
2023-04-27,299.01629638671875,304.8299865722656,305.20001220703125,295.25,295.9700012207031,46462600,0.0320277073363097,285.25021889319834,279.89396341245515,MSFT,Microsoft Corporation,"Intel Q1 Earnings Highlights : Revenue And EPS Beat , AI Update , Guidance And More - Intel ( NASDAQ : INTC )  | Tech Shares May Support Taiwan Stock Market | Tech Shares May Support Taiwan Stock Market | How to buy Microsoft stock ( MSFT )  | AI Stocks to Watch as Investors Look to Ride the Next Technology Wave","['Intel Q1 Earnings Highlights : Revenue And EPS Beat , AI Update , Guidance And More - Intel ( NASDAQ : INTC )', 'Tech Shares May Support Taiwan Stock Market', 'Tech Shares May Support Taiwan Stock Market', 'How to buy Microsoft stock ( MSFT )', 'AI Stocks to Watch as Investors Look to Ride the Next Technology Wave']",0.7451443672180176,0.23980753123760223,0.015048084780573845
2023-04-28,301.3999938964844,307.260009765625,308.92999267578125,303.3099975585937,304.010009765625,36469600,0.0079717979875009,289.28766264401986,281.84905709282145,MSFT,Microsoft Corporation,Microsoft Corporation ( NASDAQ : MSFT ) Q3 2023 Earnings Call Transcript | Ukraine approves Microsoft acquisition of Activision Blizzard | Microsoft President Calls CMA Decision to Block Activision Blizzard Acquisition a  Bad Day for Britain  ,"['Microsoft Corporation ( NASDAQ : MSFT ) Q3 2023 Earnings Call Transcript', 'Ukraine approves Microsoft acquisition of Activision Blizzard', 'Microsoft President Calls CMA Decision to Block Activision Blizzard Acquisition a  Bad Day for Britain']",0.9985666275024414,0.000798735476564616,0.0006346609443426132
2023-05-01,299.7323608398437,305.5599975585937,308.6000061035156,305.1499938964844,306.9700012207031,21294100,-0.00553295650435,291.89883719297586,283.4748119789144,MSFT,Microsoft Corporation,"Stocks Edge Higher , Fed Decision In Focus , First Republic Fail , G - 7 Eyes AI , Arm IPO - Five Things To Know | Stocks Edge Higher , Fed Decision In Focus , First Republic Fail , G - 7 Eyes AI , Arm IPO - Five Things To Know | Stocks Edge Higher , Fed Decision In Focus , First Republic Fail , G - 7 Eyes AI , Arm IPO - Five Things To Know | Stocks Edge Higher , Fed Decision In Focus , First Republic Fail , G - 7 Eyes AI , Arm IPO - Five Things To Know | Stocks Edge Higher , Fed Decision In Focus , First Republic Fail , G - 7 Eyes AI , Arm IPO - Five Things To Know","['Stocks Edge Higher , Fed Decision In Focus , First Republic Fail , G - 7 Eyes AI , Arm IPO - Five Things To Know', 'Stocks Edge Higher , Fed Decision In Focus , First Republic Fail , G - 7 Eyes AI , Arm IPO - Five Things To Know', 'Stocks Edge Higher , Fed Decision In Focus , First Republic Fail , G - 7 Eyes AI , Arm IPO - Five Things To Know', 'Stocks Edge Higher , Fed Decision In Focus , First Republic Fail , G - 7 Eyes AI , Arm IPO - Five Things To Know', 'Stocks Edge Higher , Fed Decision In Focus , First Republic Fail , G - 7 Eyes AI , Arm IPO - Five Things To Know']",0.04230384901165962,0.957078754901886,0.0006174718728289008
2023-05-02,299.5852355957031,305.4100036621094,309.17999267578125,303.9100036621094,307.760009765625,26404400,-0.0004908553875476,293.8204367936577,284.939395944077,MSFT,Microsoft Corporation,"Internet of Things ( IoT ) In Retail Market to be Worth $297 . 44 Billion by 2030 : Grand View Research , Inc .  | Internet of Things ( IoT ) In Retail Market to be Worth $297 . 44 Billion by 2030 : Grand View Research , Inc .  | IBM to stop recruiting , may replace 7 , 800 jobs with AI | Microsoft Sued for Infringement of Graphic Display and Processing Patents | Recruiters Implement AI - Powered Solutions to Ease Processes","['Internet of Things ( IoT ) In Retail Market to be Worth $297 . 44 Billion by 2030 : Grand View Research , Inc .', 'Internet of Things ( IoT ) In Retail Market to be Worth $297 . 44 Billion by 2030 : Grand View Research , Inc .', 'IBM to stop recruiting , may replace 7 , 800 jobs with AI', 'Microsoft Sued for Infringement of Graphic Display and Processing Patents', 'Recruiters Implement AI - Powered Solutions to Ease Processes']",0.6554416418075562,0.0521266832947731,0.29243165254592896
2023-05-03,298.5945129394531,304.3999938964844,308.6099853515625,304.0899963378906,306.6199951171875,22360800,-0.0033069809140627,295.0139558301065,286.18077021638385,MSFT,Microsoft Corporation,"Microsoft , Snap And 2 Other Stocks Insiders Are Selling - Microsoft ( NASDAQ : MSFT ), Biogen ( NASDAQ : BIIB ) ","['Microsoft , Snap And 2 Other Stocks Insiders Are Selling - Microsoft ( NASDAQ : MSFT ), Biogen ( NASDAQ : BIIB )']",0.9999316930770874,8.667801125739061e-07,6.748263695044443e-05
2023-05-04,299.5852355957031,305.4100036621094,307.760009765625,303.3999938964844,306.239990234375,22519900,0.0033179533223737,296.15677577150564,287.39935797814013,MSFT,Microsoft Corporation,Ukraine becomes seventh jurisdiction to approve Microsoft - Activision merger,['Ukraine becomes seventh jurisdiction to approve Microsoft - Activision merger'],0.9969515800476074,0.001974554266780615,0.00107384764123708
2023-05-05,304.7253112792969,310.6499938964844,311.9700012207031,304.2699890136719,305.7200012207031,28197100,0.0171573064118899,298.29890964845345,288.97444464188163,MSFT,Microsoft Corporation,"Enterprise Content Management System Market Research Report With Growth , Trends And Forecast 2030| | Machine Learning As A Service Market Overview Highlighting Key Drivers And Growth Opportunities By 2030 | Zoho Takes On Apple , Google And Microsoft With Its Privacy - Centred Browser  Ulaa   | Zoho launches Ulaa web browser , unveils AI strategy , Telecom News , ET Telecom | Google Pixel Fold To Unveil On May 10 : Will It Upset Samsung Galaxy Z Fold ? - Microsoft ( NASDAQ : MSFT ), Samsung Electronics Co ( OTC : SSNLF ), Alphabet ( NASDAQ : GOOG ), Alphabet ( NASDAQ : GOOGL ) ","['Enterprise Content Management System Market Research Report With Growth , Trends And Forecast 2030', 'Machine Learning As A Service Market Overview Highlighting Key Drivers And Growth Opportunities By 2030', 'Zoho Takes On Apple , Google And Microsoft With Its Privacy - Centred Browser  Ulaa', 'Zoho launches Ulaa web browser , unveils AI strategy , Telecom News , ET Telecom', 'Google Pixel Fold To Unveil On May 10 : Will It Upset Samsung Galaxy Z Fold ? - Microsoft ( NASDAQ : MSFT ), Samsung Electronics Co ( OTC : SSNLF ), Alphabet ( NASDAQ : GOOG ), Alphabet ( NASDAQ : GOOGL )']",0.8002122640609741,0.19975051283836365,3.7203513784334064e-05
2023-05-08,302.7633972167969,308.6499938964844,310.20001220703125,306.0899963378906,310.1300048828125,21318600,-0.0064383035799142,299.4150315405393,290.2279857850557,MSFT,Microsoft Corporation,"Data Catalog Market Research Study on Revenue , Statistics , Industry Growth , and Demand for 2030","['Data Catalog Market Research Study on Revenue , Statistics , Industry Growth , and Demand for 2030']",0.9999783039093018,1.5207263459160458e-05,6.420482804969652e-06
2023-05-09,301.1448669433594,307.0,310.0400085449219,306.3099975585937,308.0,21340800,-0.0053458584766722,299.8474903912443,291.2204295267197,MSFT,Microsoft Corporation,"Brandessence Market Research And Consulting Private Limited : At CAGR of 14 . 9 %, Game engine market is expected to reach ~$5 . 5 billion by 2025 : Brandessence Market Research | At CAGR of 14 . 9 %, Game engine market is expected to reach ~$5 . 5 billion by 2025 : Brandessence Market Research | Big Data Analytics In Retail Market Value To Surpass USD 25 . 56 Billion By 2028 | Research Report | Microsoft Is Determined To Win The AI Wars As It Threatens Google Online Search Dominance | MDEC and Microsoft fast - track Malaysia aspirations as the Digital Hub of ASEAN","['Brandessence Market Research And Consulting Private Limited : At CAGR of 14 . 9 %, Game engine market is expected to reach ~$5 . 5 billion by 2025 : Brandessence Market Research', 'At CAGR of 14 . 9 %, Game engine market is expected to reach ~$5 . 5 billion by 2025 : Brandessence Market Research', 'Big Data Analytics In Retail Market Value To Surpass USD 25 . 56 Billion By 2028', 'Research Report', 'Microsoft Is Determined To Win The AI Wars As It Threatens Google Online Search Dominance', 'MDEC and Microsoft fast - track Malaysia aspirations as the Digital Hub of ASEAN']",0.4966225326061249,0.34395459294319153,0.15942293405532837
2023-05-10,306.3536071777344,312.3099975585937,313.0,307.6700134277344,308.6199951171875,30078000,0.0172964602958172,301.47401958786685,292.5961729495392,MSFT,Microsoft Corporation,Clickstream Analytics Market Zooms Towards Billion - Dollar Valuation : Estimated to Reach USD 4 . 56 Billion by 2030 : Verified Market ResearchÂ® | Clickstream Analytics Market Zooms Towards Billion - Dollar Valuation : Estimated to Reach USD 4 . 56 Billion by 2030 : Verified Market ResearchÂ® | Mobile Virtualization Market Predicted to Surpass USD 26 Billion at a CAGR of 21 . 30 % by 2030 - Report by Market Research Future ( MRFR )  | Microsoft Makes Another Bet on AI with New Investment | Natural Language Processing Market to be $262 . 4 Billion by 2030 - Exclusive Report by Meticulous ResearchÂ®,"['Clickstream Analytics Market Zooms Towards Billion - Dollar Valuation : Estimated to Reach USD 4 . 56 Billion by 2030 : Verified Market ResearchÂ®', 'Clickstream Analytics Market Zooms Towards Billion - Dollar Valuation : Estimated to Reach USD 4 . 56 Billion by 2030 : Verified Market ResearchÂ®', 'Mobile Virtualization Market Predicted to Surpass USD 26 Billion at a CAGR of 21 . 30 % by 2030 - Report by Market Research Future ( MRFR )', 'Microsoft Makes Another Bet on AI with New Investment', 'Natural Language Processing Market to be $262 . 4 Billion by 2030 - Exclusive Report by Meticulous ResearchÂ®']",0.8295686841011047,0.1672784388065338,0.0031528533436357975
